titlePersian,titleEnglish,genre,CEFR,persian,english
زلزله,Earthquakes,science,A1,زلزله وقتی است که زمین می‌لرزد. گاهی زلزله کوچک است. گاهی زلزله بزرگ است. در زلزله، خانه‌ها و ساختمان‌ها می‌تواند خراب شود. مردم می‌ترسند. بعضی وقت‌ها برق قطع می‌شود. بعد از زلزله، مردم بیرون می‌روند. آن‌ها به هم کمک می‌کنند. زلزله در بعضی کشورها بیشتر است.,"An earthquake is when the ground shakes. Sometimes the earthquake is small. Sometimes the earthquake is big. In an earthquake, houses and buildings can be destroyed. People get scared. Sometimes the electricity goes out. After an earthquake, people go outside. They help each other. Earthquakes are more common in some countries."
غذای سالم,Healthy Eating,health,A1,غذای سالم برای بدن خوب است. ما باید آب زیاد بنوشیم. میوه و سبزی خوب است. نان و برنج هم می‌تواند خوب باشد. گوشت، ماهی، و تخم‌مرغ پروتئین دارند. ما نباید زیاد شیرینی بخوریم. غذای خیلی چرب هم خوب نیست. اگر ما غذای سالم بخوریم، بدن قوی است و حال ما بهتر است.,"Healthy food is good for the body. We should drink a lot of water. Fruit and vegetables are good. Bread and rice can also be good. Meat, fish, and eggs have protein. We should not eat too many sweets. Very fatty food is not good either. If we eat healthy food, the body is strong and we feel better."
شهرِ موردِ علاقه‌ی من,My Favorite City,monologue,A1,من یک شهرِ موردِ علاقه دارم. این شهر بزرگ است، اما آرام است. خیابان‌ها تمیز است. من در این شهر زیاد راه می‌روم. پارک‌های خوب دارد و درخت‌های زیاد دارد. من قهوه را دوست دارم، و در این شهر کافه‌های خوب هست. مردم معمولاً مهربان هستند. در تابستان، هوا خوب است و من کنارِ آب می‌نشینم. من این شهر را خیلی دوست دارم.,"I have a favorite city. This city is big, but calm. The streets are clean. I walk a lot in this city. It has good parks and many trees. I like coffee, and in this city there are good cafés. People are usually kind. In summer, the weather is good and I sit by the water. I like this city a lot.
"
پختنِ کوکی,Baking Cookies,monologue,A1,من می‌خواهم کوکی درست کنم. اول، آرد و شکر را در یک کاسه می‌ریزم. بعد، کره و یک تخم‌مرغ را اضافه می‌کنم. همه را خوب هم می‌زنم. بعد، کمی شکلات یا کشمش می‌ریزم. فر را گرم می‌کنم. خمیر را به شکلِ توپ‌های کوچک درست می‌کنم و روی سینی می‌گذارم. سینی را در فر می‌گذارم. بعد از چند دقیقه، کوکی‌ها آماده است. کوکی‌ها گرم و خوشمزه است.,"I want to make cookies. First, I put flour and sugar in a bowl. Then I add butter and an egg. I mix everything well. Then I add a little chocolate or raisins. I heat the oven. I shape the dough into small balls and put them on a tray. I put the tray in the oven. After a few minutes, the cookies are ready. The cookies are warm and tasty."
نظام‌های سیاسیِ جهان,Political Systems of the World,politics,A1,در جهان، کشورها نظام‌های سیاسیِ مختلف دارند. در بعضی کشورها، مردم رأی می‌دهند و رئیس را انتخاب می‌کنند. این کشورها جمهوری هستند. در بعضی کشورها، یک پادشاه یا یک ملکه هست. این کشورها پادشاهی هستند. در بعضی کشورها، یک حزب قدرتِ زیاد دارد. در بعضی کشورها، قانون‌ها سخت است. در بعضی کشورها، مردم آزادیِ بیشتر دارند. هر کشور تاریخ و فرهنگِ خودش را دارد. به همین دلیل، نظامِ سیاسیِ کشورها فرق دارد.,"In the world, countries have different political systems. In some countries, people vote and choose the president. These countries are republics. In some countries, there is a king or a queen. These countries are monarchies. In some countries, one party has a lot of power. In some countries, the laws are strict. In some countries, people have more freedom. Every country has its own history and culture. For this reason, countries’ political systems are different."
چرا ایران خیلی گرم است؟,Why Is Iran So Hot?,science,A1,ایران یک کشور بزرگ است. در تابستان، هوا در ایران خیلی گرم است. در بعضی جاها، بیابان هست. در بیابان، باران کم است. وقتی باران کم است، زمین خشک است. خورشید در آسمان خیلی قوی است. در جنوب ایران، هوا گرم‌تر است. کنار خلیج فارس، هوا گرم و مرطوب است. در بعضی شهرها، مردم در روز بیرون نمی‌روند. آن‌ها آب زیاد می‌نوشند. شب‌ها هوا بهتر است، اما هنوز گرم است.,"Iran is a big country. In summer, the weather in Iran is very hot. In some places, there is desert. In the desert, there is little rain. When there is little rain, the ground is dry. The sun in the sky is very strong. In southern Iran, the weather is hotter. Near the Persian Gulf, the weather is hot and humid. In some cities, people do not go outside during the day. They drink a lot of water. At night the weather is better, but it is still hot."
کلاسِ من,My Classroom,monologue,A1,کلاسِ من بزرگ است. کلاسِ من در مدرسه است. در کلاسِ من یک تخته هست. یک میزِ معلم هم هست. در کلاسِ من صندلی و میز زیاد است. من روی صندلی می‌نشینم. من کتاب و دفتر دارم. من در کلاس می‌خوانم و می‌نویسم. معلم حرف می‌زند و ما گوش می‌کنیم. من کلاسِ خودم را دوست دارم.,My classroom is big. My classroom is in the school. In my classroom there is a board. There is also a teacher’s desk. In my classroom there are many chairs and desks. I sit on a chair. I have a book and a notebook. In class I read and write. The teacher speaks and we listen. I like my classroom.
خانهٔ من,My Home,monologue,A1,خانهٔ من کوچک است و در شهر است. من در آپارتمان زندگی می‌کنم. خانهٔ من یک اتاق خواب دارد و یک اتاق نشیمن هم دارد. آشپزخانهٔ من کوچک است و در آشپزخانه یک یخچال و یک اجاق هست. در اتاق نشیمن یک مبل و یک میز هست و من روی مبل می‌نشینم. من تلویزیون ندارم. در اتاق خواب یک تخت هست و من شب‌ها روی تخت می‌خوابم. یک حمام هم دارم. من هر روز خانه را مرتب می‌کنم. خانهٔ من تمیز است و من خانهٔ خودم را دوست دارم.,"My home is small and it is in the city. I live in an apartment. My home has one bedroom and it also has a living room. My kitchen is small, and in the kitchen there is a refrigerator and a stove. In the living room there is a sofa and a table, and I sit on the sofa. I do not have a TV. In the bedroom there is a bed, and at night I sleep on the bed. I also have a bathroom. Every day I tidy the home. My home is clean, and I like my home."
شب سال نو در ایران,New Year's Eve in Iran,culture,A1,شب سال نو در ایران مهم است. خیلی از مردم در خانه هستند. خانواده دور هم می‌نشینند. آن‌ها با هم حرف می‌زنند و می‌خندند. بعضی‌ها تلویزیون نگاه می‌کنند. بعضی‌ها چای می‌خورند و شیرینی می‌خورند. در شهر، بعضی‌ها بیرون می‌روند. هوا در بعضی جاها سرد است. در نیمه‌شب، مردم می‌گویند: «سال نو مبارک».,"New Year’s Eve in Iran is important. Many people are at home. The family sits together. They talk and laugh together. Some people watch TV. Some people drink tea and eat sweets. In the city, some people go out. In some places, the weather is cold. At midnight, people say, “Happy New Year.”"
سیاست چیست؟,What is Politics?,politics,A1,سیاست درباره‌ی مردم و قانون است. در سیاست، مردم درباره‌ی کارهای مهم حرف می‌زنند. برای مثال، مردم درباره‌ی مدرسه، بیمارستان، و پول حرف می‌زنند. در یک شهر، شهردار کار می‌کند. در یک کشور، رئیس و دولت کار می‌کنند. دولت قانون می‌گذارد. مردم به قانون نیاز دارند. مردم رأی می‌دهند و یک نفر را انتخاب می‌کنند. گاهی مردم با دولت موافق نیستند. آن‌ها در خیابان حرف می‌زنند و می‌گویند: «نه». سیاست همیشه آسان نیست. اما سیاست برای زندگی مهم است.,"Politics is about people and laws. In politics, people talk about important things. For example, people talk about school, hospitals, and money. In a city, the mayor works. In a country, the president and the government work. The government makes laws. People need laws. People vote and choose a person. Sometimes people do not agree with the government. They talk in the street and say, “No.” Politics is not always easy. But politics is important for life."
واحه در بیابان,Desert Oases,science,A1,بیابان خیلی خشک است. در بیابان، باران کم است. اما گاهی در بیابان آب هست. این جا را واحه می‌گویند. در واحه، چشمه یا چاه هست. کنارِ آب، درخت و گیاه رشد می‌کند. بعضی وقت‌ها نخل هم هست. مردم و حیوان‌ها به واحه می‌آیند تا آب بخورند. واحه برای زندگی در بیابان خیلی مهم است.,"The desert is very dry. In the desert, there is little rain. But sometimes there is water in the desert. This place is called an oasis. In an oasis, there is a spring or a well. Near the water, trees and plants grow. Sometimes there are date palms too. People and animals come to the oasis to drink water. An oasis is very important for life in the desert."
منظومه‌ی شمسی,The Solar System,science,A1,منظومه‌ی شمسی درباره‌ی خورشید و سیاره‌ها است. خورشید خیلی بزرگ و خیلی داغ است. زمین یک سیاره است. ما روی زمین زندگی می‌کنیم. ماه دورِ زمین می‌چرخد. سیاره‌های دیگر هم در آسمان هستند. همه‌ی سیاره‌ها دورِ خورشید می‌چرخند. شب، ما آسمان را می‌بینیم. در آسمان، ستاره‌ها را می‌بینیم. گاهی ماه را هم می‌بینیم.,"The solar system is about the sun and the planets. The sun is very big and very hot. Earth is a planet. We live on Earth. The moon orbits Earth. Other planets are also in the sky. All the planets orbit the sun. At night, we see the sky. In the sky, we see the stars. Sometimes we also see the moon."
هوای امروز,Today's Weather,monologue,A1,امروز هوا خوب است. آسمان کمی ابری است. باد آرام است. هوا سرد نیست، اما گرم هم نیست. صبح کمی باران می‌آید. بعد از ظهر هوا بهتر می‌شود. من یک ژاکت می‌پوشم. من یک چتر هم می‌برم.,"Today the weather is good. The sky is a little cloudy. The wind is calm. It isn’t cold, but it isn’t warm either. In the morning, it rains a little. In the afternoon, the weather gets better. I wear a jacket. I also take an umbrella."
اولین تلاشِ آشپزیِ من,My First Cooking Attempt,monologue,A1,اولین بار که آشپزی کردم، در خانه تنها بودم. من می‌خواستم یک غذای ساده درست کنم. اول برنج را شستم و در قابلمه ریختم و آب اضافه کردم. بعد کمی نمک ریختم و قابلمه را روی گاز گذاشتم. من زیاد نگاه می‌کردم چون می‌ترسیدم برنج بسوزد. بعد از کمی وقت، آب کم شد و برنج نرم شد. من خوشحال شدم و برنج را در بشقاب گذاشتم. آن غذا خیلی ساده بود، اما برای من خیلی خوب بود چون خودم آن را درست کردم.,"The first time I cooked, I was alone at home. I wanted to make a simple meal. First I washed the rice, put it in a pot, and added water. Then I added a little salt and put the pot on the stove. I watched it a lot because I was afraid the rice would burn. After a little while, the water went down and the rice became soft. I was happy and put the rice on a plate. That food was very simple, but for me it was very good because I made it myself."
بازدید از آکواریوم,Visiting an Aquarium,monologue,A1,دیروز من به یک آکواریوم رفتم. من بلیت خریدم و وارد شدم. داخلِ آکواریوم تاریک بود و نورِ آبی داشت. من اول ماهی‌های کوچک را دیدم. آن‌ها سریع شنا می‌کردند و رنگ‌های قشنگ داشتند. بعد من یک کوسه را دیدم. کوسه بزرگ بود و آرام شنا می‌کرد. من هم عروسِ دریایی را دیدم. عروسِ دریایی نرم و سفید بود و آرام حرکت می‌کرد. من کنارِ یک شیشهٔ بزرگ ایستادم و مدتِ زیادی نگاه کردم. آخر، من از آکواریوم بیرون رفتم و خیلی خوشحال بودم.,"Yesterday I went to an aquarium. I bought a ticket and went in. Inside the aquarium it was dark and there was blue light. First I saw small fish. They swam fast and had pretty colors. Then I saw a shark. The shark was big and swam slowly. I also saw a jellyfish. The jellyfish was soft and white and moved slowly. I stood next to a big glass tank and watched for a long time. Finally, I left the aquarium and I was very happy."
بازدید از موزه,Visiting a Museum,monologue,A1,دیروز من به یک موزه رفتم. من بلیت خریدم و وارد شدم. داخلِ موزه آرام بود و مردم آهسته راه می‌رفتند. من اول تابلوهای نقاشی را دیدم. بعضی تابلوها خیلی قدیمی بودند و رنگ‌های زیبا داشتند. بعد من مجسمه‌ها را دیدم. یک مجسمه خیلی بزرگ بود و من از آن عکس گرفتم. در یک اتاق، چیزهای قدیمی مثل سکه و ظرف هم بود. من کنارِ هر چیز کمی می‌ایستادم و نگاه می‌کردم. بعد از یک ساعت، خسته شدم و بیرون رفتم، اما از بازدید خوشحال بودم.,"Yesterday I went to a museum. I bought a ticket and went in. Inside the museum it was quiet and people walked slowly. First I saw paintings. Some paintings were very old and had beautiful colors. Then I saw statues. One statue was very big and I took a photo of it. In one room, there were old things like coins and dishes too. I stopped next to each thing for a little and looked. After one hour, I got tired and went out, but I was happy with the visit."
روزِ اول در کارِ جدید,The First Day at a New Job,monologue,A1,روزِ اول در کارِ جدید برای من مهم است. من صبح زود بیدار می‌شوم و لباسِ تمیز می‌پوشم. بعد صبحانه می‌خورم و از خانه بیرون می‌روم. وقتی به محلِ کار می‌رسم، کمی استرس دارم. من به دفتر می‌روم و به همکاران سلام می‌کنم. یک نفر به من نشان می‌دهد که کجا بنشینم. بعد مدیر با من صحبت می‌کند و کارهای ساده را توضیح می‌دهد. من گوش می‌دهم و سؤال‌های کوتاه می‌پرسم. در پایانِ روز، من خسته هستم، اما خوشحال هستم چون روزِ اول تمام شد.,"The first day at a new job is important for me. I wake up early in the morning and put on clean clothes. Then I eat breakfast and leave the house. When I arrive at work, I feel a little stressed. I go to the office and say hello to my coworkers. Someone shows me where to sit. Then the manager talks with me and explains simple tasks. I listen and ask short questions. At the end of the day, I am tired, but I am happy because the first day is over."
سرگرمیِ موردِ علاقهٔ من,My Favorite Hobby,monologue,A1,سرگرمیِ موردِ علاقهٔ من آشپزی است. من دوست دارم در خانه غذا درست کنم. من معمولاً برنج و مرغ می‌پزم و گاهی سوپ درست می‌کنم. من سبزی‌ها را می‌شویم و خرد می‌کنم و بعد با غذا می‌پزم. آشپزی برای من آرامش دارد و بویِ غذا در خانه خوب است. وقتی وقت دارم، یک غذای جدید هم امتحان می‌کنم. بعد از آشپزی، من از خوردنِ غذای خودم خوشحال می‌شوم.,"My favorite hobby is cooking. I like to make food at home. I usually cook rice and chicken, and sometimes I make soup. I wash vegetables and chop them, and then I cook them with the food. Cooking is relaxing for me, and the smell of food at home is nice. When I have time, I also try a new dish. After cooking, I feel happy eating my own food."
غذایِ موردِ علاقهٔ من,My Favorite Food,monologue,A1,غذایِ موردِ علاقهٔ من مرغ است. من مرغ را خیلی دوست دارم چون خوشمزه است و سیرم می‌کند. من معمولاً مرغ را در ماهیتابه می‌پزم و کمی نمک و فلفل می‌زنم. گاهی با مرغ برنج می‌خورم و گاهی با سیب‌زمینی. وقتی خسته هستم، مرغِ ساده درست می‌کنم چون سریع آماده می‌شود. من دوست دارم مرغ را با پیاز هم بپزم چون بویِ خوبی دارد. برای من، مرغ بهترین غذا است و همیشه از آن لذت می‌برم.,"My favorite food is chicken. I really like chicken because it is tasty and it makes me feel full. I usually cook chicken in a pan and add a little salt and pepper. Sometimes I eat rice with chicken and sometimes potatoes. When I am tired, I make simple chicken because it gets ready quickly. I also like to cook chicken with onion because it smells good. For me, chicken is the best food, and I always enjoy it."
قارچ,Mushrooms,food,A1,قارچ یک غذا است و در جنگل یا مزرعه رشد می‌کند. قارچ مثلِ گیاه نیست و دانه ندارد. قارچ از خاک و چیزهای قدیمیِ زمین غذا می‌گیرد و آب زیادی دارد. بعضی قارچ‌ها سمی هستند، پس قارچِ فروشگاه برای خوردن امن‌تر است. قارچ را می‌شویند و خرد می‌کنند و با پیاز در ماهیتابه می‌پزند. قارچ با تخم‌مرغ و برنج هم خوب است. قارچ کمی پروتئین و ویتامین دارد و وقتی پخته می‌شود بویِ خوب می‌دهد.,"Mushrooms are a food and they grow in a forest or on a farm. Mushrooms are not like plants and they do not have seeds. Mushrooms take food from the soil and old things in the ground, and they have a lot of water. Some mushrooms are poisonous, so store-bought mushrooms are safer to eat. Mushrooms are washed and chopped and cooked with onion in a pan. Mushrooms are also good with eggs and rice. Mushrooms have a little protein and vitamins, and when they are cooked they smell good."
محلهٔ من,My Neighborhood,monologue,A1,محلهٔ من آرام است. در محلهٔ من خانه‌ها و آپارتمان‌ها زیاد است. نزدیکِ خانهٔ من یک فروشگاه هست و من گاهی برای خرید آنجا می‌روم. در محلهٔ من یک پارک هم هست و مردم آنجا راه می‌روند. صبح‌ها من آدم‌های زیادی را می‌بینم که به کار می‌روند. بعضی وقت‌ها بچه‌ها در خیابان بازی می‌کنند. من این محله را دوست دارم چون امن است و رفت‌وآمد آسان است. وقتی هوا خوب است، من در محله قدم می‌زنم و از اطراف لذت می‌برم.,"My neighborhood is quiet. In my neighborhood there are many houses and apartments. Near my home there is a store and sometimes I go there to shop. In my neighborhood there is also a park and people walk there. In the mornings I see many people going to work. Sometimes children play in the street. I like this neighborhood because it is safe and getting around is easy. When the weather is good, I walk in the neighborhood and enjoy the surroundings."
حیواناتِ خانگیِ من,My Pets,monologue,A1,من دو حیوانِ خانگی دارم. یکی یک گربه است و یکی یک سگ است. گربهٔ من کوچک و آرام است و خیلی می‌خوابد. سگِ من بازیگوش است و هر روز دوست دارد بیرون برود. من هر روز به آن‌ها آب و غذا می‌دهم. گاهی با سگِ من در پارک قدم می‌زنم. گربهٔ من دوست دارد کنارِ من بنشیند و نوازش شود. من حیواناتِ خانگیِ خودم را خیلی دوست دارم چون خانه را شاد می‌کنند.,I have two pets. One is a cat and one is a dog. My cat is small and calm and sleeps a lot. My dog is playful and every day it likes to go outside. Every day I give them water and food. Sometimes I walk with my dog in the park. My cat likes to sit next to me and be petted. I really like my pets because they make the home happy.
رفت‌وآمدِ صبحِ من,My Morning Commute,monologue,A1,هر صبح من از خانه بیرون می‌روم و به محلِ کار می‌روم. من صبح زود بیدار می‌شوم و بعد قهوه می‌خورم. بعد لباس می‌پوشم و کیفم را برمی‌دارم. من معمولاً با مترو می‌روم. من به ایستگاه می‌روم و منتظر می‌مانم. وقتی مترو می‌آید، سوار می‌شوم و می‌نشینم. در راه، مردم را می‌بینم و گاهی موسیقی گوش می‌کنم. بعد در ایستگاهِ نزدیکِ محلِ کار پیاده می‌شوم و کمی پیاده‌روی می‌کنم. وقتی به محلِ کار می‌رسم، روزِ من شروع می‌شود.,"Every morning I leave home and go to work. I wake up early and then I drink coffee. Then I get dressed and take my bag. I usually go by metro. I go to the station and wait. When the metro comes, I get on and sit down. On the way, I see people and sometimes I listen to music. Then I get off at the station near work and walk a little. When I arrive at work, my day begins."
بستنِ چمدان برای سفر,Packing for a Vacation,monologue,A1,وقتی می‌خواهم به سفر بروم، من یک چمدان می‌آورم و آن را روی زمین می‌گذارم. اول لباس‌ها را آماده می‌کنم. من چند تی‌شرت، یک شلوار، جوراب، و لباسِ زیر برمی‌دارم. اگر هوا سرد باشد، یک ژاکت هم می‌گذارم. بعد مسواک و خمیرِ دندان و شامپو را در یک کیفِ کوچک می‌گذارم. من گوشی و شارژر را هم برمی‌دارم چون لازم است. من پاسپورت و پول را در جایِ امن می‌گذارم. آخر، چمدان را می‌بندم و مطمئن می‌شوم همه چیز آماده است.,"When I want to go on vacation, I bring a suitcase and put it on the floor. First I prepare my clothes. I take a few T-shirts, one pair of pants, socks, and underwear. If the weather is cold, I also pack a jacket. Then I put my toothbrush, toothpaste, and shampoo in a small bag. I also take my phone and charger because they are necessary. I put my passport and money in a safe place. Finally, I close the suitcase and make sure everything is ready."
