English,CEFR,gender,word,wordAudio,pronunciation,definition,sentenceAudio,example,sentenceTranslation,To Delete,Duplicate?
"toward, towards",A2,preposition,به سمت,X,beh samt,حرف اضافه برای جهت,X,من به سمت خانه می‌روم.,I am going toward home.,,
use,B2,verb,به کار بردن,X,be kâr bordan,به کار گرفتنِ چیزی برای هدف,X,برای توضیح این مفهوم، بهتر است یک مثال ساده به کار ببریم.,"To explain this concept, it’s better to use a simple example.",,
"rarely, seldom",B2,adverb,به ندرت,X,be nodrat,در دفعاتِ بسیار کم و به سختی,X,در این اقلیم کویری، به ندرت باران می‌بارد.,"In this desert climate, it rarely rains.",,
"spring, springtime",A1,noun,بهار,X,bahâr,فصلِ بعد از زمستان,X,در بهار گل‌ها می‌آیند.,"In spring, flowers come out.",,
accusation,C,noun,بهتان,X,bohtân,نسبت دادنِ تهمتِ سنگین به کسی,X,بهتان وقتی پخش شود، حتی تکذیب هم اثرِ اول را پاک نمی‌کند.,"When an accusation spreads, even a denial does not erase the first effect.",,
accuse,C,verb,بهتان زدن,X,bohtân zadan,به کسی تهمتِ سنگین زدن,X,اگر بی‌دلیل به کسی بهتان بزنی، اعتمادِ جمع به‌سادگی برنمی‌گردد.,"If you accuse someone without reason, the group’s trust does not easily return.",,
best,A2,adjective,بهترین,X,behtarin,از همه بهتر,X,این بهترین کافه در این خیابان است.,This is the best café on this street.,,
smell,A2,noun,بو,X,bu,چیزی که با بینی آن را احساس و درک می‌کنیم,X,از بوی سوختگی فهمیدم که غذا روی گاز سوخته است.,"From the smell of burning, I realized the food had burnt on the stove.",,
budget,B2,noun,بودجه,X,budje,کلِ پولِ اختصاصی برای یک طرح,X,دولت برای سال آینده، بودجه ویژه‌ای را به بخش آموزش اختصاص داده است.,The government has allocated a special budget for the education sector for next year.,,
be,A1,verb,بودن,X,budan,وجود داشتن,X,بودن در خانه برای من خوب است.,Being at home is good for me.,,
kiss,A2,noun,بوسه,X,buse,تماسِ لب با لب برای محبت,X,یک بوسه روی گونه‌اش داد.,He gave her a kiss on the cheek.,,
kiss,A2,verb,بوسیدن,X,busidan,لب را روی صورت یا لبِ کسی گذاشتن,X,من بچه را بوسیدم.,I kissed the child.,,
desert,B1,noun,بیابان,X,biyâbân,زمینِ خشک و کم‌آب,X,در بیابان پیدا کردن آب سخت است و آدم باید همیشه آماده باشد.,"In the desert, finding water is hard, and you always have to be prepared.",,
disrespectful,B2,adjective,بی‌احترامی,X,bi-ehtarâmi,بی‌احترام,X,رفتار بی‌احترامی او باعث شد چند نفر جلسه را ترک کنند.,His disrespectful behavior made a few people leave the meeting.,,
awake,A1,adjective,بیدار,X,bidâr,در حالِ خواب نبودن,X,من صبح زود بیدار می‌شوم.,I wake up early in the morning.,,
"wake up, awaken",A2,verb,بیدار شدن,X,bidâr šodan,از خواب بیرون آمدن,X,من ساعت شش بیدار شدم.,I woke up at six o’clock.,,
wake up,A2,verb,بیدار کردن,X,bidâr kardan,کسی را از خواب بیرون آوردن,X,مادر من مرا بیدار کرد.,My mother woke me up.,,
non-religious,B2,adjective,بی‌دین,X,bi-din,بدون دین,X,او خودش را بی‌دین می‌داند، اما می‌گوید اخلاق برایش جدی‌تر از هر برچسبی است.,"He considers himself non-religious, but says morality matters to him more than any label.",,
"colorless, colourless",B1,adjective,بی‌رنگ,X,bi-rang,بدون رنگ,X,او رنگِ بی‌رنگ را برای دیوار انتخاب کرد چون سلیقه‌اش ساده است.,He chose a colorless color for the wall because his taste is simple.,,
colorlessness,B2,noun,بی‌رنگی,X,bi-rangi,حالتِ بی‌رنگ بودن,X,بی‌رنگیِ اتاق حس سردی می‌داد، برای همین چند تابلو به دیوار زدند.,"The room’s colorlessness felt cold, so they put a few pictures on the wall.",,
"outer, external",B1,adjective,بیرونی,X,biruni,مربوط به بیرون,X,دیوارهای بیرونی ساختمان تازه رنگ شده‌اند.,The outer walls of the building have been freshly painted.,,
twenty,A1,numeral,بیست,X,bist,عدد ۲۰,X,بیست یعنی دو تا ده.,Twenty means two tens.,,
twentieth,A2,adjective,بیستم,X,bistom,شمارهٔ بیست در ترتیب,X,امروز بیستم ماه است.,Today is the twentieth of the month.,,
more,A1,adjective,بیشتر,X,bištar,به مقدارِ بیشتر,X,لطفاً کمی بیشتر آب بده.,Please give a little more water.,,
"grove, forest, wood, jungle",C,noun,بیشه,X,biše,منطقه‌ای پوشیده از درختان درهم‌تنیده,X,پلنگ در میان گیاهان درهم‌تنیده‌ی بیشه ناپدید گشت.,The leopard disappeared into the tangled vegetation of the grove.,,
bacon,A2,noun,بیکن,X,beyken,گوشتِ خوکِ نمکی یا دودی,X,من بیکن نمی‌خورم.,I don’t eat bacon.,,
"foreign, alien",B1,adjective,بیگانه,X,bigâne,ناآشنا و از جای دیگر,X,او در این شهر احساس بیگانه بودن می‌کرد، چون هیچ‌کس را نمی‌شناخت.,"In this city he felt like a stranger, because he didn’t know anyone.",,
innocent,B1,adjective,بی‌گُناه,X,bi-gonâh,بدون تقصیر,X,او بی‌گُناه بود، اما کسی حرفش را باور نکرد.,"He was innocent, but nobody believed what he said.",,
"sick, ill",A2,adjective,بیمار,X,bimâr,دارای حالِ بد و تب یا درد,X,پدرم بیمار است.,My father is sick.,,
hospital,A2,noun,بیمارستان,X,bimârestân,جایی برای درمان,X,بیمارستان بزرگ و تمیز است.,The hospital is big and clean.,,
"sickness, illness, disease",A2,noun,بیماری,X,bimâri,حالِ بدِ بدن,X,او یک بیماری دارد و باید استراحت کند.,He has an illness and needs to rest.,,
insurance,B1,noun,بیمه,X,bime,قراردادی برای دریافتِ پول هنگامِ خسارت,X,شرکت بیمه تمام خسارت تصادف ماشین را پرداخت کرد.,The insurance company paid all the damages for the car accident.,,
between,A1,preposition,بین,X,beyn,برای قرار گرفتن در وسطِ دو چیز,X,تو بین من و بابا نشسته‌ای.,You are sitting between me and Dad.,,
international,B2,adjective,بین‌المللی,X,beyno-l-melali,مربوط به چند کشور,X,این کنفرانس بین‌المللی است و از چند کشور مهمان دارد.,This conference is international and has guests from several countries.,,
nose,A1,noun,بینی,X,bini,عضوی روی صورت برای نفس کشیدن و بو کردن,X,بینی من در سرما سرد می‌شود.,My nose gets cold in the cold weather.,,
biology,B2,noun,بیولوژی,X,biyoloži,درسِ مربوط به موجودات زنده,X,در کلاس بیولوژی دربارهٔ سلول و ژن صحبت کردیم.,In biology class we talked about cells and genes.,,Duplicate
"leg, foot",A1,noun,پا,X,pâ,عضوی برای راه رفتن,X,پاهایم بعد از راه رفتن خسته است.,My legs are tired after walking.,,
king,B1,noun,پادشاه,X,pâdešâh,پادشاهِ یک کشور,X,پادشاه قول داد مالیات را کم کند، ولی بعد نظرش عوض شد.,"The king promised to lower taxes, but then he changed his mind.",,
kingdom,B1,noun,پادشاهی,X,pâdešâhi,نظامِ پادشاهی,X,در آن زمان کشور یک پادشاهی بود.,At that time the country was a kingdom.,,
Persia,B1,noun,پارس,X,pârs,نامِ قدیمیِ ایران,X,در کتاب تاریخ خواندم که پارس در دوره‌های مختلف نام‌های دیگری هم داشته است.,In a history book I read that Persia has had other names in different periods too.,,
park,A1,noun,پارک,X,pârk,جایی سبز برای تفریح و بازیِ بچه‌ها,X,من هر روز در پارک پیاده‌روی می‌کنم.,I walk in the park every day.,,
passport,A2,noun,پاسپورت,X,pâsport,دفترچه قانونی برای سفر,X,من برای سفر به خارج از کشور به پاسپورت نیاز دارم.,I need a passport to travel abroad.,,
pasta,A1,noun,پاستا,X,pâstâ,غذای رشته‌ای که از آرد درست می‌شود و در آب پخته می‌شود,X,پاستا را با چنگال می‌خورم.,I eat pasta with a fork.,,
"answer, response, reply",A2,noun,پاسخ,X,pâsox,جواب برای سؤال,X,جواب تو را می‌خواهم، نه سکوت.,"I want your answer, not silence.",,
"answer, respond, reply",A2,verb,پاسخ دادن,X,pâsox dâdan,جواب دادن به سؤال,X,لطفاً به سؤال من پاسخ بده.,Please answer my question.,,Duplicate
"clean, pure",A2,adjective,پاک,X,pâk,تمیز و بدون آلودگی,X,لطفاً آب پاک بنوش.,Please drink clean water.,,
eraser,A1,noun,پاک‌کن,X,pâk-kon,چیزی برای پاک کردن نوشتهٔ مداد,X,با پاک‌کن اشتباه را پاک می‌کنم.,I erase the mistake with an eraser.,,
fifteen,A1,numeral,پانزده,X,pânzdah,عدد ۱۵,X,پانزده یعنی ده و پنج.,Fifteen means ten and five.,,
end,A2,noun,پایان,X,pâyân,آخرِ یک چیز,X,این پایان داستان است.,This is the end of the story.,,
"capital city, capital",A2,noun,پایتخت,X,pâytaxt,شهرِ اصلیِ یک کشور,X,تهران پایتخت ایران است.,Tehran is the capital of Iran.,,
"autumn, fall",A1,noun,پاییز,X,pâyiz,فصل بعد از تابستان و قبل از زمستان,X,در پاییز هوا سرد می‌شود.,"In autumn, the weather gets cold.",,
blanket,A2,noun,پتو,X,patu,پوششی گرم هنگام خواب,X,هوا سرد است، لطفا روی من پتو بینداز.,"It is cold, please throw a blanket over me.",,
"cook, bake",A2,verb,پختن,X,poxtan,غذا را با گرما آماده کردن,X,امشب برای خانواده‌ام غذا می‌پزم.,Tonight I cook food for my family.,,
father,A1,noun,پدر,X,pedar,مردی که فرزند دارد,X,پدر من در تهران است.,My father is in Tehran.,,
grandfather,A1,noun,پدربزرگ,X,pedar-bozorg,پدرِ پدر یا پدرِ مادر,X,پدربزرگ من عینک دارد.,My grandfather has glasses.,,
Portugal,A2,noun,پرتغال,X,portoġâl,کشوری در اروپا,X,پرتغال کنار اقیانوس است.,Portugal is by the ocean.,,
orange,A1,noun,پرتقال,X,porteqâl,میوه‌ای گرد و نارنجی‌رنگ با پوست,X,پرتقال را پوست می‌کنم و می‌خورم.,I peel the orange and eat it.,,
flag,A2,noun,پرچم,X,parčam,چیزی که رنگِ کشور دارد,X,پرچم کشور روی ساختمان است.,The country’s flag is on the building.,,
payment,B1,noun,پرداخت,X,pardâxt,دادنِ پول برای خرید,X,پرداختِ آنلاین برای من راحت‌تر است.,Online payment is more convenient for me.,,
curtain,A2,noun,پرده,X,parde,پارچه‌ای که برای پوشاندنِ پنجره می‌آویزند,X,پرده را بکش تا نور شدید خورشید چشمم را اذیت نکند.,Pull the curtain so the strong sunlight doesn't bother my eyes.,,
worship,B2,verb,پرستیدن,X,parastidan,پرستش کردنِ یک موجود مقدس,X,بعضی‌ها به جای پرستیدن خدا، پول یا قدرت را پرستیدن می‌کنند، بی‌آنکه متوجه باشند.,"Some people, instead of worshipping God, worship money or power without realizing it.",,
ask,A2,verb,پرسیدن,X,porsidan,سؤال کردن برای فهمیدن,X,می‌توانم یک سؤال بپرسم؟,May I ask a question?,,
bird,A1,noun,پرنده,X,parande,جانوری که پر دارد و پرواز می‌کند,X,پرنده روی درخت است.,The bird is on the tree.,,
flight,A2,noun,پرواز,X,parvâz,سفر با هواپیما,X,پروازِ ما ساعت هشت است.,Our flight is at eight o’clock.,,
fly,A2,verb,پرواز کردن,X,parvâz kardan,با هواپیما در آسمان رفتن,X,هواپیما از فرودگاه پرواز کرد.,The airplane took off from the airport.,,
jump,A2,verb,پریدن,X,paridan,با پا از زمین جدا شدن,X,بچه‌ها در حیاط می‌پرند.,The children jump in the yard.,,
"doctor, physician",A2,noun,پزشک,X,pezešk,کسی که بیمار را درمان می‌کند,X,پزشک گفت که باید بیشتر بخوابم.,The doctor said I should sleep more.,,
medicine,B1,noun,پزشکی,X,pezeški,شاخه‌ای مربوط به درمان و دارو,X,در دانشگاه، پزشکی می‌خواند تا بتواند به مردم کمک کند.,"At university, he studies medicine so he can help people.",,
"so, therefore",A2,conjunction,پس,X,pas,برای نتیجه گرفتن,X,هوا سرد بود، پس خانه ماندم.,"It was cold, so I stayed home.",,
"mail, post",A2,noun,پست,X,post,نامه‌ها و بسته‌ها,X,من بسته را با پست فرستادم.,I sent the package by post.,,
"boy, son",A1,noun,پسر,X,pesar,پسرِ یک خانواده,X,این پسر کوچک گریه می‌کند.,This little boy is crying.,,
behind,A1,preposition,پشت,X,pošt-e,در قسمتِ عقبِ یک چیز,X,کفش پشت در است.,The shoes are behind the door.,,
support,B2,noun,پشتیبانی,X,poštibâni,کمکِ فنی یا مالی برای ادامهٔ کار,X,برای راه‌اندازیِ این سامانه، پشتیبانیِ فنی لازم است.,"To launch this system, technical support is necessary.",,
support,B2,verb,پشتیبانی کردن,X,poštibâni kardan,کمکِ فنی یا مالی کردن برای ادامهٔ کار,X,شرکت باید از مشتری‌ها پشتیبانی کند، نه این‌که آن‌ها را سرگردان بگذارد.,"The company should support customers, not leave them stranded.",,
wool,B1,noun,پشم,X,pašm,موی بدنِ گوسفند,X,این پلیور خیلی گرم است چون از پشم گوسفند بافته شده است.,This sweater is very warm because it is made of sheep's wool.,,
bridge,A1,noun,پل,X,pol,ساختاری روی رودخانه برای عبور,X,پل روی جاده است و ماشین‌ها از آن می‌گذرند.,The bridge is on the road and cars pass over it.,,
"stair, step",A2,noun,پله,X,pelle,هر یک از سطوحِ سنگی یا چوبی برای بالا رفتن,X,آسانسور شلوغ است، پس ترجیح می‌دهم از پلهها بالا بروم.,"The elevator is crowded, so I prefer to go up the stairs.",,
police,A2,noun,پلیس‎,X,polis,نیرویِ نگهبانیِ شهر,X,پلیس در خیابان ایستاده است.,The police are standing on the street.,,
sweater,A2,noun,پلیور,X,poliver,لباسِ گرم برای بالا تنه,X,این پلیور گرم است.,This sweater is warm.,,
refugee,B2,noun,پناهنده,X,panâhande,پناهجویِ گریخته از جنگ,X,هزاران پناهنده به دلیل جنگ داخلی مجبور به ترک خانه و دیار خود شدند.,Thousands of refugees were forced to flee their homes and lands due to the civil war.,,
cotton,B1,noun,پنبه,X,panbe,گیاه نرم برای تولید پارچه,X,پیراهن‌های تولید شده از پنبه برای فصل تابستان بسیار خنک هستند.,Shirts made of cotton are very cool for the summer.,,
five,A1,numeral,پنج,X,panj,عدد ۵,X,پنج یعنی دو و سه.,Five means two and three.,,
fifty,A1,numeral,پنجاه,X,panjâh,عدد ۵۰,X,پنجاه یعنی پنج تا ده.,Fifty means five tens.,,
window,A1,noun,پنجره,X,panjare,چارچوبی در دیوار که شیشه دارد و نور می‌آورد,X,پنجره باز است.,The window is open.,,
Thursday,A1,noun,پنجشنبه,X,panj-šanbe,روز پنجمِ هفته در تقویمِ ایرانی,X,پنجشنبه کلاس ندارم.,On Thursday I don’t have class.,,
cheese,A1,noun,پنیر,X,panir,خوراکی سفید که از شیر درست می‌شود,X,پنیر را روی پیتزا می‌ریزم.,I put cheese on the pizza.,,
"wide, broad",A2,adjective,پهن,X,pahn,چیزی که عرض و فاصله‌ی دو طرفِ آن زیاد است,X,این میز خیلی پهن است و از درِ کوچک اتاق رد نمی‌شود.,This table is very wide and won't pass through the small room door.,,
"wear, dress, put on",A1,verb,پوشیدن,X,pušidan,تن کردن لباس,X,من کلاه می‌پوشم.,I wear a hat.,,
money,A1,noun,پول,X,pul,اسکناس یا فلزی که برای خریدِ کالا به کار می‌رود,X,من پول دارم.,I have money.,,
pedestrian,A2,adjective,پیاده,X,piyâde,مربوط به راه رفتن,X,من پیاده به خانه رفتم.,I walked home.,,
pizza,A1,noun,پیتزا,X,pitzâ,غذای گرد با پنیر و سس که در فر پخته می‌شود,X,پیتزا را با چاقو می‌بُرم.,I cut the pizza with a knife.,,
screw,B1,noun,پیچ,X,pič,قطعه فلزیِ چرخشی,X,این صندلی لرزان است چون یکی از پیچ‌های آن باز شده است.,This chair is wobbly because one of its screws is loose.,,
screwdriver,B1,noun,پیچ‌گوشتی,X,pič-gušti,ابزارِ چرخاندنِ پیچ,X,برای باز کردن این پیچِ چهارسو، به یک پیچ‌گوشتی نیاز دارم.,I need a screwdriver to loosen this square screw.,,
"find, discover",A2,verb,پیدا کردن,X,peydâ kardan,چیزی را پیدا کردن بعد از گم شدن,X,کلیدم را در کیفم پیدا کردم.,I found my key in my bag.,,
old,A2,adjective,پیر,X,pir,دارای سنِ زیاد,X,پیرمرد لبخند زد.,The old man smiled.,,
shirt,A1,noun,پیراهن,X,pirâhan,لباس برای بالاتنه,X,پیراهن من تمیز است چون آن را شستم.,My shirt is clean because I washed it.,,
progress,B1,noun,پیشرفت,X,pišraft,حرکت به سمتِ جلو و بهتر شدن,X,او در یادگیری زبان فارسی پیشرفت خوبی داشته است.,He has made good progress in learning Persian.,,
"offer, suggestion",B1,noun,پیشنهاد,X,pišnehâd,بیانِ یک طرح یا فکر,X,مدیر شرکت پیشنهاد خوبی برای افزایش حقوق به کارمندان داد.,The company manager made a good offer to increase the salary of the employees.,,
message,A2,noun,"پیغام, پیام",X,payġâm,خبری که به صورتِ کلامی یا متنی برای کسی می‌فرستیم,X,او جواب تلفن را نداد، پس برایش یک پیام کوتاه فرستادم.,"He didn't answer the phone, so I sent him a short message.",,
join,B2,verb,پیوستن,X,peyvastan,ملحق شدن به یک گروه یا سازمان,X,او پس از فارغ‌التحصیلی به ارتش پیوست.,"After graduating, he joined the army.",,
link,B2,noun,پیوند,X,peyvand,اتصالِ عمیق یا رابطه‌ی میانِ دو چیز,X,محققان به دنبال کشف پیوند ژنتیکی بین این دو بیماری هستند.,Researchers are looking for a genetic link between the two diseases.,,
"influence, impression, effect",B2,noun,تأثیر,X,ta'sir,چیزی که نظر یا نتیجه را عوض می‌کند,X,این تجربه روی نگاهِ من به زندگی تأثیرِ عمیقی گذاشت.,This experience had a deep effect on my outlook on life.,,
"theater, theatre",A2,noun,تئاتر,X,te'âtr,جایی برای دیدن نمایش,X,امشب به تئاتر می‌رویم.,Tonight we are going to the theater.,,
theocracy,B2,noun,تئوکراسی,X,te'okrâsi,حکومتی که قدرت سیاسی در دست نهاد دینی است,X,در تئوکراسی، قانون‌گذاری به شکل مستقیم به نهاد دینی گره می‌خورد.,"In a theocracy, lawmaking is directly tied to a religious institution.",,
"until, up to",A2,preposition,تا,X,tâ,حرف اضافه برای زمانِ آخر,X,من تا فردا در تهران می‌مانم.,I’m staying in Tehran until tomorrow.,,
"summer, summertime",A1,noun,تابستان,X,tâbestân,فصل بعد از بهار و قبل از پاییز,X,تابستان برای شنا خوب است.,Summer is good for swimming.,,
crown,B1,noun,تاج,X,tâj,چیزی که روی سرِ پادشاه است,X,روی تاجِ پادشاه سنگ‌های قیمتی بود.,There were precious stones on the king’s crown.,,
"date, history",A2,noun,تاریخ,X,târix,رویدادهای گذشته یا روز و ماه,X,تاریخ این نامه را نگاه کن.,Look at the date of this letter.,,
date of birth,A1,noun,تاریخ تولد,X,târix-e tavallod,روزی که یک نفر به دنیا آمده است,X,تاریخ تولد من روی کارت است.,My date of birth is on the card.,,
dark,A1,adjective,تاریک,X,târik,مکانی که نوری در آن نیست و چشم نمی‌بیند,X,اتاق تاریک است.,The room is dark.,,
darkness,B1,noun,تاریکی,X,târiki,وضعیتی که به دلیلِ نبودنِ نور ایجاد می‌شود,X,چراغ‌ها ناگهان خاموش شدند و تمام خانه در تاریکی مطلق فرو رفت، طوری که حتی دستم را هم نمی‌دیدم.,"The lights suddenly turned off and the whole house plunged into absolute darkness, such that I couldn't even see my hand.",,
just,A2,adverb,تازه,X,tâze,به همین تازگی,X,من تازه رسیدم.,I just arrived.,,
fresh,A2,adjective,تازه,X,tâze,نو و تازه از بازار,X,این نان تازه است.,This bread is fresh.,,
taxi,A1,noun,تاکسی,X,tâksi,ماشینِ کرایه‌ای برای رفتن,X,وقتی دیر است، تاکسی می‌گیرم.,"When it’s late, I take a taxi.",,
congratulate,A2,verb,تبریک گفتن,X,tabrik goftan,گفتنِ جمله برای شادیِ یک نفر,X,برای تولدت به تو تبریک می‌گویم.,I congratulate you on your birthday.,,
discrimination,B2,noun,تبعیض,X,tab'iz,تفاوت گذاشتنِ ناعادلانه,X,مبارزه با تبعیض نژادی و جنسیتی یکی از اهداف اصلی سازمان‌های حقوق بشری است.,Fighting racial and gender discrimination is one of the main goals of human rights organizations.,,
"commerce, trade",B1,noun,تجارت,X,tejârat,دادوستدِ کالا,X,تجارت بین دو کشور در این سال‌ها بیشتر شده است.,Trade between the two countries has increased in recent years.,,
trade,B2,verb,تجارت کردن,X,tejârat kardan,دادوستد انجام دادن,X,او سال‌هاست با کشورهای همسایه تجارت می‌کند.,He has been trading with neighboring countries for years.,,
"experience, experiment",B1,noun,تجربه,X,tajrobe,اتفاق یا کارِ انجام‌شده برای یادگیری,X,این تجربه به من یاد داد تنها تصمیم نگیرم.,This experience taught me not to decide alone.,,
"experience, experiment",B1,verb,تجربه کردن,X,tajrobe kardan,چیزی را خودت انجام دادن و یاد گرفتن,X,من این کار را برای اولین بار تجربه کردم.,I experienced this for the first time.,,
bed,A1,noun,تخت,X,taxt,جایی برای خوابیدن,X,تخت در اتاق خواب است.,The bed is in the bedroom.,,
"discount, sale",A2,noun,تخفیف,X,taxfif,کم کردنِ قیمتِ کالا,X,چون امروز روز جمعه است، این فروشگاه تخفیف خوبی می‌دهد.,"Since today is Friday, this store is giving a good discount.",,
egg,A1,noun,تخم مرغ,X,toxm-e morġ,غذایی که از مرغ به دست می‌آید و برای صبحانه هم خورده می‌شود,X,تخم مرغ را برای صبحانه می‌پزم.,I cook eggs for breakfast.,,
translation,A2,noun,ترجمه,X,tarjome,نوشتنِ معنی از یک زبان به زبان دیگر,X,من ترجمه فارسی را دوست دارم.,I like the Persian translation.,,
fear,B1,noun,ترس,X,tars,احساسِ ناخوشایند هنگامِ روبرو شدن با خطر,X,او از ارتفاع ترس دارد و هرگز حاضر نمی‌شود به بالای برج‌های بلند یا کوه‌های نوک‌تیز برود.,He has a fear of heights and never agrees to go to the top of tall towers or sharp mountains.,,
sour,A2,adjective,ترش,X,torš,دارای مزهٔ لیمو,X,این لیمو ترش است.,This lemon is sour.,,
sourness,A2,noun,ترشی,X,torši,مزهٔ ترش در غذا,X,من ترشی دوست دارم.,I like pickles.,,
