English,CEFR,gender,word,wordAudio,pronunciation,sentenceAudio,example,sentenceTranslation,
eight,A1,numeral,هشت,X,hašt,X,من هشت کتاب دارم.,I have eight books.,
eighteen,A1,numeral,هجده,X,hejdah,X,من هجده سالم است.,I am eighteen years old.,
eighty,A1,numeral,هشتاد,X,haštâd,X,هشتاد نفر اینجا هستند.,Eighty people are here.,
electric toothbrush,A2,noun,مسواک برقی,X,mesvâk-e barqi,X,من از مسواک برقی استفاده می‌کنم.,I use an electric toothbrush.,
elephant,A1,noun,فیل,X,fil,X,فیل بزرگ است.,The elephant is big.,
eleven,A1,numeral,یازده,X,yâzdah,X,من یازده سالم است.,I am eleven years old.,
email,A1,noun,ایمیل,X,imeyl,X,من یک ایمیل دارم.,I have an email.,
empty,A1,adjective,خالی,X,xâli,,,,
end,A2,noun,پایان,X,pâyân,,,,
English,A1,noun,انگلیسی,X,engelisi,X,من انگلیسی یاد می‌گیرم.,I am learning English.,
English,A1,adjective,انگلیسی,X,englisi,X,او انگلیسی است.,He is English.,
eraser,A1,noun,پاک‌کن,X,pâk-kon,X,این پاک‌کن است.,This is an eraser.,
Estonian,B2,adjective,استونیایی,X,estuniyâyi,,,,
Europe,A1,noun,اروپا,X,orupâ,X,اروپا بزرگ است.,Europe is big.,
European,A2,adjective,اروپایی,X,orupâyi,,,,
"every, each",A1,adjective,هر,X,har,X,هر روز می‌خوانم.,I read every day.,
"everyone, everybody",A1,pronoun,همه,X,hame,X,همه اینجا هستند.,Everyone is here.,
example,A1,noun,مثال,X,mesâl,X,این یک مثال است.,This is an example.,
"excellent, great, awesome",A1,adjective,عالی,X,âli,,,,
"excuse me, I'm sorry",A1,interjection,ببخشید,X,bebaxšid,X,ببخشید، اینجا کجاست؟,"Excuse me, where is this?",
expensive,A2,adjective,گران,X,gerân,X,این هتل خیلی گران است.,This hotel is very expensive.,
eye,A1,noun,چشم,X,čašm,X,چشم من آبی است.,My eye is blue.,
"fair, just",B2,adjective,عادل,X,âdel,X,او را عادل می‌دانند چون بین دوستانش فرق نمی‌گذارد.,People consider him fair because he doesn’t treat his friends differently.,
family,A1,noun,خانواده,X,xânevâde,,,,
family member,A1,noun,عضو خانواده,X,ozv-e xânevâde,,,,
"farm, field",A2,noun,مزرعه,X,mazra'e,X,پدربزرگم یک مزرعه دارد.,My grandfather has a farm.,
"fast, quick",A2,adjective,سریع,X,sari',X,او خیلی سریع می‌دود.,He runs very fast.,
father,A1,noun,پدر,X,pedar,X,پدر من اینجا است.,My father is here.,
February,A1,noun,فوریه,X,fevriye,X,فوریه ماهِ دو است.,February is month two.,
"feel, sense",B1,verb,احساس کردن,X,ehsâs kardan,,,,
"feeling, emotion",B1,noun,احساس,X,ehsâs,,,,
fifteen,A1,numeral,پانزده,X,pânzdah,X,من پانزده سالم است.,I am fifteen years old.,
fifty,A1,numeral,پنجاه,X,panjâh,X,پنجاه نفر اینجا هستند.,Fifty people are here.,
"find, discover",A2,verb,پیدا کردن,X,peydâ kardan,,,,
finger,A1,noun,انگشت,X,angošt,X,این انگشت من است.,This is my finger.,
Finland,A2,noun,فنلاند,X,fanlând,,,,
Finnish,A2,adjective,فنلاندی,X,fanlândi,,,,
fire,A1,noun,آتش,X,âtaš,X,آتش گرم است.,The fire is hot.,
"firewood, wood",B1,noun,هیزم,X,hizom,,,,
first,A2,adjective,اول,X,avval,X,او شاگرد اول کلاس است.,He is a first-grade student.,
fish,A1,noun,ماهی,X,mâhi,X,من ماهی دوست دارم.,I like fish.,
fishing,A2,noun,ماهیگیری,X,mâhi-giri,,,,
five,A1,numeral,پنج,X,panj,X,من پنج کتاب دارم.,I have five books.,
fjord,B2,noun,فیورد,X,fiyôrd,,,,
flag,A2,noun,پرچم,X,parčam,,,,
flight,A2,noun,پروازِ,X,parvâz,,,,
"floor, bottom",A2,noun,کف,X,kaf,X,کف اتاق تمیز است.,The floor of the room is clean.,
flour,A1,noun,آرد,X,ârd,X,آرد روی میز است.,The flour is on the table.,
flower,A1,noun,گل,X,gol,X,این گل زیبا است.,This flower is beautiful.,
fly,A2,verb,پرواز کردن,X,parvâz kardan,,,,
fly,A2,noun,مگس,X,magas,X,یک مگس روی پنجره نشست.,A fly sat on the window.,
follow,A2,verb,دنبال کردن,X,donbâl kardan,X,من او را در خیابان دنبال کردم.,I followed him in the street.,
food,A1,noun,غذا,X,ğazâ,X,غذا آماده است.,The food is ready.,
"foot, leg",A1,noun,پا,X,pâ,X,پاهای من خسته است.,My legs are tired.,
"for, to",A1,preposition,برای,X,barâ-ye,X,این کتاب برای تو است.,This book is for you.,
"foreign, alien",B1,adjective,بیگانه,X,bigâne,X,او در این شهر احساس بیگانه بودن می‌کرد، چون هیچ‌کس را نمی‌شناخت.,"In this city he felt like a stranger, because he didn’t know anyone.",
forget,A2,verb,فراموش کردن,X,farâmôš kardan,,,,
fork,A1,noun,چنگال,X,čangâl,X,این چنگال است.,This is a fork.,
"form, shape, mold",A2,noun,شکل,X,šekl,,,,
forty,A1,numeral,چهل,X,čehel,X,من چهل سالم است.,I am forty years old.,
four,A1,numeral,چهار,X,čahâr,X,من چهار سیب دارم.,I have four apples.,
fourteen,A1,numeral,چهارده,X,čahârdah,X,من چهارده سالم است.,I am fourteen years old.,
fourth,A1,adjective,چهارم,X,čahârom,X,این روز چهارم است.,This is the fourth day.,
France,A2,noun,فرانسه,X,farânse,X,من به فرانسه سفر کردم.,I traveled to France.,
"free, for free",A1,adjective,رایگان,X,râyegân,X,این آب رایگان است.,This water is free.,
"free, liberal",A2,adjective,آزاد,X,âzâd,X,من آزاد هستم.,I am free.,
freedom,B1,noun,آزادی,X,âzâdi,X,مردم برای آزادی گاهی هزینهٔ سنگینی می‌دهند.,People sometimes pay a heavy cost for freedom.,
French,A2,adjective,فرانسوی,X,farânsavi,X,دوست من فرانسوی است.,My friend is French.,
fresh,A2,adjective,تازه,X,tâze,X,این نان تازه است.,This bread is fresh.,
Friday,A1,noun,جمعه,X,jom'e,X,جمعه من در خانه هستم.,On Friday I’m at home.,
friend,A1,noun,دوست,X,dust,X,او دوست من است.,He is my friend.,
friendly,B1,adjective,دوستانه,X,dustâne,X,او با لحن دوستانه حرف زد تا بحث آرام شود.,He spoke in a friendly tone so the discussion wouldn’t turn into an argument.,
frog,A2,noun,قورباغه,X,ġurbâġe,,,,
"from, of",A1,preposition,از,X,az,X,من از تهران هستم.,I am from Tehran.,
fruit,A1,noun,میوه,X,mive,X,میوه روی میز است.,The fruit is on the table.,
fruit salad,A2,noun,سالاد میوه,X,sâlâd-e mive,,,,
"fruit seller, fruit-seller, fruitmonger",A2,noun,میوه‌فروش,X,mêve-forôš,X,میوه‌فروش نزدیک مدرسه است.,The fruit seller is near the school.,
"fun, joke",A2,noun,شوخی,X,šôxi,X,او همیشه شوخی می‌کند.,He always jokes.,
fungal,B2,adjective,قارچی,X,qârči,,,,
game,A1,noun,بازی,X,bâzi,X,این بازی خوب است.,This game is good.,
gay,B1,adjective,گی,X,gey,X,او گی است و این موضوع را پنهان نمی‌کند.,He is gay and he doesn’t hide it.,
geography,B1,noun,جغرافیا,X,joġrâfiyâ,,,,
German,A1,adjective,آلمانی,X,âlmâni,X,آلمانی است.,It is German.,
Germany,A1,noun,آلمان,X,âlmân,X,آلمان کشور بزرگی است.,Germany is a big country.,
"gift, present",A1,noun,هدیه,X,hadiye,X,این هدیه برای تو است.,This gift is for you.,
"girl, daughter",A1,noun,دختر,X,doxtar,X,او یک دختر است.,She is a girl.,
give,A2,verb,دادن,X,dâdan,X,او کتاب را به من داد.,He gave me the book.,
glass,A1,noun,لیوان,X,livân,,,,
"go, leave",A1,verb,رفتن,X,raftan,X,من به خانه می‌روم.,I’m going home.,
God,A2,noun,الله,X,allâh,X,الله یکتا است.,Allah is one.,
"god, lord",A1,noun,خدا,X,xodâ,X,خدا مهربان است.,God is kind.,
good morning,A1,interjection,صبح بخیر,X,sobh bexeyr,,,,
good night,A1,interjection,شب بخیر,X,šab bexeyr,,,,
"good, nice, OK, okay",A1,adjective,خوب,X,xub,X,روز خوب است.,It's a good day.,
goodbye,A1,interjection,خداحافظ,X,xodâhâfez,,,,
government,A2,noun,دولت,X,dowlat,X,دولت جدید شروع به کار کرد.,The new government has started working.,
gram,A2,noun,گرم,X,geram,,,,
grammar,B1,noun,دستور زبان,X,dastur-e zabân,,,,
"grandchild, grandkid",A2,noun,نوه,X,nave,,,,
grandfather,A1,noun,پدربزرگ,X,pedar-bozorg,X,این پدربزرگ من است.,This is my grandfather.,
grandmother,A1,noun,مادربزرگ,X,mâdar-bozorg,,,,
grape,A1,noun,انگور,X,angur,X,من انگور می‌خورم.,I eat grapes.,
"gray, grey",A1,adjective,خاکستری,X,xâkestari,,,,
green,A1,adjective,سبز,X,sabz,X,این چای سبز است.,This tea is green.,
Greenland,B1,noun,گرینلند,X,gerinland,,,,
"grocery store, supermarket",A1,noun,سوپرمارکت,X,supermârket,,,,
hair,A1,noun,مو,X,mu,,,,
"halal, permissible",B1,adjective,حلال,X,halâl,X,روی بسته نوشته بود که این گوشت حلال است.,On the package it said that this meat is halal.,
"hallway, corridor",B1,noun,راهرو,X,râhro,,,,
ham,A2,noun,ژامبون,X,žâmbon,,,,
hamburger,A1,noun,همبرگر,X,hamberger,,,,
hammer,A2,noun,چکش,X,čakoš,,,,
hamster,A2,noun,همستر,X,hamestar,,,,
"hand, arm",A1,noun,دست,X,dast,X,دست من سرد است.,My hand is cold.,
handsome,B1,adjective,خوش‌تیپ,X,xoš-tip,X,او همیشه مرتب لباس می‌پوشد و خیلی خوش‌تیپ به نظر می‌رسد.,He always dresses neatly and looks very well-dressed.,
hang,B1,verb,آویزان کردن,X,âvizân kardan,,,,
happiness,B1,noun,خوشی,X,xoši,X,در میان همهٔ مشکلات، همین لحظه‌های کوچکِ خوشی به آدم نیرو می‌دهد.,"Amid all the problems, these small moments of happiness give you strength.",
happy,A1,adjective,خوشحال,X,xoš-hâl,X,او خوشحال است.,He is happy.,
"happy, good",B1,adjective,خوش,X,xoš,X,امروز حالِ خوشی دارم و می‌خواهم کمی بیرون بروم.,I feel good today and I want to go out a bit.,
"haram, forbidden",B1,adjective,حرام,X,harâm,X,این کار در دین ما حرام است، پس انجامش نمی‌دهم.,"This is forbidden in our religion, so I won’t do it.",
"hard, difficult",A2,adjective,سخت,X,saxt,X,این درس سخت است.,This lesson is hard.,
hat,A1,noun,کلاه,X,kolâh,,,,
have,A1,verb,داشتن,X,dâštan,X,من یک ماشین دارم.,I have a car.,
"he, she",A1,pronoun,او,X,u,X,او در خانه است.,He is at home.,
"he, she, you, they",A2,pronoun,ایشان,X,išân,X,ایشان معلم ما هستند.,He is our teacher.,
head,A1,noun,سر,X,sar,X,سر من درد دارد.,My head hurts.,
health,A2,noun,سلامتی,X,salâmati,X,سلامتی از همه چیز مهم‌تر است.,Health is more important than everything.,
healthy,A2,adjective,سالم,X,sâlem,,,,
healthy,A2,adjective,سلامت,X,salâmat,X,او بدنِ سالمی دارد.,He has a healthy body.,
hear,A1,verb,شنیدن,X,šenidan,,,,
heart,A2,noun,قلب,X,ġalb,X,قلب من تند می‌زند.,My heart is beating fast.,
heaviness,B1,noun,سنگینی,X,sangini,X,سنگینی هوا قبل از باران همیشه من را بی‌حوصله می‌کند.,The heaviness in the air before rain always makes me irritable.,
heavy,A2,adjective,سنگین,X,sangin,X,این کیف خیلی سنگین است.,This bag is very heavy.,
hello,A1,interjection,سلام,X,salâm,X,سلام!,Hello!,
help,A2,noun,کمک,X,komak,,,,
help,A1,verb,کمک کردن,X,komak kardan,,,,
here,A1,adverb,اینجا,X,injâ,X,اینجا مدرسه است.,This is the school.,
"hold, keep, stop",A2,verb,نگه داشتن,X,negah dâštan,,,,
homosexual,B2,adjective,همجنس‌گرا,X,ham-jens-garâ,X,او همجنس‌گراست و نمی‌خواهد زندگی‌اش را پنهان کند.,He is homosexual and doesn’t want to hide his life.,
hope,A2,noun,امید,X,omid,X,من هنوز امید دارم.,I still have hope.,
hopeless,B2,adjective,ناامید,X,nâomid,X,بعد از چند بار شکست، ناامید شد و دیگر تلاش نکرد.,"After failing a few times, he became hopeless and stopped trying.",
horse,A2,noun,اسب,X,asb,X,اسب سفید سریع می‌دود.,The white horse runs fast.,
hospital,A2,noun,بیمارستان,X,bimârestân,X,بیمارستان بزرگ و تمیز است.,The hospital is big and clean.,
hot,A2,adjective,داغ,X,dâğ,X,چای داغ است.,The tea is hot.,
"hot dog, sausage",A1,noun,سوسیس,X,sosis,,,,
"hot, warm",A1,adjective,گرم,X,garm,X,چای گرم است.,The tea is hot.,
hotel,A1,noun,هتل,X,hotel,X,هتل بزرگ است.,The hotel is big.,
house,A1,noun,خانه,X,xâne,X,خانه من کوچک است.,My house is small.,
how,A1,adverb,چطور,X,četowr,X,تو چطور هستی؟,How are you?,
"how many, how much",A1,determiner,چند,X,čand,X,چند کتاب داری؟,How many books do you have?,
human,B1,adjective,انسانی,X,ensâni,X,کمک کردن به دیگران یک رفتار انسانی است، حتی وقتی کسی از تو تشکر نمی‌کند.,"Helping others is a human act, even when no one thanks you.",
"human being, person, human",A2,noun,انسان,X,ensân,,,,
hundred,A1,numeral,صد,X,sad,X,صد نفر اینجا هستند.,One hundred people are here.,
hungry,A1,adjective,گرسنه,X,gorosne,,,,
husband,A1,noun,شوهر,X,šowhar,X,او شوهر من است.,He is my husband.,
I,A1,pronoun,من,X,man,X,من دانشجو هستم.,I am a student.,
ice,A1,noun,یخ,X,yax,,,,
ice cream,A1,noun,بستنی,X,bastani,X,من بستنی می‌خورم.,I eat ice cream.,
Iceland,A2,noun,ایسلند,X,island,,,,
idiot,B1,noun,احمق,X,ahmaġ,X,به او نگفت احمق، فقط گفت باید بیشتر فکر کنی.,He didn’t call him an idiot; he just said you should think more.,
idiotic,B1,adjective,احمق,X,ahmaġ,X,این تصمیم احمق بود و همه را به دردسر انداخت.,This decision was stupid and got everyone into trouble.,
if,A2,conjunction,اگر,X,agar,X,اگر باران بیاید، نمی‌رویم.,"If it rains, we will not go.",
"imperfect, incomplete",C,adjective,ناکامل,X,nâkâmel,X,به دلیل داده‌های ناقص، گزارش نهایی ناکامل بود و نتیجه‌گیری قابل اعتماد نبود.,"Because of incomplete data, the final report was incomplete and the conclusion was not reliable.",
important,A2,adjective,مهم,X,mohemm,X,این موضوع خیلی مهم است.,This topic is very important.,
in front of,A1,preposition,جلوی,X,jolow-ye,X,جلوی خانه است.,It is in front of the house.,
"in, at",A1,preposition,در,X,dar,X,کتاب در کیف است.,The book is in the bag.,
Indian,A1,adjective,هندی,X,hendi,,,,
information,A2,noun,اطلاعات,X,ettelâ'ât,,,,
innocent,B1,adjective,بی‌گُناه,X,bi-gonâh,X,او بی‌گُناه بود، اما کسی حرفش را باور نکرد.,"He was innocent, but nobody believed what he said.",
inside,A1,noun,داخل,X,dâxel,,,,
inside of,A1,preposition,داخل,X,dâxel-e,,,,
interesting,A2,adjective,جالب,X,jâleb,X,این فیلم جالب است.,This movie is interesting.,
Iran,A1,noun,ایران,X,irân,X,ایران زیباست.,Iran is beautiful.,
Iranian,A1,noun,ایرانی,X,irâni,X,او یک ایرانی است.,He is an Iranian.,
Iranian,A1,adjective,ایرانی,X,irâni,X,غذا ایرانی است.,The food is Iranian.,
Ireland,A2,noun,ایرلند,X,irland,,,,
"is not, there is not",A1,verb,نیست,X,nêst,X,او اینجا نیست.,He is not here.,
Islam,A2,noun,اسلام,X,eslâm,X,اسلام دین بزرگی است.,Islam is a great religion.,
Islamic,B1,adjective,اسلامی,X,eslâmi,X,او معماری اسلامی را دوست دارد و هر بار به مسجد نگاه می‌کند، جزئیات تازه‌ای می‌بیند.,"He likes Islamic architecture, and every time he looks at the mosque, he notices new details.",
island,A2,noun,جزیره,X,jazire,X,ما در یک جزیره کوچک بودیم.,We were on a small island.,
Italian,A2,noun,ایتالیایی,X,itâliyâyi,X,آن مرد ایتالیایی است.,That man is Italian.,
Italian,A2,adjective,ایتالیایی,X,itâliyâyi,X,من غذای ایتالیایی دوست دارم.,I like Italian food.,
Italy,A1,noun,ایتالیا,X,itâliyâ,X,ایتالیا یک کشور است.,Italy is a country.,
jacket,A1,noun,ژاکت,X,žâkat,X,این ژاکت گرم است.,This jacket is warm.,
January,A1,noun,ژانویه,X,žânviye,X,ژانویه ماهِ یک است.,January is month one.,
Japan,A1,noun,ژاپن,X,žâpon,,,,
Japanese,A1,adjective,ژاپنی,X,žâponi,,,,
Jewish,B1,adjective,یهودی,X,yahudi,X,او یک خانوادهٔ یهودی دارد، اما دربارهٔ دین زیاد حرف نمی‌زند.,"He has a Jewish family, but he doesn’t talk much about religion.",
"journey, trip",A2,noun,سفر,X,safar,,,,
Judaism,B2,noun,یهودیت,X,yahudiyat,X,او دربارهٔ یهودیت مطالعه کرد تا ریشه‌های تاریخی و فرهنگی آن را بهتر بفهمد.,He studied Judaism to better understand its historical and cultural roots.,
juice,A1,noun,آب میوه,X,âbmive,X,آب میوه شیرین است.,The juice is sweet.,
July,A1,noun,ژوئیه,X,žu'iye,X,ژوئیه ماهِ هفت است.,July is month seven.,
jump,A2,verb,پریدن,X,paridan,,,,
June,A1,noun,ژوئن,X,žu'an,X,ژوئن ماهِ شش است.,June is month six.,
just,A2,adverb,تازه,X,tâze,X,من تازه رسیدم.,I just arrived.,
kangaroo,A2,noun,کانگورو,X,kângoro,X,در باغ‌وحش کانگورو دیدیم.,We saw a kangaroo at the zoo.,
kebab,A2,noun,کباب,X,kabâb,X,امشب کباب می‌خوریم.,Tonight we eat kebab.,
key,A1,noun,کلید,X,kelid,X,این کلید مالِ من است.,This key is mine.,
kilogram,A1,noun,کیلوگرم,X,kilogram,X,این یک کیلوگرم است.,This is one kilogram.,
kilometer,A1,noun,کیلومتر,X,kilometr,X,این ده کیلومتر است.,This is ten kilometers.,
king,B1,noun,پادشاه,X,pâdešâh,X,پادشاه قول داد مالیات را کم کند، ولی بعد نظرش عوض شد.,"The king promised to lower taxes, but then he changed his mind.",
king,A2,noun,شاه,X,šâh,X,شاه در قصر زندگی می‌کرد.,The king lived in the palace.,
kiss,A2,noun,بوسه,X,buse,,,,
kiss,A2,verb,بوسیدن,X,busidan,,,,
kitchen,B1,noun,آشپزخانه‌ای,X,âšpaz-xâne,X,برای خانهٔ جدید چند وسیلهٔ آشپزخانه‌ای لازم داریم.,For the new house we need a few kitchen items.,
knee,A2,noun,زانو,X,zânu,,,,
knife,A1,noun,چاقو,X,čâġu,X,این چاقو است.,This is a knife.,
know,A2,verb,دانستن,X,dânestan,X,من جواب را می‌دانم.,I know the answer.,
knowledge,B1,noun,دانش,X,dâneš,X,دانش بدون تمرین کم‌کم فراموش می‌شود.,Knowledge fades little by little without practice.,
"known, famous",A2,adjective,معروف,X,ma'ruf,,,,
lamb,A2,noun,بره,X,barre,,,,
lamp,A1,noun,چراغ,X,čerâġ,X,این چراغ است.,This is a lamp.,
"language, tongue",A1,noun,زبان,X,zabân,X,من زبان فارسی بلدم.,I know Persian.,
"last name, family name, surname",A2,noun,نام خانوادگی,X,nâm-e xânevâdegi,X,نام خانوادگیِ شما چیست؟,What is your last name?,
Latvia,A2,noun,لتونی,X,letoni,X,لتونی در شمال اروپا است.,Latvia is in northern Europe.,
laugh,A1,verb,خندیدن,X,xandidan,X,من می‌خندم.,I laugh.,
learn,A1,verb,یاد گرفتن,X,yâd gereftan,X,من شنا یاد می‌گیرم.,I am learning to swim.,
left,A1,adjective,چپ,X,čap,X,ماشین چپ است.,The car is on the left.,
lemon,A2,noun,لیمو,X,limu,X,برای چای لیمو داری؟,Do you have lemon for tea?,
"lemon juice, lemonade",A2,noun,آبلیمو,X,âblimu,X,من صبح‌ها کمی آبلیمو در آب می‌ریزم.,In the mornings I pour a little lemon juice into water.,
"lesson, lecture",A1,noun,درس,X,dars,X,من درس دارم.,I have lessons.,
letter,B1,noun,نِویسِه,X,nevise,X,من یک نِویسِه کوتاه برای دوستم نوشتم.,I wrote a short letter for my friend.,
"letter, book",A2,noun,نامه,X,nâme,X,من یک نامه برای مادرم نوشتم.,I wrote a letter to my mother.,
library,A2,noun,کتابخانه,X,ketâbxâne,X,من امروز به کتابخانه می‌روم.,Today I’m going to the library.,
life,A1,noun,زندگی,X,zendegi,X,زندگی زیباست.,Life is beautiful.,
life,B2,noun,زیست,X,zist,X,در گزارش نوشت که زیستِ مردمِ آن منطقه به آب و هوا و کشاورزی وابسته است.,In the report he wrote that the life of the people in that region depends on the climate and agriculture.,
light,A2,noun,نور,X,nur,X,نورِ اتاق کم است.,The room doesn’t have much light.,
"light, thin",A2,adjective,سبک,X,sabok,,,,
like,B1,verb,خوش آمدن,X,xoš âmadan,X,از دیدن تو خوشم آمد و دوست دارم بیشتر صحبت کنیم.,"I was happy to see you, and I’d like to talk more.",
like,A2,preposition,مثل,X,mesl-e,X,من قهوه را مثل چای نمی‌خورم.,I don’t drink coffee like tea.,
"like this, like that",A2,adverb,این‌طور,X,intowr,,,,
line,A2,noun,خط,X,xatt,,,,
linguistics,B2,noun,زبان‌شناسی,X,zabân-šenâsi,X,او زبان‌شناسی را انتخاب کرد چون می‌خواست بفهمد چرا زبان‌ها این‌قدر شبیه هم هستند و در عین حال فرق دارند.,He chose linguistics because he wanted to understand why languages are so similar and yet different.,
lion,A2,noun,شیر,X,šir,X,در باغ‌وحش یک شیر دیدیم.,We saw a lion at the zoo.,
listen,A1,verb,گوش کردن,X,guš kardan,X,من به موسیقی گوش می‌کنم.,I'm listening to music.,
live,A1,verb,زندگی کردن,X,zendegi kardan,X,من اینجا زندگی می‌کنم.,I live here.,
live,B2,verb,زیستن,X,zistan,X,گاهی آدم فقط زیستن را ادامه می‌دهد، بدون این‌که بداند برای چه چیزی می‌جنگد.,Sometimes a person just keeps living without knowing what they are fighting for.,
living room,A1,noun,اتاق نشیمن,X,otâġ-e nešiman,X,این اتاق نشیمن است.,This is the living room.,
"long, tall",A2,adjective,دراز,X,derâz,X,این خیابان خیلی دراز است.,This street is very long.,
"love, like",A1,verb,دوست داشتن,X,dust dâštan,X,من تو را دوست دارم.,I love you.,
lovely,A2,adjective,دوست‌داشتنی,X,dust-dâštani,X,این بچه خیلی دوست‌داشتنی است.,This child is very lovely.,
lunch,A1,noun,ناهار,X,nâhâr,,,,
"mail, post",A2,noun,پست,X,post,,,,
"make, build",A2,verb,ساختن,X,sâxtan,X,او برای خانه یک میز ساخت.,He made a table for the house.,
man,A1,noun,مرد,X,mard,X,مرد در خیابان است.,The man is on the street.,
manhood,B2,noun,مردی,X,mardi,X,او از مردیِ خودش حرف می‌زد، اما بیشتر دنبال تأیید دیگران بود.,"He talked about his manhood, but he was mostly looking for other people’s approval.",
manliness,C,noun,مردانگی,X,mardânegi,X,او مردانگی را با مسئولیت‌پذیری تعریف می‌کرد، نه با نمایش قدرت و تحقیر دیگران.,"He defined manliness as taking responsibility, not showing power and humiliating others.",
manly,B2,adjective,مردانه,X,mardâne,X,او رفتار مردانه را با خشونت اشتباه می‌گیرد.,He confuses manly behavior with violence.,
"map, plan, model",A2,noun,نقشه,X,naġše,,,,
March,A1,noun,مارس,X,mârs,X,مارس ماهِ سه است.,March is month three.,
market,A2,noun,بازار,X,bâzâr,X,بازار امروز خیلی شلوغ است.,The market is very crowded today.,
masturbation,C,noun,خودارضایی,X,xod-erzâyi,X,در گفت‌وگوی آموزشی تأکید شد که خودارضایی موضوعی رایج است و بهتر است با اطلاعات درست همراه باشد، نه شرم.,"In an educational discussion it was emphasized that masturbation is common and should be accompanied by correct information, not shame.",
match,A2,noun,مسابقه,X,mosâbeġe,,,,
May,A1,noun,مه,X,me,X,مه ماهِ پنج است.,May is month five.,
"maybe, perhaps",A2,adverb,شاید,X,šâyad,,,,
meat,A1,noun,گوشت,X,gušt,X,گوشت تازه است.,The meat is fresh.,
medicine,B1,noun,پزشکی,X,pezeški,X,در دانشگاه، پزشکی می‌خواند تا بتواند به مردم کمک کند.,"At university, he studies medicine so he can help people.",
"medicine, drug",A2,noun,دارو,X,dâru,X,پزشک برای من دارو نوشت.,The doctor prescribed medicine for me.,
meet,B1,verb,ملاقات کردن,X,molâqât kardan,,,,
menu,A1,noun,منو,X,menu,,,,
"meter, metre",A1,noun,متر,X,metr,,,,
milk,A1,noun,شیر,X,šir,X,من شیر می‌نوشم.,I drink milk.,
