English,CEFR,gender,word,wordAudio,pronunciation,definition,sentenceAudio,example,sentenceTranslation,To Delete,Duplicate?
promise,B1,verb,قول دادن,X,ġowl dâdan,متعهد شدن به کسی برای انجامِ یک درخواست,X,او به من قول داد که تا پایان هفته تمام بدهی‌اش را تسویه کند، اما باز هم زیر حرفش زد.,"He promised me to settle all his debt by the end of the week, but he broke his word again.",,
strong,A2,adjective,قوی,X,ġavi,دارای زورِ زیاد,X,بدنم قوی‌تر از قبل است.,My body is stronger than before.,,
scissors,B1,noun,قیچی,X,ġayči,ابزارِ بریدن پارچه و کاغذ,X,خیاط با یک قیچی تیز، پارچه را بر اساس الگو برید.,The tailor cut the fabric according to the pattern with a sharp pair of scissors.,,
price,A1,noun,قیمت,X,ġeymat,مقدارِ پول برای خریدِ یک چیز,X,قیمت این نان خوب است.,The price of this bread is good.,,
"job, work",A1,noun,کار,X,kâr,کاری که برای پول انجام می‌دهی,X,کار من در شهر است.,My job is in the city.,,
work,A1,verb,کار کردن,X,kâr kardan,انجام دادنِ کار برای پول,X,من دوشنبه کار می‌کنم.,I work on Monday.,,
user,B1,noun,کاربر,X,kârbar,کسی که از سیستم استفاده می‌کند,X,هر کاربر یک نام کاربری و رمز دارد.,Each user has a username and a password.,,
card,A2,noun,کارت,X,kârt,کارتِ کوچک برای پرداخت,X,کارت من در کیف است.,My card is in my wallet.,,
postcard,A2,noun,کارت پستال,X,kârt postâl,کارت برای فرستادنِ سلام,X,من برای دوستم کارت پستال فرستادم.,I sent my friend a postcard.,,
"employer, boss",B2,noun,کارفرما,X,kârfarmâ,صاحبِ کار و استخدام‌کننده,X,طبق قانون، کارفرما موظف است تمام کارکنان خود را تحت پوشش بیمه قرار دهد.,"By law, the employer is obliged to provide insurance coverage to all its employees.",,
employee,B1,noun,کارمند,X,kârmand,فرد شاغل در ادارات,X,او به عنوان کارمند بخش اداری، مسئول بایگانی پرونده‌ها است.,"As an administrative employee, he is responsible for filing files.",,
bowl,A2,noun,کاسه,X,kâse,ظرفِ گرد برای غذا,X,سوپ را در کاسه می‌ریزم.,I pour the soup into a bowl.,,
paper,A1,noun,کاغذ,X,kâġaz,چیزی نازک برای نوشتن یا چاپ,X,روی کاغذ می‌نویسم.,I write on paper.,,
"café, cafe",A1,noun,کافه,X,kâfe,جایی برای خوردن و نوشیدن بیرون از خانه,X,ما در کافه قهوه می‌خوریم.,We drink coffee in the café.,,
"commodities, goods",B1,noun,کالا,X,kâlâ,چیزهای فروختنی,X,قیمتِ کالاها این ماه بالا رفت.,The prices of goods went up this month.,,
"desire, wish",B2,noun,کام,X,kâm,آرزوی قلبی و رسیدن به آن چیزی که می‌خواهیم,X,او پس از سال‌ها تحمل سختی در غربت، سرانجام به کامِ دیرینه‌اش رسید و به میهن بازگشت تا در کنار خانواده‌اش باشد.,"After years of enduring hardships in exile, he finally achieved his long-held desire and returned to the homeland to be with his family.",,
computer,A1,noun,کامپیوتر,X,kâmpyuter,وسیله‌ای برای کار و اینترنت,X,کامپیوتر روی میز است.,The computer is on the table.,,
"complete, perfect",A2,adjective,کامل,X,kâmel,بدون کمبود و ناقص نبودن,X,این جواب کامل نیست.,This answer isn’t complete.,,
Canada,A1,noun,کانادا,X,kânâdâ,کشوری بزرگ در شمالِ آمریکا,X,کانادا یک کشور است.,Canada is a country.,,
kangaroo,A2,noun,کانگورو,X,kângoro,حیوانی که در استرالیا زندگی می‌کند,X,در باغ‌وحش کانگورو دیدیم.,We saw a kangaroo at the zoo.,,
kebab,A2,noun,کباب,X,kabâb,غذای گوشتِ کبابی,X,امشب کباب می‌خوریم.,Tonight we eat kebab.,,
liver,B2,noun,کبد,X,kabed,اندامِ بزرگ و تصفیه‌گر بدن,X,مصرف مداوم الکل و غذاهای چرب می‌تواند باعث التهاب و تخریب کبد شود.,Continuous consumption of alcohol and fatty foods can cause inflammation and damage to the liver.,,
"match, matchstick",A2,noun,کبریت,X,kebrit,چوبِ کوچکی برای روشن کردنِ آتش,X,او با یک چوب کبریت اجاق را روشن کرد.,She lit the stove with a match.,,
Copenhagen,A2,noun,کپنهاگ,X,kopenhâg,پایتختِ دانمارک,X,کپنهاگ پایتخت دانمارک است.,Copenhagen is the capital of Denmark.,,
book,A1,noun,کتاب,X,ketâb,چیزی با صفحه برای خواندن,X,این کتاب فارسی است.,This book is in Persian.,,
library,A2,noun,کتابخانه,X,ketâbxâne,جایی برای کتاب‌ها و مطالعه,X,من امروز به کتابخانه می‌روم.,Today I’m going to the library.,,
librarian,B1,noun,کتابدار,X,ketâbdâr,فردی که مسئولِ نگهداریِ کتاب‌ها در کتابخانه است,X,وقتی کتاب را به کتابخانه برگرداندم، کتابدار آن را اسکن کرد و در قفسه مخصوص گذاشت.,"When I returned the book to the library, the librarian scanned it and put it on the specific shelf.",,
dirty,A2,adjective,کثیف,X,kasif,نه تمیز و پر از چرک,X,این لیوان کثیف است.,This glass is dirty.,,
where,A1,adverb,کجا,X,kojâ,کلمه برای پرسیدنِ مکان,X,دستشویی کجا است؟,Where is the restroom?,,
"tie, necktie",A2,noun,کراوات,X,kerâvât,پارچهٔ رسمی برای گردن,X,او برای مهمانی کراوات زد.,He wore a tie for the party.,,
"make, do",A1,verb,کردن,X,kardan,انجام دادنِ یک کار,X,امروز شام درست می‌کنم.,Today I make dinner.,,
butter,A1,noun,کره,X,kare,چیزی چرب از شیر برای نان,X,کره روی نان است.,Butter is on the bread.,,
Croatia,A2,noun,کرواسی,X,korovâsi,کشوری در اروپا,X,کرواسی کشور زیبایی است.,Croatia is a beautiful country.,,
Christmas,A1,noun,کریسمس,X,kerismas,جشنِ زمستانی در پایانِ سال,X,کریسمس در دسامبر است.,Christmas is in December.,,
"someone, somebody, some",A1,numeral,کسی,X,kasi,یک نفر نامشخص,X,کسی اینجا نیست.,There is nobody here.,,
kill,B1,verb,کشتن,X,koštan,گرفتنِ جانِ یک انسان یا حیوان,X,هیچ‌کس حق ندارد کسی را بکشد.,No one has the right to kill someone.,,
"country, land",A1,noun,کشور,X,kešvar,جایی که مردم با قانون زندگی می‌کنند,X,ایران یک کشور است.,Iran is a country.,,
pull,A2,verb,کشیدن,X,kašidan,کشیدنِ چیزی به سمت خود,X,من در را می‌کشم تا بسته شود.,I pull the door so it will close.,,
priest,B1,noun,کشیش,X,kašiš,روحانیِ مسیحی,X,آن کشیش در کلیسا برای صلح دعا کرد.,That priest prayed for peace in the church.,,
"floor, bottom",A2,noun,کف,X,kaf,قسمتِ پایینِ یک اتاق,X,کف اتاق تمیز است.,The floor of the room is clean.,,
shoe,A1,noun,کفش,X,kafš,چیزی که زیر پا می‌پوشی,X,کفش زیر تخت است.,The shoes are under the bed.,,
classroom,A1,noun,کلاس درس,X,kelâs-e dars,اتاقی برای درس در مدرسه,X,کلاس درس امروز شلوغ است.,The classroom is crowded today.,,
hat,A1,noun,کلاه,X,kolâh,چیزی برای گذاشتن روی سر,X,این کلاه برای زمستان است.,This hat is for winter.,,
cabbage,A1,noun,کلم,X,kalam,سبزیِ برگ‌دار که در غذا می‌پزند,X,کلم در سالاد است.,Cabbage is in the salad.,,
word,A1,noun,کلمه,X,kalame,واحدِ زبان که در جمله می‌آید,X,این کلمه سخت است.,This word is hard.,,
key,A1,noun,کلید,X,kelid,چیزی برای باز کردنِ در,X,کلید را گم کردم.,I lost the key.,,
church,A2,noun,کلیسا,X,kelisâ,جایی برای عبادتِ مسیحی‌ها,X,یک کلیسا نزدیک خانهٔ ما هست.,There is a church near our house.,,
kidney,B2,noun,کلیه,X,kolye,اندامِ دفعِ ادرار و تصفیه خون,X,بیمار به دلیل نارسایی شدید کلیه، مجبور است هفته‌ای سه بار دیالیز شود.,The patient has to undergo dialysis three times a week due to severe kidney failure.,,
"not much, little, few",A1,adjective,کم,X,kam,به مقدارِ کم,X,در یخچال شیر کم است.,There is little milk in the fridge.,,
"closet, wardrobe",A2,noun,کمد,X,komod,جایی برای گذاشتنِ لباس,X,لباس‌هایم در کمد است.,My clothes are in the closet.,,
belt,A2,noun,کمربند,X,kamarband,نوار برای بستنِ شلوار,X,او کمربند مشکی دارد.,He has a black belt.,,
"help, aid",A2,noun,کمک,X,komak,یاری برای یک کار,X,از تو کمک می‌خواهم.,I want your help.,,
"help, aid",A1,verb,کمک کردن,X,komak kardan,دادنِ کمک به یک نفر,X,لطفاً به من کمک کن.,Please help me.,,
communism,B2,noun,کمونیسم,X,komunism,نظام فکری و اقتصادی بر پایهٔ مالکیت جمعی,X,کمونیسم در قرن بیستم روی سیاست بسیاری از کشورها اثر گذاشت.,Communism affected the politics of many countries in the twentieth century.,,
"a little, a little bit, a bit",A1,adverb,کمی,X,kami,به مقدارِ کم,X,کمی آب در لیوان است.,There is a little water in the glass.,,
side,A1,noun,کنار,X,kenâr,پهلو و بغلِ یک چیز,X,قاشق کنار بشقاب است.,The spoon is next to the plate.,,
"blunt, dull",B1,adjective,کُند,X,kond,ویژگیِ چاقویی که دیگر قدرتِ بریدن ندارد,X,این قیچی چاقو کُند شده است و دیگر نمی‌تواند پارچه‌های ضخیم را برش بزند.,This pair of scissors has become blunt and can no longer cut thick fabrics.,,
dig,A2,verb,کندن,X,kandan,درآوردن خاک از زمین با ابزار,X,او در باغ زمین را می‌کند.,He is digging the ground in the garden.,,
"that, who",A2,conjunction,که,X,ke,کلمه برای وصل کردنِ جمله‌ها,X,می‌دانم که تو خسته‌ای.,I know that you are tired.,,
galaxy,B2,noun,کهکشان,X,kahkašân,مجموعه‌ی عظیمی از ستاره‌ها در فضا,X,راه شیری تنها یکی از میلیاردها کهکشان در کیهان است.,The Milky Way is just one of billions of galaxies in the universe.,,
"short, low",A1,adjective,کوتاه,X,kutâh,با طولِ کم,X,موی من کوتاه است.,My hair is short.,,
"small, little",A1,adjective,کوچک,X,kučak,با اندازهٔ کم,X,اتاق من کوچک است.,My room is small.,,
effort,B1,noun,کوشش,X,kušeš,تلاش برای انجامِ کار,X,با کوشش می‌توانی زبان را بهتر یاد بگیری.,"With effort, you can learn the language better.",,
try,B1,verb,کوشش کردن,X,kôšeš kardan,تلاش کردن,X,برای پیدا کردن کار، کوشش کردم و ناامید نشدم.,I tried to find a job and I didn’t give up.,,Duplicate
try,B1,verb,کوشیدن,X,kušidan,تلاش کردن,X,او خیلی کوشید تا دیر نکند.,He tried hard not to be late.,,Duplicate
mountain,A1,noun,کوه,X,kuh,جایی بلند در طبیعت,X,کوه خیلی بلند است.,The mountain is very tall.,,
when,A1,adverb,کی,X,key,کلمه برای پرسیدنِ زمان,X,کی به خانه می‌آیی؟,When are you coming home?,,
who (informal),A1,pronoun,کی,X,ki,کلمه برای پرسیدنِ نامِ یک نفر,X,پشتِ در کیه؟,Who is at the door?,,
keyboard,A1,noun,کیبورد,X,kibord,وسیله‌ای برای تایپ کلمات,X,من با کیبورد کامپیوتر نامه می‌نویسم.,I am writing a letter with the computer keyboard.,,
"dick, cock",C,noun,کیر,X,kêr,ناسزای بسیار رکیک برای اندام جنسی مرد,X,قاضی گفت به‌کار بردن واژهٔ «کیر» در جلسهٔ رسمی توهین‌آمیز است و عواقب حقوقی دارد.,The judge said using the word “dick” in an official session is insulting and has legal consequences.,,
bag,A2,noun,کیسه,X,kise,چیزی برای گذاشتن خوراکی‌ها یا چیزها,X,لطفا میوه‌ها را در این کیسه پلاستیکی بگذارید.,Please put the fruit in this plastic bag.,,
bag,A1,noun,کیف,X,kif,چیزی برای گذاشتن وسایل شخصی,X,کیفِ مدرسه روی میز است.,The school bag is on the table.,,
quality,B1,noun,کیفیت,X,keyfiyat,مرغوبیت و چگونگیِ کالا,X,اگرچه این موبایل گران است، اما کیفیت دوربین آن فوق‌العاده است.,"Although this phone is expensive, its camera quality is excellent.",,
cake,A1,noun,کیک,X,keyk,شیرینیِ پخته,X,کیک برای تولد است.,Cake is for birthdays.,,
kilogram,A1,noun,کیلوگرم,X,kilogram,واحدِ وزن برای خرید,X,یک کیلوگرم برنج می‌خرم.,I buy one kilogram of rice.,,
kilometer,A1,noun,کیلومتر,X,kilometr,واحدِ طول برای راه,X,مدرسه دو کیلومتر دور است.,The school is two kilometers away.,,
universe,B2,noun,کیهان,X,keyhân,جهانِ بسیار بزرگِ فراتر از زمین,X,در مستند گفتند که کیهان شاید خیلی بزرگ‌تر از چیزی باشد که ما تصور می‌کنیم.,In the documentary they said the universe might be much bigger than we imagine.,,
gas,A2,noun,گاز,X,gâz,چیزی که برای پخت و پز می‌سوزد,X,بوی گاز آمد و پنجره را باز کردم.,I smelled gas and opened the window.,,
natural gas,B1,noun,گاز طبیعی,X,gâz-e tabi'i,گازِ مصرفیِ خانه از زمین,X,در زمستان مصرف گاز طبیعی بیشتر می‌شود.,"In winter, the consumption of natural gas increases.",,
time,B2,noun,گاه,X,gâh,زمان یا نوبت,X,گاه آدم فکر می‌کند همه چیز دیر شده، اما هنوز وقت هست.,"Sometimes a person thinks everything is too late, but there is still time.",,
sometimes,A2,adverb,گاهی,X,gâhi,نه همیشه و نه هر روز,X,گاهی آخر هفته‌ها دیر بیدار می‌شوم.,Sometimes on weekends I wake up late.,,
cow,A1,noun,گاو,X,gâv,حیوانی که شیر می‌دهد,X,گاو شیر دارد.,A cow has milk.,,
"put, place, let, allow",A2,verb,گذاشتن,X,gozâštan,قرار دادنِ یک چیز در جایی,X,کتاب را روی میز بگذار.,Put the book on the table.,,
passport,B1,noun,گذرنامه,X,gozarnâme,مدرک شناساییِ بین‌المللی,X,مامور مرز، اعتبار گذرنامه مسافران را پیش از خروج بررسی کرد.,The border guard checked the validity of the passengers' passports before they left.,,
the past,B1,noun,گذشته,X,gozašte,خاطرات و اتفاقاتی که قبلاً رخ داده است,X,ما نباید در گذشته زندگی کنیم؛ باید از اشتباهات قبلی درس بگیریم و به فکر حال باشیم.,We should not live in the past; we must learn from previous mistakes and think about the present.,,
"past, last",B1,adjective,گذشته,X,gozašte,مربوط به زمان یا روزهایی که به پایان رسیده‌اند,X,در تابستان گذشته، هوا آن‌قدر گرم بود که بسیاری از رودخانه‌ها کاملاً خشک شدند.,"Last summer, the weather was so hot that many rivers dried up completely.",,
expensive,A2,adjective,گران,X,gerân,با قیمتِ زیاد,X,این هتل خیلی گران است.,This hotel is very expensive.,,
cat,A1,noun,گربه,X,gorbe,حیوانی کوچک که میو میو می‌کند,X,گربه زیر میز خوابیده است.,The cat is sleeping under the table.,,
neck,A2,noun,گردن,X,gardan,بخشی از بدن که سر را به تنه وصل می‌کند,X,او یک شال‌گردن پشمی دور گردن خود بسته است تا سرما نخورد.,He has tied a wool scarf around his neck so he doesn't catch a cold.,,
hungry,A1,adjective,گرسنه,X,gorosne,نیاز داشتن به غذا,X,من گرسنه‌ام و نان می‌خواهم.,I’m hungry and I want bread.,,
"take, get, catch",A2,verb,گرفتن,X,gereftan,دست گرفتن یا برداشتن,X,من اتوبوس را از ایستگاه گرفتم.,I took the bus from the stop.,,
"hot, warm",A1,adjective,گرم,X,garm,دارای دمای بالا,X,چای گرم است.,The tea is hot.,,
gram,A2,noun,گرم,X,geram,واحدِ اندازهٔ وزن,X,این بسته دویست گرم است.,This package is two hundred grams.,,
"knot, tie",B1,noun,گره,X,gereh,گره در طناب یا بند,X,گره بند کفش را محکم کن.,Tighten the knot on your shoelaces.,,
"tie, knot",B1,verb,گره زدن,X,gereh zadan,با بند گره درست کردن,X,او دو طناب را با یک گره ساده گره زد.,He tied two ropes with a simple knot.,,
"pricy, pricey, expensive",A2,adjective,گرون,X,gerun,گران و با قیمتِ زیاد,X,این کافه خیلی گرون است.,This café is very pricy.,,
group,A2,noun,گروه,X,goruh,چند نفر یا چند چیز با هم,X,ما یک گروه برای درس داریم.,We have a study group.,,
Greenland,B1,noun,گرینلند,X,gerinland,جزیره‌ای بزرگ در شمال,X,گرینلند خیلی سرد است و بیشتر سال یخ دارد.,Greenland is very cold and has ice for most of the year.,,
cry,A2,verb,گریه کردن,X,gerye kardan,اشک ریختن از ناراحتی,X,وقتی ناراحت هستم گریه می‌کنم.,"When I am upset, I cry.",,
converse,B1,verb,گفتگو کردن,X,goftogu kardan,با هم حرف زدن,X,بهتر است قبل از تصمیم گرفتن، با هم گفتگو کنیم و همهٔ گزینه‌ها را ببینیم.,It’s better to talk it through together before deciding and look at all the options.,,
"say, tell",A1,verb,گفتن,X,goftan,گفتنِ جمله با زبان,X,او می‌گوید «سلام».,He says “hello.”,,
flower,A1,noun,گل,X,gol,چیزی زیبا که روی گیاه رشد می‌کند,X,گل در گلدان است.,The flower is in the vase.,,
"vase, pot",A2,noun,گلدان,X,goldân,ظرف برای گل,X,یک گلدان روی میز است.,There is a vase on the table.,,
throat,B1,noun,گلو,X,galu,بخشِ داخلیِ گردن که غذا از آن پایین می‌رود,X,گلویم به شدت درد می‌کند و وقتی می‌خواهم غذا را قورت بدهم، حس می‌کنم گلویم ورم کرده است.,"My throat hurts severely and when I want to swallow food, I feel my throat is swollen.",,
lose,A2,verb,گم کردن,X,gom kardan,پیدا نکردنِ وسیله‌ای که قبلاً در اختیار داشتیم,X,من کلیدهایم را گم کرده‌ام و نمی‌توانم وارد خانه شوم.,I have lost my keys and cannot enter the house.,,
customs,B2,noun,گمرک,X,gomrok,اداره‌ی نظارت بر واردات,X,تمام کالاهای وارداتی باید توسط ماموران گمرک بازرسی و ترخیص شوند.,All imported goods must be inspected and cleared by customs officers.,,
"sin, crime",B1,noun,گناه,X,gonâh,کارِ بد از نظرِ دین,X,او از گناهی که کرده بود پشیمان شد و از همه عذرخواهی کرد.,He regretted the sin he had committed and apologized to everyone.,,
sinner,B2,noun,گناهکار,X,gonâh-kâr,کسی که گناه کرده است,X,بعضی‌ها خیلی راحت به دیگران می‌گویند گناهکار، بدون این‌که چیزی بدانند.,Some people very easily call others sinners without knowing anything.,,
tomato,A1,noun,گوجه‌فرنگی,X,gowje-farangi,میوهٔ قرمز برای سالاد,X,گوجه‌فرنگی را در سالاد می‌ریزیم.,We put tomatoes in the salad.,,
"grave, tomb",B1,noun,گور,X,gur,جای دفنِ مرده,X,گورِ او کنارِ یک درختِ بزرگ است.,His grave is next to a big tree.,,Duplicate
"cemetery, graveyard",B2,noun,گورستان,X,gurestân,جایی که مرده‌ها را دفن می‌کنند,X,گورستانِ قدیمی حالا تبدیل به یک مکانِ تاریخی شده است.,The old graveyard has now become a historical site.,,Duplicate
ear,A1,noun,گوش,X,guš,عضوی برای شنیدن,X,گوش من درد می‌کند.,My ear hurts.,,
listen,A1,verb,گوش کردن,X,guš kardan,شنیدنِ صدا با توجه,X,به موسیقی گوش می‌کنم.,I listen to music.,,
meat,A1,noun,گوشت,X,gušt,خوراکی از بدنِ حیوان,X,گوشت در یخچال است.,The meat is in the fridge.,,
beef,A1,noun,گوشت گاو,X,gušt-e gâv,خوراکی از بدنِ گاو,X,گوشت گاو گران است.,Beef is expensive.,,
cheek,A2,noun,گونه,X,gune,قسمتِ کنارِ صورت,X,گونه‌هایش قرمز شد.,His cheeks turned red.,,
gay,B1,adjective,گی,X,gey,مربوط به همجنس‌گرایی,X,او گی است و این موضوع را پنهان نمی‌کند.,He is gay and he doesn’t hide it.,,
smile,A2,noun,لبخند,X,labxand,باز شدنِ لب‌ها به نشانه‌ی شادی و مهربانی,X,وقتی هدیه را باز کرد، لبخند بزرگی روی صورتش نشست.,"When he opened the gift, a big smile sat on his face.",,
Latvia,A2,noun,لتونی,X,letoni,کشوری در شمالِ اروپا,X,لتونی در شمال اروپا است.,Latvia is in northern Europe.,,
"stubborn, headstrong",B1,adjective,لجباز,X,lajbâz,کسی که حرف دیگران را گوش نمی‌دهد,X,کودک لجباز حاضر نبود داروهای تلخ خود را بخورد و مدام گریه می‌کرد.,The stubborn child refused to take his bitter medicine and kept crying.,,
moment,A2,noun,لحظه,X,lahze,یک زمانِ خیلی کوتاه,X,یک لحظه صبر کن.,Wait a moment.,,
please,A1,interjection,لطفاً,X,lotfan,کلمه برای درخواستِ مودبانه,X,لطفاً در را ببند.,Please close the door.,,
word,A2,noun,لغت,X,loġat,کلمه با معنی,X,این لغت را نمی‌فهمم.,I don’t understand this word.,,
dictionary,B1,noun,لغت‌نامه,X,loġat-nâme,کتابِ معنیِ واژه‌ها,X,برای معنی دقیق این واژه، به لغت‌نامه مراجعه کردم.,"For the exact meaning of this word, I consulted a dictionary.",,
Poland,A2,noun,لهستان,X,lahestân,کشوری در اروپا,X,لهستان در اروپا است.,Poland is in Europe.,,
Polish,A2,adjective,لهستانی,X,lahestâni,مربوط به کشورِ لهستان,X,او غذای لهستانی دوست دارد.,He likes Polish food.,,
lemon,A2,noun,لیمو,X,limu,میوهٔ ترشِ زرد,X,برای چای لیمو داری؟,Do you have lemon for tea?,,
link,A1,noun,لینک,X,link,آدرسِ اینترنتی برای وصل شدن به صفحه,X,روی این لینک آبی کلیک کن.,Click on this blue link.,,
glass,A1,noun,لیوان,X,livân,ظرف برای نوشیدن,X,یک لیوان آب می‌خواهم.,I want a glass of water.,,
we,A1,pronoun,ما,X,mâ,ضمیر برای چند نفر با هم,X,ما با هم می‌رویم.,We go together.,,
mother,A1,noun,مادر,X,mâdar,زنِ پدر یا مادرِ تو,X,مادر من مهربان است.,My mother is kind.,,
grandmother,A1,noun,مادربزرگ,X,mâdar-bozorg,مادرِ پدر یا مادرِ تو,X,مادربزرگ من در تهران است.,My grandmother is in Tehran.,,
snake,A1,noun,مار,X,mâr,حیوانی بلند و بدون پا,X,مار ترسناک است.,The snake is scary.,,
March,A1,noun,مارس,X,mârs,ماهِ سومِ سالِ میلادی,X,مارس ماهِ سه است.,March is the third month.,,
yogurt,A1,noun,ماست,X,mâst,خوراکی سفید که از شیر درست می‌شود,X,ماست برای صبحانه خوب است.,Yogurt is good for breakfast.,,
"car, machine",A2,noun,ماشین,X,mâšin,وسیلهٔ رفتن در خیابان,X,ماشین من امروز روشن نمی‌شود.,My car won’t start today.,,
washing machine,B1,noun,ماشین لباس‌شویی,X,mâšin-e lebâs-šuyi,دستگاهِ شستنِ لباس,X,ماشین لباس‌شویی خراب شده و باید تعمیرش کنم.,The washing machine is broken and I need to fix it.,,
property,A2,noun,مال,X,mâl,چیزی که مالِ یک نفر است,X,این کتاب مالِ من است.,This book is mine.,,
