English,CEFR,gender,word,wordAudio,pronunciation,definition,sentenceAudio,example,sentenceTranslation,To Delete,Duplicate?
valley,A2,noun,دره,X,"dare, darre",زمینِ گودِ میان دو کوه,X,روستای ما پایین کوه و در یک دره زیبا قرار دارد.,Our village is located at the bottom of a mountain in a beautiful valley.,,
liar,B1,noun,دروغگو,X,doruġgu,کسی که حرفِ اشتباه می‌زند,X,هیچ‌کس به حرف‌های یک دروغگو اعتماد نمی‌کند.,No one trusts the words of a liar.,,
"sea, ocean",A1,noun,دریا,X,daryâ,حجمِ بسیار پهناوری از آب‌هایِ شور,X,دریا بزرگ است.,The sea is big.,,
"perception, receiving, understanding",B2,noun,دریافت,X,daryâft,عملِ گرفتنِ چیزی یا فهمیدنِ یک حس و پیام,X,دریافتِ منتقدان از لایه‌های پنهان این رمان، نشان‌دهنده تفاوت عمیق نگاه نسل‌های مختلف به مسائل اجتماعی است.,The critics' perception of the hidden layers of this novel demonstrates the profound difference in how various generations view social issues.,,
receive,B1,verb,دریافت کردن,X,daryâft kardan,گرفتنِ هدیه، نامه یا پیامی که برای ما آمده است,X,من هنوز ایمیل تاییدیه شما را دریافت نکرده‌ام؛ لطفاً دوباره آن را به آدرس من بفرستید.,I still haven't received your confirmation email; please send it to my address again.,,
December,A1,noun,دسامبر,X,desâmbr,ماهِ دوازدهمِ سالِ میلادی,X,دسامبر ماهِ دوازده است.,December is the twelfth month.,,
"hand, arm",A1,noun,دست,X,dast,عضوی برای گرفتن و لمس کردن,X,دست من سرد است.,My hand is cold.,,
"restroom, bathroom, toilet, sink",A1,noun,دستشویی,X,dastšuyi,جایی برای دست شستن و کارهای بهداشتی,X,دستشویی آنجاست.,The restroom is over there.,,
"order, command",A2,noun,دستور,X,dastur,قانون یا فرمان,X,دستورِ پخت را از اینترنت گرفتم.,I got the cooking instructions from the internet.,,
grammar,B1,noun,دستور زبان,X,dastur-e zabân,قواعدِ یک زبان,X,اگر دستور زبان را خوب یاد بگیری، راحت‌تر صحبت می‌کنی.,"If you learn grammar well, you can speak more easily.",,
enemy,B1,noun,دشمن,X,došman,کسی یا گروهی که با تو مخالف است,X,او دشمنِ من نیست و فقط با من مخالف است.,"He isn’t my enemy, he just disagrees with me.",,
"burial, internment",B2,noun,دفن,X,dafn,به خاک سپردنِ مرده,X,دفنِ او با حضورِ خانواده و دوستان انجام شد.,His burial took place in the presence of family and friends.,,
bury,B2,verb,دفن کردن,X,dafn kardan,به خاک سپردنِ مرده,X,آن‌ها او را در کنارِ خانواده‌اش دفن کردند.,They buried him next to his family.,,
minute,A2,noun,دقیقه,X,daġiġe,شصت ثانیه,X,یک دقیقه صبر کن.,Wait a minute.,,
button,A2,noun,دکمه,X,dokme,چیزی کوچک برای فشار دادن,X,این دکمه را فشار بده.,Press this button.,,
"reason, cause",B1,noun,دلیل,X,dalil,چرایی و علتِ اصلیِ وقوعِ یک ماجرا,X,اصلی‌ترین دلیل ترافیک در این ساعت، تصادف شدیدی است که در ابتدای بزرگراه رخ داده است.,The main reason for traffic at this hour is the severe accident that occurred at the beginning of the highway.,,
nose,A2,noun,دماغ,X,damâġ,بینیِ صورت,X,دماغ من گرفته است.,My nose is congested.,,
slipper,A2,noun,دمپایی,X,dampâyi,کفشِ راحتِ خانه,X,دمپایی‌ام را در خانه می‌پوشم.,I wear my slippers at home.,,
democratic,B2,adjective,دموکراتیک,X,demokrâtik,مربوط به مردم‌سالاری,X,نظام دموکراتیک بدون انتخاباتِ آزاد معنی ندارد.,A democratic system has no meaning without free elections.,,
democracy,B1,noun,دموکراسی,X,demokrâsi,حکومتِ مردم با رأی,X,در دموکراسی مردم با رأی خود مسیر کشور را تعیین می‌کنند.,"In a democracy, people determine the country’s path with their vote.",,
tail,C,noun,دنب,X,donb,دمِ جانور,X,دُنبِ این حیوان هنگام دویدن مثل پرچم تکان می‌خورد.,The animal’s tail waves like a flag when it runs.,,
"rear, behind",A2,noun,دنبال,X,donbâl,پشتِ یک چیز برای پیدا کردن,X,کلیدم را جا گذاشتم، دنبالِ آن می‌گردم.,I left my key behind; I’m looking for it.,,
follow,A2,verb,دنبال کردن,X,donbâl kardan,پشتِ کسی رفتن,X,من او را در خیابان دنبال کردم.,I followed him in the street.,,
sequence,B2,noun,دنباله,X,donbâle,رشتهٔ پیوسته با نظم مشخص,X,برای حل مسئله، باید دنبالهٔ اعداد را درست ادامه بدهی.,"To solve the problem, you must continue the sequence of numbers correctly.",,
tooth,A2,noun,دندان,X,dandân,چیزِ سفید در دهان,X,دندان من درد می‌کند.,My tooth hurts.,,
dentist,B1,noun,دندان‌پزشک,X,dandân-pezešk,پزشکِ دندان,X,برای درد دندان باید به دندان‌پزشک مراجعه کنی، نه این‌که فقط مسکن بخوری.,"For tooth pain, you should see a dentist, not just take painkillers.",,
ten,A1,numeral,ده,X,dah,عدد ۱۰,X,ده یعنی پنج و پنج.,Ten means five and five.,,
mouth,A1,noun,دهان,X,dahân,جایی برای خوردن و حرف زدن,X,دهانِ من خشک است.,My mouth is dry.,,
two,A1,numeral,دو,X,do,عدد ۲,X,دو یعنی یک و یک.,Two means one and one.,,
twelve,A1,numeral,دوازده,X,davâzdah,عدد ۱۲,X,دوازده یعنی ده و دو.,Twelve means ten and two.,,
"again, twice",A1,adverb,دوباره,X,dobâre,یک بار دیگر,X,این فیلم را دوباره می‌بینم.,I watch this movie again.,,
"bike, bicycle",A1,noun,دوچرخه,X,dočarxe,وسیله‌ای دوچرخ برای رفتن در خیابان,X,من با دوچرخه به مدرسه می‌روم.,I go to school by bicycle.,,
sew,B1,verb,دوختن,X,duxtan,اتصال پارچه با نخ و سوزن,X,دکمه پیراهنم افتاده است و باید آن را دوباره با نخ و سوزن بدوزم.,A button on my shirt fell off and I have to sew it back on with a needle and thread.,,
away,A2,adverb,دور,X,dur,در فاصلهٔ زیاد,X,خانهٔ ما از مدرسه دور است.,Our house is far from the school.,,
camera,A2,noun,دوربین,X,durbin,وسیله برای گرفتنِ عکس,X,من با دوربین عکس می‌گیرم.,I take photos with a camera.,,
friend,A1,noun,دوست,X,dust,کسی که با او وقت می‌گذرانی,X,او دوست من است.,He is my friend.,,
"love, like",A1,verb,دوست داشتن,X,dust dâštan,احساسِ علاقه داشتن به یک نفر یا یک چیز,X,من موسیقی را دوست دارم.,I like music.,,
friendly,B1,adjective,دوستانه,X,dustâne,با رفتارِ مهربان با دوست,X,او با لحن دوستانه حرف زد تا بحث آرام شود.,He spoke in a friendly tone so the discussion wouldn’t turn into an argument.,,
lovely,A2,adjective,دوست‌داشتنی,X,dust-dâštani,جوری که آدم آن را دوست دارد,X,این بچه خیلی دوست‌داشتنی است.,This child is very lovely.,,
Monday,A1,noun,دوشنبه,X,došanbe,روزِ اولِ هفته در تقویمِ کاری,X,دوشنبه بعد از یکشنبه است.,Monday comes after Sunday.,,
government,A2,noun,دولت,X,dowlat,سازمانِ ادارهٔ کشور,X,دولت جدید شروع به کار کرد.,The new government has started working.,,
"donut, doughtnut",A1,noun,دونات,X,donât,شیرینیِ حلقه‌ای که گاهی با قهوه می‌خورند,X,من یک دونات می‌خورم.,I eat a donut.,,
run,A1,verb,دویدن,X,davidan,حرکتِ بسیار سریع با پاها,X,من می‌دوم.,I am running.,,
see,A1,verb,دیدَن,X,didan,نگاه کردن با چشم,X,من فیلم را می‌بینم.,I watch the movie.,,
visit,B1,noun,دیدنی,X,didani,جایی یا چیزی که دیدنش ارزش دارد,X,در سفر، از چند جای دیدنی بازدید کردیم.,"On the trip, we visited a few sights.",,
worth seeing,B1,adjective,دیدنی,X,didani,که دیدنش ارزش دارد,X,این موزه واقعاً دیدنی است.,This museum is really worth seeing.,,
yesterday,A1,adverb,دیروز,X,diruz,روزِ قبل از امروز,X,دیروز در خانه بودم.,Yesterday I was at home.,,
"other, another",A2,adjective,دیگر,X,digar,غیر از این,X,من یک اتاق دیگر می‌خواهم.,I want another room.,,
religion,A2,noun,دین,X,din,باورهای مذهبی,X,دین موضوع مهمی است.,Religion is an important issue.,,
wall,A1,noun,دیوار,X,divâr,بخشِ عمودی و محکمِ دورِ اتاق یا حیاط,X,دیوار سفید است.,The wall is white.,,
corn,A2,noun,ذرت,X,zorrat,دانهٔ زرد برای خوردن,X,ذرت را با نمک می‌خورم.,I eat corn with salt.,,
president,B2,noun,رئیس‌جمهور,X,ra'is-jomhur,بالاترین مقام اجراییِ منتخب در یک کشور,X,رئیس‌جمهور در سخنرانی‌اش گفت که کشور به اصلاحات واقعی نیاز دارد، نه شعارهای کوتاه.,"In his speech, the president said the country needs real reforms, not short slogans.",,
object marker,A1,particle,را,X,râ,نشانه برای نشان دادنِ مفعول در جمله,X,کتاب را روی میز بگذار.,Put the book on the table.,,
"comfortable, cozy",A1,adjective,راحت,X,râhat,دارای حسِ خوب و بدون سختی,X,این صندلی راحت است.,This chair is comfortable.,,
secret,B1,noun,راز,X,râz,حرفِ پوشیده‌ای که نباید به همه بگوییم,X,او این راز بزرگ را سال‌ها در قلبش نگه داشت و هرگز به هیچ‌کس نگفت که آن شب چه اتفاقی افتاد.,He kept this big secret in his heart for years and never told anyone what happened that night.,,
"straight, right",A1,adjective,راست,X,râst,مستقیم و بدون کج شدن,X,دست راست من درد می‌کند.,My right hand hurts.,,
thigh,B1,noun,ران,X,rân,قسمتِ بالای پا,X,بعد از تمرین سنگین، رانِ پایم درد گرفت.,"After a heavy workout, my thigh hurt.",,
solution,B1,noun,راه حل,X,râh-e hal,روشِ مناسب برای انجامِ کار,X,بهترین راه حل این است که دوباره شروع کنیم.,The best solution is to start again.,,
walk,A1,verb,راه رفتن,X,râh raftan,حرکت کردن با پاها روی زمین,X,من هر روز راه می‌روم.,I walk every day.,,
"railroad, railway",A2,noun,راه‌آهن,X,râh-âhan,راهِ قطار,X,قطار روی راه‌آهن حرکت می‌کند.,The train moves on the railway.,,
"hallway, corridor",B1,noun,راهرو,X,râhro,راهِ باریکِ داخلِ خانه یا ساختمان,X,در راهرو منتظر ماندم تا او از کلاس بیرون بیاید.,I waited in the hallway until he came out of the class.,,
guide,A2,noun,راهنما,X,râhnamâ,کسی که راه را نشان می‌دهد,X,این راهنما به من کمک کرد راه را پیدا کنم.,This guide helped me find the way.,,
"free, for free",A1,adjective,رایگان,X,râyegân,بدون پرداخت پول,X,این آب رایگان است.,This water is free.,,
"regime, diet",B1,noun,رژیم,X,režim,نوعی برنامه برای غذا یا حکومت,X,پزشک گفت رژیم من باید کم‌نمک باشد.,The doctor said my diet must be low in salt.,,
"go on a diet, diet",A2,verb,رژیم گرفتن,X,režim gereftan,کم خوردن برای کم کردنِ وزن,X,برای سلامتی رژیم می‌گیرم.,I’m going on a diet for my health.,,
restaurant,A1,noun,رستوران,X,restorân,جایی که غذا می‌فروشد و می‌پزیند,X,این آب در رستوران رایگان است.,This water is free in the restaurant.,,
growth,B1,noun,رشد,X,rošd,فرآیندِ بزرگ شدن و افزایشِ حجمِ یک موجود,X,نور کافی و خاک خوب، دو عامل اصلی برای رشد سریع گیاهان در گلخانه هستند.,Adequate light and good soil are the two main factors for the fast growth of plants in a greenhouse.,,
grow,B1,verb,رشد کردن,X,rošd kardan,بزرگ‌تر شدنِ طبیعیِ گیاه، حیوان یا انسان,X,این درختان در مناطق گرمسیری خیلی سریع رشد می‌کنند و در عرض یک سال به ارتفاع دو متر می‌رسند.,These trees grow very fast in tropical regions and reach a height of two meters within a year.,,
"go, leave",A1,verb,رفتن,X,raftan,حرکت کردن به یک جای دیگر,X,من به خانه می‌روم.,I go home.,,
"dance, dancing",A1,noun,رقص,X,raġs,حرکت با موسیقی,X,رقص در این کلاس خوب است.,Dancing is good in this class.,,
dance,A1,verb,رقصیدن,X,raġsidan,حرکت کردن با موسیقی,X,در عروسی می‌رقصم.,I dance at weddings.,,
Rome,A1,noun,رم,X,rom,پایتختِ ایتالیا,X,رم در ایتالیا است.,Rome is in Italy.,,
code,B1,noun,رمز,X,ramz,کدِ محرمانه,X,برای ورود به برنامه، یک رمز لازم است.,"To enter the program, a code is required.",,
password,B1,noun,رمز عبور,X,ramz-e obur,رمز برای ورود به حساب,X,رمز عبورم را هر چند ماه عوض می‌کنم.,I change my password every few months.,,
"color, colour",A1,noun,رنگ,X,rang,چیزی که اسمِ ظاهرِ یک چیز را نشان می‌دهد,X,رنگِ این دیوار سفید است.,The color of this wall is white.,,
"colorful, colourful",A2,adjective,رنگی,X,rangi,دارای چند رنگ,X,این لباس خیلی رنگی است.,This outfit is very colorful.,,
"leader, supreme leader",B2,noun,رهبر,X,rahbar,کسی که در رأس یک گروه یا کشور تصمیم می‌گیرد,X,رهبر حزب گفت که تصمیم نهایی بعد از جلسه اعلام می‌شود.,The party leader said the final decision will be announced after the meeting.,,
leadership,A2,noun,رهبری,X,rahbari,کارِ راهبریِ یک گروه,X,رهبریِ خوب تیم را آرام نگه می‌دارد.,Good leadership keeps the team calm.,,
psyche,B2,noun,روان,X,ravân,ذهن و بخش درونیِ انسان,X,در این کتاب، نویسنده تلاش می‌کند لایه‌های پنهانِ روان را با مثال‌های ساده توضیح دهد.,"In this book, the author tries to explain the hidden layers of the psyche with simple examples.",,
psychiatrist,B2,noun,روان‌پزشک,X,ravân-pezešk,پزشکِ تخصصیِ سلامت روان,X,اگر بی‌خوابی و اضطراب ادامه پیدا کند، بهتر است با یک روان‌پزشک مشورت کنی.,"If insomnia and anxiety continue, it’s better to consult a psychiatrist.",,
psychological,B2,adjective,روانی,X,ravâni,مربوط به روان,X,او بعد از آن حادثه فشار روانی زیادی داشت و مدتی تمرکز کردن برایش سخت شد.,"After that incident, he was under a lot of psychological pressure, and for a while it was hard for him to concentrate.",,
spiritual,B2,adjective,روحانی,X,rowhâni,تجربهٔ دینی و درونی,X,او تجربه‌ای روحانی را توصیف کرد که با احساسات روزمره فرق داشت.,He described a spiritual experience that was different from everyday feelings.,,
clergyman,B1,noun,روحانی,X,rowhâni,روحانیِ دین,X,آن روحانی در مسجد دربارهٔ کمک به فقرا صحبت کرد.,That cleric spoke in the mosque about helping the poor.,,
river,A1,noun,رودخانه,X,rudxâne,راهِ آب در طبیعت,X,پل روی رودخانه است.,The bridge is over the river.,,
intestine,B2,noun,روده,X,rude,بخشی از دستگاه گوارش,X,جذب مواد مغذی در بدن عمدتا در بخش‌های مختلف روده کوچک انجام می‌شود.,The absorption of nutrients in the body occurs mainly in different parts of the small intestine.,,
day,A1,noun,روز,X,ruz,زمانِ ۲۴ ساعت,X,هر روز صبحانه می‌خورم.,Every day I eat breakfast.,,
newspaper,A1,noun,روزنامه,X,ruznâme,کاغذی که خبرهای روز را دارد,X,روزنامه را صبح می‌خوانم.,I read the newspaper in the morning.,,
village,A2,noun,روستا,X,rustâ,منطقه‌ای برای زندگی که کوچک‌تر از شهر است,X,در این روستا فقط ده خانواده زندگی می‌کنند و مغازه وجود ندارد.,Only ten families live in this village and there are no shops.,,
"bright, light",A2,adjective,روشن,X,rowšan,مکانی که نورِ کافی برای دیدنِ اجسام دارد,X,لامپ را روشن کن چون اتاق خیلی تاریک است و نمی‌توانم ببینم.,Turn on the light because the room is very dark and I cannot see.,,
oil,A2,noun,روغن,X,rowġan,مایع برای پختن یا سالاد,X,برای سالاد کمی روغن می‌ریزم.,"For the salad, I pour in a little oil.",,
"on, upon, above, over",A1,preposition,روی,X,ruy,حرف اضافه برای روی یک سطح,X,لیوان روی میز است.,The glass is on the table.,,
lung,B1,noun,ریه,X,riye,عضوی در بدن برای نفس کشیدن,X,دود برای ریه خیلی بد است.,Smoke is very bad for the lungs.,,
knee,A2,noun,زانو,X,zânu,مفصلِ وسطِ پا,X,زانویم درد می‌کند.,My knee hurts.,,
"language, tongue",A1,noun,زبان,X,zabân,وسیلهٔ حرف زدن و ارتباط,X,زبانِ من فارسی است.,My language is Persian.,,
sign language,B1,noun,زبان اشاره,X,zabân-e ešâre,روشِ حرف زدن با دست‌ها,X,دوستم زبان اشاره یاد می‌گیرد تا با برادر ناشنوایش راحت‌تر صحبت کند.,My friend is learning sign language so he can talk more easily with his deaf brother.,,
linguistics,B2,noun,زبان‌شناسی,X,zabân-šenâsi,دانشِ بررسیِ زبان,X,او زبان‌شناسی را انتخاب کرد چون می‌خواست بفهمد چرا زبان‌ها این‌قدر شبیه هم هستند و در عین حال فرق دارند.,He chose linguistics because he wanted to understand why languages are so similar and yet different.,,
gold,C,noun,زر,X,zar,فلز گران‌بها با رنگ زرد,X,زر در این متن نمادِ ثروت است، نه صرفاً یک فلز.,"In this text, zar is a symbol of wealth, not merely a metal.",,
yellow,A1,adjective,زرد,X,zard,دارای رنگِ موز,X,زرد رنگِ موز است.,Yellow is the color of a banana.,,
"clever, smart",B1,adjective,زرنگ,X,zerang,باهوش و سریع در کار,X,او دانش‌آموز زرنگی است و همیشه مسائل سخت ریاضی را سریع حل می‌کند.,He is a smart student and always solves difficult math problems quickly.,,
ugly,A2,adjective,زشت,X,zešt,زشت و بدشکل,X,آن فیلم خیلی زشت بود.,That movie was very ugly.,,
time,A2,noun,زمان,X,zamân,وقتی که ساعت نشان می‌دهد,X,در زمان قدیم مردم ساده‌تر بودند.,"In ancient times, people were simpler.",,
earth,A1,noun,زمین,X,zamin,جایی که روی آن زندگی می‌کنیم,X,زمین زیر پای ما است.,The earth is under our feet.,,
"woman, wife",A1,noun,زن,X,zan,آدمِ بزرگِ مونث,X,آن زن مادر است.,That woman is a mother.,,
"woman's, womanly, feminine",A2,adjective,زنانه,X,zanâna,مربوط به زن,X,این کیف زنانه است.,This is a woman's bag.,,
bee,A2,noun,زنبور,X,zanbur,حشره‌ای که نیش می‌زند,X,یک زنبور روی گل نشست.,A bee landed on a flower.,,
honeybee,B1,noun,زنبور عسل,X,zanbur-e 'asal,حشره‌ای که عسل می‌سازد,X,یک زنبور عسل روی گل نشست و شهد جمع کرد.,A honeybee landed on the flower and collected nectar.,,
queen bee,B2,noun,زنبور ملکه,X,zanbur-e malake,مادهٔ تخم‌گذارِ اصلی در کندو,X,زنبور ملکه اگر از بین برود، کندو به‌تدریج از هم می‌پاشد.,"If the queen bee is lost, the hive gradually falls apart.",,
"prison, jail",B1,noun,زندان,X,zendân,جایی برای نگهداریِ قانون‌شکنان,X,دزد پس از دادگاه به پنج سال زندان محکوم شد.,The thief was sentenced to five years in prison after the trial.,,
prisoner,B1,noun,زندانی,X,zendâni,کسی که به خاطرِ جرم در حبس است,X,زندانی از طریق پنجره کوچک سلول به بیرون می‌نگریست.,The prisoner looked out through the small window of his cell.,,
life,A1,noun,زندگی,X,zendegi,چیزهایی که بین تولد و مرگ می‌گذرد,X,زندگی در اسلو آرام است.,Life in Oslo is calm.,,
live,A1,verb,زندگی کردن,X,zendegi kardan,بودن و کار کردن در دنیا,X,من در اسلو زندگی می‌کنم.,I live in Oslo.,,
biography,B1,noun,زندگی‌نامه,X,zendegi-nâme,کتابِ زندگیِ یک شخص,X,من زندگی‌نامهٔ او را خواندم و فهمیدم چرا این‌قدر سخت‌کوش است.,I read his biography and understood why he is so hardworking.,,
force,B1,noun,زور,X,zur,قدرتِ فیزیکی برای تکان دادن یا فشار به چیزی,X,این کار با زور درست نمی‌شود.,This won’t work by force.,,
"a lot of, much, many",A1,adjective,زیاد,X,ziyâd,به مقدارِ زیاد,X,شکر در چای زیاد است.,There is too much sugar in the tea.,,
zipper,A2,noun,زیپ,X,zip,وسیله‌ای برای بستن لباس,X,زیپ کاپشن من خراب شده است و دیگر بسته نمی‌شود.,The zipper on my jacket is broken and won't close anymore.,,
olive,A2,noun,زیتون,X,zeytun,میوهٔ کوچک و شور,X,زیتون را با پنیر می‌خورم.,I eat olives with cheese.,,
"under, underneath, below, beneath",A1,preposition,زیر,X,zir,حرف اضافه برای پایینِ یک چیز,X,کفش زیر تخت است.,The shoes are under the bed.,,
because,B1,conjunction,زیرا,X,zirâ,برای بیانِ علت,X,من امروز نیامدم زیرا مریض بودم.,I didn’t come today because I was sick.,,
life,B2,noun,زیست,X,zist,زندگی از دید علمی,X,در گزارش نوشت که زیستِ مردمِ آن منطقه به آب و هوا و کشاورزی وابسته است.,In the report he wrote that the life of the people in that region depends on the climate and agriculture.,,
biology,B2,noun,زیست‌شناسی,X,zist-šenâsi,دانشِ بررسیِ موجودات زنده,X,من زیست‌شناسی را دوست دارم چون رابطهٔ بدن با محیط را توضیح می‌دهد.,I like biology because it explains the relationship between the body and the environment.,,Duplicate
live,B2,verb,زیستن,X,zistan,زندگی کردن,X,گاهی آدم فقط زیستن را ادامه می‌دهد، بدون این‌که بداند برای چه چیزی می‌جنگد.,Sometimes a person just keeps living without knowing what they are fighting for.,,
Japan,A1,noun,ژاپن,X,žâpon,کشوری در شرقِ آسیا,X,ژاپن یک کشور دور است.,Japan is a faraway country.,,
Japanese,A1,adjective,ژاپنی,X,žâponi,مربوط به آن کشور در شرقِ آسیا,X,او ژاپنی است و ژاپنی حرف می‌زند.,He is Japanese and speaks Japanese.,,
jacket,A1,noun,ژاکت,X,žâkat,لباسِ گرم برای روی لباس,X,وقتی سرد است، ژاکت می‌پوشم.,"When it’s cold, I wear a jacket.",,
ham,A2,noun,ژامبون,X,žâmbon,گوشتِ نمکیِ ران,X,من در ساندویچ ژامبون می‌گذارم.,I put ham in the sandwich.,,
January,A1,noun,ژانویه,X,žânviye,ماهِ اولِ سالِ میلادی,X,ژانویه ماهِ یک است.,January is the first month.,,
June,A1,noun,ژوئن,X,žu'an,ماهِ ششمِ سالِ میلادی,X,ژوئن ماهِ شش است.,June is the sixth month.,,
July,A1,noun,ژوئیه,X,žu'iye,ماهِ هفتمِ سالِ میلادی,X,ژوئیه ماهِ هفت است.,July is the seventh month.,,
question,A1,noun,سؤال,X,so'âl,چیزی که برای دانستن می‌پرسیم,X,یک سؤال دارم، ساعت چند است؟,"I have a question, what time is it?",,
