English,CEFR,gender,word,wordAudio,pronunciation,sentenceAudio,example,sentenceTranslation,
"a bit, a little, a little bit",A1,adverb,کمی,X,kami,X,کمی آب می‌خواهم.,I want a little water.,
"a lot of, much, many",A1,adjective,زیاد,X,ziyâd,X,من زیاد آب می‌نوشم.,I drink a lot of water.,
"a, an, one",A1,numeral,یک,X,yek,X,من یک کتاب دارم.,I have a book.,
about,A2,preposition,درباره,X,darbâre,X,او درباره کارش حرف زد.,He talked about his work.,
about,A2,preposition,درباره,X,darbâre-ye,X,می‌خواهم درباره سفر صحبت کنم.,I want to talk about travel.,
address,A1,noun,آدرس,X,âdres,X,آدرس من این است.,This is my address.,
Africa,A1,noun,آفریقا,X,âfriġâ,X,آفریقا بزرگ است.,Africa is big.,
after,A1,preposition,بعد از,X,ba'd az,X,بعد از کلاس می‌روم.,I go after class.,
afternoon,A1,noun,بعد از ظهر,X,ba'd az zohr,X,بعد از ظهر در خانه هستم.,In the afternoon I am at home.,
"afternoon, evening",A1,noun,عصر,X,asr,,,,
"again, twice",A1,adverb,دوباره,X,dobâre,X,دوباره بگو.,Say it again.,
age,A2,noun,سن,X,senn,X,سن تو چند است؟,How old are you?,
"ahead, forward",A2,adverb,جلو,X,jelow,,,,
airport,A2,noun,فرودگاه,X,forudgâh,X,فرودگاه از اینجا دور است.,The airport is far from here.,
all,A2,adjective,همهٔ,X,hame-ye,X,همهٔ مردم اینجا هستند.,All the people are here.,
alphabet,A2,noun,الفبا,X,alefbâ,X,من الفبای فارسی را یاد می‌گیرم.,I am learning the Persian alphabet.,
"also, too",A1,adverb,هم,X,ham,X,من هم می‌آیم.,I’m coming too.,
always,A1,adverb,همیشه,X,hamiše,X,من همیشه اینجا هستم.,I am always here.,
America,A1,noun,آمریکا,X,âmrikâ,X,آمریکا بزرگ است.,America is big.,
and,A1,conjunction,و,X,"va, o",X,من و تو دوست هستیم.,You and I are friends.,
"angry, nervous",A2,adjective,عصبانی,X,asabâni,X,او از دستِ من عصبانی است.,He is angry with me.,
animal,A1,noun,حیوان,X,heyvân,X,این حیوان بزرگ است.,This animal is big.,
"answer, respond, reply",A2,verb,پاسخ دادن,X,pâsox dâdan,X,لطفاً به سؤال من پاسخ بده.,Please answer my question.,
"answer, response, reply",A2,noun,پاسخ,X,pâsox,X,جواب تو را می‌خواهم، نه سکوت.,"I want your answer, not silence.",
apple,A1,noun,سیب,X,sib,X,این سیب قرمز است.,This apple is red.,
April,A1,noun,آوریل,X,âvril,X,آوریل ماهِ چهار است.,April is month four.,
arm,A1,noun,بازو,X,bâzu,X,بازوی من درد می‌کند.,My arm hurts.,
armed,B2,adjective,مسلح,X,mosallah,X,نیروهای مسلح وارد ساختمان شدند و همه را بیرون آوردند.,Armed forces entered the building and escorted everyone out.,
armed,C,adjective,مسلحانه,X,mosallahâne,X,ورود مسلحانه به اماکن عمومی، طبق قانون جرم سنگینی محسوب می‌شود.,Armed entry into public places is considered a serious crime under the law.,
ask,A2,verb,پرسیدن,X,porsidan,X,می‌توانم یک سؤال بپرسم؟,May I ask a question?,
atheist,B2,noun,آتئیست,X,âte'ist,X,او خودش را آتئیست معرفی می‌کند، اما می‌گوید دربارهٔ باور دیگران قضاوت نمی‌کند.,"He introduces himself as an atheist, but says he doesn’t judge other people’s beliefs.",
atom,B2,noun,اتم,X,atom,X,اتم کوچک‌ترین بخشِ یک عنصر نیست، اما برای فهم بسیاری از پدیده‌ها نقطهٔ شروع خوبی است.,"An atom isn’t the smallest part of an element, but it’s a good starting point for understanding many phenomena.",
atomic,B2,adjective,اتمی,X,atomi,X,بحث دربارهٔ انرژی اتمی می‌تواند هم علمی باشد و هم سیاسی.,Discussion about nuclear energy can be both scientific and political.,
atomic bomb,B2,noun,بمب اتمی,X,bomb-e atomi,X,تهدید به استفاده از بمب اتمی معمولاً برای ترساندن طرف مقابل است، نه برای حل مسئله.,"Threatening to use an atomic bomb is usually meant to frighten the other side, not to solve the problem.",
attack,B1,noun,حمله,X,hamle,X,بعد از آن حمله، مردم برای مدتی از شب بیرون نمی‌رفتند.,"After that attack, people didn’t go out at night for a while.",
attractive,B1,adjective,جذاب,X,jazzâb,X,او با حرف‌های آرام و نگاه مستقیمش برای خیلی‌ها جذاب بود.,"With his calm words and direct gaze, he was attractive to many people.",
August,A1,noun,آگوست,X,âgost,X,آگوست ماهِ هشت است.,August is month eight.,
Austria,A2,noun,اتریش,X,otriš,X,اتریش در اروپا است.,Austria is in Europe.,
automatic,B1,adjective,خودکار,X,xodkâr,X,این در خودکار است و خودش بسته می‌شود.,This door is automatic and it closes by itself.,
automotive,B1,adjective,خودرو,X,xodrow,X,او در یک شرکت خودرویی کار می‌کند و دربارهٔ ماشین‌ها زیاد می‌داند.,He works at an automotive company and knows a lot about cars.,
"autumn, fall",A1,noun,پاییز,X,pâyiz,X,پاییز سرد است.,Autumn is cold.,
avocado,A2,noun,آووکادو,X,âvokâdo,X,برای صبحانه آووکادو می‌خورم.,I eat avocado for breakfast.,
awake,A1,adjective,بیدار,X,bidâr,X,من بیدار هستم.,I’m awake.,
away,A2,adverb,دور,X,dur,X,خانهٔ ما از مدرسه دور است.,Our house is far from the school.,
"baby, newborn",A2,noun,نوزاد,X,nowzâd,X,نوزاد خیلی کوچک است.,The baby is very small.,
bacon,A2,noun,بیکن,X,beyken,X,من بیکن نمی‌خورم.,I don’t eat bacon.,
bad,A1,adjective,بد,X,bad,X,غذا بد است.,The food is bad.,
bag,A1,noun,کیسه,X,kise,X,کیسه روی تخت است.,The bag is on the bed.,
baker,B1,noun,نانوا,X,nânvâ,X,نانوا صبح زود نان تازه می‌پزد.,The baker bakes fresh bread early in the morning.,
bakery,B1,noun,نانوایی,X,nânvâyi,X,این نانوایی نان گرم و شیرینی تازه دارد.,This bakery has warm bread and fresh pastries.,
balance,B1,noun,تعادل,X,ta'âdol,X,برای سلامتی باید بین کار و استراحت تعادل داشته باشیم.,"For our health, we should keep a balance between work and rest.",
ball,A1,noun,توپ,X,tup,X,این توپ قرمز است.,This ball is red.,
banana,A1,noun,موز,X,mowz,X,موز زرد است.,The banana is yellow.,
bar,A2,noun,بار,X,bâr,X,ما امشب به یک بار می‌رویم.,Tonight we are going to a bar.,
"barber, hairdresser, hairstylist",A2,noun,آرایشگر,X,ârâyešgar,,,,
barley,B1,noun,جو,X,jow,X,برای صبحانه جو پختم و با کمی نمک خوردم.,For breakfast I cooked barley and ate it with a little salt.,
bastard,C,noun,حرام‌زاده,X,harâm-zâde,X,در دادگاه، قاضی به او اخطار داد که به‌جای گفتن «حرام‌زاده»، دربارهٔ رفتارِ طرف مقابل حرف بزند.,"In court, the judge warned him that instead of saying “bastard,” he should talk about the other party’s behavior.",
bathe,A1,verb,حمام کردن,X,hammâm kardan,X,من حمام می‌کنم.,I am taking a bath.,
"bathroom, bath",A1,noun,حمام,X,hammâm,X,حمام در خانه است.,The bathroom is in the house.,
be,A1,verb,بودن,X,budan,X,من هستم.,I am.,
"beautiful, pretty",A2,adjective,خوشگل,X,xošgel,X,او خیلی خوشگل است.,She is very pretty.,
because,B1,conjunction,زیرا,X,zirâ,X,من امروز نیامدم زیرا مریض بودم.,I didn’t come today because I was sick.,
"because, since",A2,conjunction,چون,X,čun,X,چون باران می‌بارد، بیرون نمی‌روم.,"Because it’s raining, I’m not going out.",
"become, get",A1,verb,شُدَن,X,šodan,X,هوا سرد شد.,The weather has become cold.,
bed,A1,noun,تخت,X,taxt,X,تخت من راحت است.,My bed is comfortable.,
bedroom,A1,noun,اتاق خواب,X,otâq-e xâb,X,اتاق خواب من کوچک است.,My bedroom is small.,
beef,A1,noun,گوشت گاو,X,gušt-e gâv,X,من گوشت گاو نمی‌خورم.,I don't eat beef.,
beer,A2,noun,آبجو,X,âbjow,X,در این رستوران آبجو هم دارند.,They have beer at this restaurant too.,
before,A1,preposition,قبل از,X,qabl az,X,قبل از کار، صبحانه می‌خورم.,"Before work, I eat breakfast.",
behind,A1,preposition,پشت,X,pošt-e,X,کیف پشت صندلی است.,The bag is behind the chair.,
Belgian,A2,adjective,بلژیکی,X,belžiki,,,,او یک بلژیکی است.
Belgium,A2,noun,بلژیک,X,belžik,X,بلژیک کشور کوچکی است.,Belgium is a small country.,
belt,A2,noun,کمربند,X,kamarband,X,او کمربند مشکی دارد.,He has a black belt.,
berry,A2,noun,توت,X,tut,X,این توت‌ها خیلی شیرین‌اند.,These berries are very sweet.,
best,A2,adjective,بهترین,X,behtarin,X,این بهترین کافه در این خیابان است.,This is the best café on this street.,
between,A1,preposition,بین,X,beyn,X,کتاب بین دو میز است.,The book is between two tables.,
"big, large, great",A1,adjective,بزرگ,X,bozorg,X,خانه بزرگ است.,The house is big.,
"biggest, largest, greatest",A2,adjective,بزرگترین,X,bozorg-tarin,X,این بزرگترین اتاقِ خانه است.,This is the biggest room in the house.,
"bike, bicycle",A1,noun,دوچرخه,X,dočarxe,X,این دوچرخه مالِ من است.,This bicycle is mine.,
biography,B1,noun,زندگی‌نامه,X,zendegi-nâme,X,من زندگی‌نامهٔ او را خواندم و فهمیدم چرا این‌قدر سخت‌کوش است.,I read his biography and understood why he is so hardworking.,
bird,A1,noun,پرنده,X,parande,X,آن پرنده سفید است.,That bird is white.,
"birthday, birth",A1,noun,تولد,X,tavallod,X,امروز تولد من است.,Today is my birthday.,
black,A1,adjective,سیاه,X,siyâh,X,سگ سیاه است.,The dog is black.,
blue,A1,adjective,آبی,X,âbi,X,دریا آبی است.,The sea is blue.,
boat,A1,noun,قایق,X,ġâyeġ,X,قایق روی آب است.,The boat is on the water.,
bomb,B1,noun,بمب,X,bomb,X,پلیس گفت یک بمب در ساختمان پیدا کرده‌اند.,The police said they found a bomb in the building.,
bomber,C,noun,بمب‌گذار,X,bomb-gozâr,X,دادستان ادعا کرد بمب‌گذار با انگیزهٔ سیاسی عمل کرده است، اما دفاعیه شواهد را ناکافی دانست.,"The prosecutor claimed the bomber acted with a political motive, but the defense considered the evidence insufficient.",
bone,A2,noun,استخوان,X,ostoxân,X,سگ یک استخوان پیدا کرد.,The dog found a bone.,
book,A1,noun,کتاب,X,ketâb,X,کتاب روی میز است.,The book is on the table.,
bottle,A1,noun,بطری,X,botri,X,این بطری آب است.,This is a bottle of water.,
bowl,A2,noun,کاسه,X,kâse,X,سوپ را در کاسه می‌ریزم.,I pour the soup into a bowl.,
"boy, son",A1,noun,پسر,X,pesar,X,او یک پسر است.,He is a boy.,
"brazier, firepot",C,noun,آتشدان,X,âtašdân,X,آتشدانِ برنجیِ وسطِ حیاط، شب‌ها را روشن و دورهمی را گرم می‌کرد.,The brass brazier in the middle of the yard lit up the nights and warmed the gathering.,
Brazil,A2,noun,برزیل,X,berezil,X,برزیل کشور بزرگی است.,Brazil is a big country.,
bread,A1,noun,نان,X,nân,X,من نان می‌خورم.,I eat bread.,
breakfast,A1,noun,صبحانه,X,sobhâne,X,من صبحانه می‌خورم.,I eat breakfast.,
bridge,A1,noun,پل,X,pol,X,این پل بزرگ است.,This bridge is big.,
bring,A2,verb,آوردن,X,âvardan,X,می‌توانی یک لیوان آب برای من بیاوری؟,Can you bring me a glass of water?,
brother,A1,noun,برادر,X,barâdar,X,برادر من کوچک است.,My brother is small.,
brown,A1,adjective,قهوه‌ای,X,qahve-yi,X,این کیف قهوه‌ای است.,This bag is brown.,
builder,B2,noun,سازنده,X,sâzande,X,سازنده قول داد تا آخر ماه همهٔ نقص‌ها را برطرف کند.,The builder promised to fix all the defects by the end of the month.,
building,A2,noun,ساختمان,X,sâxtemân,X,این ساختمان خیلی قدیمی است.,This building is very old.,
bus,A1,noun,اتوبوس,X,otobus,X,اتوبوس دیر آمد.,The bus is late.,
bus stop,A2,noun,ایستگاه اتوبوس,X,istgâh-e otobus,X,ایستگاه اتوبوس نزدیک خانه است.,The bus stop is near the house.,
but,A1,conjunction,ولی,X,vali,X,او خسته است ولی می‌خندد.,He is tired but laughing.,
butter,A1,noun,کره,X,kare,X,کره روی نان است.,The butter is on the bread.,
button,A2,noun,دکمه,X,dokme,X,این دکمه را فشار بده.,Press this button.,
buy,A1,verb,خرید,X,xaridan,X,من نان می‌خرم.,I buy bread.,
"by, through",B1,preposition,توسط,X,tavassot-e,X,این گزارش توسط مدیر نوشته شد.,This report was written by the manager.,
cabbage,A1,noun,کلم,X,kalam,X,کلم سبز است.,The cabbage is green.,
"café, cafe",A1,noun,کافه,X,kâfe,X,ما در کافه هستیم.,We are in a cafe.,
cake,A1,noun,کیک,X,keyk,X,کیک خوشمزه است.,The cake is delicious.,
calendar,A2,noun,تقویم,X,taqvim,X,من در تقویم نگاه می‌کنم.,I look at the calendar.,
call,A2,verb,تماس گرفتن,X,tamâs gereftan,,,,
camera,A2,noun,دوربین,X,durbin,X,من با دوربین عکس می‌گیرم.,I take photos with a camera.,
Canada,A1,noun,کانادا,X,kânâdâ,X,کانادا یک کشور است.,Canada is a country.,
"candy, sweets",A2,noun,آبنبات,X,âbnabât,X,من یک آبنبات در کیفم دارم.,I have a candy in my bag.,
"capital city, capital",A2,noun,پایتخت,X,pâytaxt,X,تهران پایتخت ایران است.,Tehran is the capital of Iran.,
"car, machine",A2,noun,ماشین,X,mâšin,X,ماشین من امروز روشن نمی‌شود.,My car won’t start today.,
card,A2,noun,کارت,X,kârt,X,کارت من در کیف است.,My card is in my wallet.,
cardiac,B2,adjective,قلبی,X,qalbi,X,پزشک گفت مشکل قلبیِ او فعلاً خطرناک نیست، اما باید پیگیری شود.,"The doctor said his heart problem isn’t dangerous for now, but it needs follow-up.",
carrot,A1,noun,هویج,X,havij,X,هویج نارنجی است.,The carrot is orange.,
cat,A1,noun,گربه,X,gorbe,X,گربه خوابیده است.,The cat is sleeping.,
CD,A1,noun,سی‌دی,X,si di,X,این سی‌دی مالِ من است.,This CD is mine.,
"cell phone, mobile, mobile phone ",A1,noun,تلفن همراه,X,telefon-e hamrâh,X,این تلفن همراه مالِ من است.,This cell phone is mine.,
"centimeter, centimetre",A1,noun,سانتی‌متر,X,sânti-metr,X,این ده سانتی‌متر است.,This is ten centimeters.,
Central America,B1,noun,آمریکای مرکزی,X,âmrikâ-ye markazi,X,آمریکای مرکزی چند کشور کوچک و گرم دارد.,"Central America has several small, warm countries.",
chair,A1,noun,صندلی,X,sandali,X,این صندلی راحت است.,This chair is comfortable.,
"cheap, inexpensive",A2,adjective,ارزان,X,arzân,X,این مغازه ارزان است.,This shop is cheap.,
cheek,A2,noun,گونه,X,gune,X,گونه‌هایش قرمز شد.,His cheeks turned red.,
cheese,A1,noun,پنیر,X,panir,X,پنیر روی نان است.,The cheese is on the bread.,
"chicken, hen",A1,noun,مرغ,X,morġ,X,مرغ گرم است.,The chicken is hot.,
child,A1,noun,بَچه,X,bačče,X,بَچه می‌خندد.,The child is laughing.,
China,A1,noun,چین,X,čin,X,چین بزرگ است.,China is big.,
Chinese,A1,adjective,چینی,X,čini,,,,
Chinese,A1,noun,چینی,X,čini,,,,
"chips, crisps",A1,noun,چیپس,X,čips,X,من چیپس می‌خورم.,I eat chips.,
chocolate,A1,noun,شکلات,X,šokolât,X,من شکلات دوست دارم.,I like chocolate.,
Christmas,A1,noun,کریسمس,X,kerismas,X,کریسمس امروز است.,Christmas is today.,
church,A2,noun,کلیسا,X,kelisâ,X,یک کلیسا نزدیک خانهٔ ما هست.,There is a church near our house.,
city,A1,noun,شهر,X,šahr,X,شهر بزرگ است.,The city is big.,
"city, town",A1,noun,شهر,X,šahr,X,این شهر بزرگ است.,This city is big.,
classroom,A1,noun,کلاس درس,X,kelâs-e dars,X,من در کلاس درس هستم.,I am in the classroom.,
"clean up, tidy up",A2,verb,مرتب کردن,X,morattab kardan,,,,
"clean, neat",A2,adjective,تمیز,X,tamiz,X,لطفاً اتاق را تمیز کن.,Please clean the room.,
"clean, pure",A2,adjective,پاک,X,pâk,X,لطفاً آب پاک بنوش.,Please drink clean water.,
clear,B1,adjective,واضح,X,vâzeh,,,,
climate,A2,noun,آب و هوا,X,âb-o-havâ,X,آب و هوای امروز گرم است.,Today's weather is hot.,
"close to, near",A1,preposition,نزدیکِ,X,nazdik,,,,
"close, shut",A1,verb,بستن,X,bastan,X,در را ببند.,Close the door.,
"closet, wardrobe",A2,noun,کمد,X,komod,X,لباس‌هایم در کمد است.,My clothes are in the closet.,
cloud,A1,noun,ابر,X,abr,X,ابر در آسمان است.,The cloud is in the sky.,
coffee,A1,noun,قهوه,X,qahve,X,من قهوه می‌نوشم.,I am drinking coffee.,
cold,A1,adjective,سرد,X,sard,X,سوپ سرد نیست.,The soup is not cold.,
"color, colour",A1,noun,رنگ,X,rang,X,این رنگ قرمز است.,This color is red.,
"colorful, colourful",A2,adjective,رنگی,X,rangi,X,این لباس خیلی رنگی است.,This outfit is very colorful.,
"colorless, colourless",B1,adjective,بی‌رنگ,X,bi-rang,X,او رنگِ بی‌رنگ را برای دیوار انتخاب کرد چون سلیقه‌اش ساده است.,He chose a colorless color for the wall because his taste is simple.,
colorlessness,B2,noun,بی‌رنگی,X,bi-rangi,X,بی‌رنگیِ اتاق حس سردی می‌داد، برای همین چند تابلو به دیوار زدند.,"The room’s colorlessness felt cold, so they put a few pictures on the wall.",
comb,A2,noun,شانه,X,šâne,X,موهایم را با شانه مرتب می‌کنم.,I comb my hair.,
comb,A2,verb,شانه کردن,X,šâne kardan,,,,
"come, arrive",A1,verb,آمدن,X,âmadan,X,من الان می‌آیم.,I’m coming now.,
"comfortable, cozy",A1,adjective,راحت,X,râhat,,,,
"commerce, trade",B1,noun,تجارت,X,tejârat,X,تجارت بین دو کشور در این سال‌ها بیشتر شده است.,Trade between the two countries has increased in recent years.,
"complete, perfect",A2,adjective,کامل,X,kâmel,X,این جواب کامل نیست.,This answer isn’t complete.,
computer,A1,noun,کامپیوتر,X,kâmpyuter,X,کامپیوتر روشن است.,The computer is on.,
"condition, health",A2,noun,حال,X,hâl,X,حال تو چطور است؟,How are you?,
congratulate,A2,verb,تبریک گفتن,X,tabrik goftan,,,,
converse,B1,verb,گفتگو کردن,X,goftogu kardan,X,بهتر است قبل از تصمیم گرفتن، با هم گفتگو کنیم و همهٔ گزینه‌ها را ببینیم.,It’s better to talk it through together before deciding and look at all the options.,
"cook, bake",A2,verb,پختن,X,poxtan,,,,
"cook, chef",A2,noun,آشپز,X,âšpaz,X,آشپز در رستوران کار می‌کند.,The cook works in the restaurant.,
Copenhagen,A2,noun,کپنهاگ,X,kopenhâg,X,کپنهاگ پایتخت دانمارک است.,Copenhagen is the capital of Denmark.,
corn,A2,noun,ذرت,X,zorrat,X,ذرت را با نمک می‌خورم.,I eat corn with salt.,
"correct, right",A1,adjective,درست,X,dorost,,,,
cough,A2,verb,سرفه کردن,X,sorfe kardan,,,,
count,A2,verb,شمردن,X,šomordan,,,,
"country, land",A1,noun,کشور,X,kešvar,X,ایران کشور زیبایی است.,Iran is a beautiful country.,
"county, countryside",B1,noun,شهرستان,X,šahrestân,X,این شهرستان از شهر دور است و طبیعت زیبایی دارد.,This county is far from the city and has beautiful nature.,
cow,A1,noun,گاو,X,gâv,X,گاو در مزرعه است.,The cow is on the farm.,
Croatia,A2,noun,کرواسی,X,korovâsi,X,کرواسی کشور زیبایی است.,Croatia is a beautiful country.,
crown,B1,noun,تاج,X,tâj,X,روی تاجِ پادشاه سنگ‌های قیمتی بود.,There were precious stones on the king’s crown.,
cry,A2,verb,گریه کردن,X,gerye kardan,,,,
cucumber,A1,noun,خیار,X,xiyâr,X,خیار سبز است.,The cucumber is green.,
cup,A1,noun,فنجان,X,fenjân,X,یک فنجان چای می‌خواهم.,I want a cup of tea.,
dad,A1,noun,بابا,X,bâbâ,X,بابا در خانه است.,Dad is at home.,
dance,A1,verb,رقصیدن,X,raġsidan,,,,
"dance, dancing",A1,noun,رقص,X,raġs,,,,
data,B1,noun,داده‌ها,X,dâde-hâ,,,,
date of birth,A1,noun,تاریخ تولد,X,târix-e tavallod,X,تاریخ تولد من این است.,My date of birth is this.,
"date, history",A2,noun,تاریخ,X,târix,,,,
day,A1,noun,روز,X,ruz,X,امروز روز خوبی است.,Today is a nice day.,
"dear, soul, life",A2,noun,جان,X,jân,X,جان من، بیا اینجا.,"My dear, come here.",
December,A1,noun,دسامبر,X,desâmbr,X,دسامبر ماهِ دوازده است.,December is month twelve.,
Denmark,A2,noun,دانمارک,X,dânmârk,,,,
dentist,B1,noun,دندان‌پزشک,X,dandân-pezešk,X,برای درد دندان باید به دندان‌پزشک مراجعه کنی، نه این‌که فقط مسکن بخوری.,"For tooth pain, you should see a dentist, not just take painkillers.",
desert,B1,noun,بیابان,X,biyâbân,X,در بیابان پیدا کردن آب سخت است و آدم باید همیشه آماده باشد.,"In the desert, finding water is hard, and you always have to be prepared.",
"dick, cock",C,noun,کیر,X,kêr,X,قاضی گفت به‌کار بردن واژهٔ «کیر» در جلسهٔ رسمی توهین‌آمیز است و عواقب حقوقی دارد.,The judge said using the word “dick” in an official session is insulting and has legal consequences.,
dictionary,B1,noun,لغت‌نامه,X,loġat-nâme,X,برای معنی دقیق این واژه، به لغت‌نامه مراجعه کردم.,"For the exact meaning of this word, I consulted a dictionary.",
die,A2,verb,مردن,X,mordan,,,,
"dinner, supper",A1,noun,شام,X,šâm,,,,
dirty,B1,adjective,چرکین,X,čerkin,X,بعد از سفر طولانی، لباس‌ها چرکین شد و مجبور شدم همه را بشویم.,"After the long trip, the clothes got dirty and I had to wash them all.",
dirty,A2,adjective,کثیف,X,kasif,X,این لیوان کثیف است.,This glass is dirty.,
dish,A2,noun,ظرف,X,zarf,,,,
disrespectful,B2,adjective,بی‌احترامی,X,bi-ehtarâmi,X,رفتار بی‌احترامی او باعث شد چند نفر جلسه را ترک کنند.,His disrespectful behavior made a few people leave the meeting.,
"divide, share, split",B1,verb,تقسیم کردن,X,taqsim kardan,,,,
"do, make",A1,verb,كَردَن,X,kardan,X,من این کار می‌کنم,I do this.,
"doctor, physician",A2,noun,پزشک,X,pezešk,X,پزشک گفت که باید بیشتر بخوابم.,The doctor said I should sleep more.,
dog,A1,noun,سگ,X,sag,X,سگ کوچک است.,The dog is small.,
doll,A2,noun,عروسک,X,arusak,,,,
"donut, doughtnut",A1,noun,دونات,X,donât,,,,
door,A1,noun,در,X,dar,X,در بسته است.,The door is closed.,
dream,A2,verb,خواب دیدن,X,xâb didan,,,,
"dream, sleep",A1,noun,خواب,X,xâb,,,,
"dress, put on",A1,verb,پوشیدن,X,pušidan,X,من پیراهن می‌پوشم.,I put on a shirt.,
drink,A1,verb,نوشیدن,X,nušidan,X,من آب می‌نوشم.,I drink water.,
duck,A2,noun,اردک,X,ordak,,,,
"each other, one another",A2,pronoun,همدیگر,X,hamdigar,X,ما همدیگر را در مدرسه دیدیم.,We saw each other at school.,
"each other, one another",B1,pronoun,یکدیگر,X,yekdigar,X,ما یکدیگر را از دانشگاه می‌شناسیم.,We know each other from university.,
ear,A1,noun,گوش,X,guš,X,گوش من درد می‌کند.,My ears hurt.,
earth,A1,noun,زمین,X,zamin,,,,
"ease, convenience",B1,noun,آسانی,X,âsâni,X,با این برنامه‌ریزی، کارها با آسانی بیشتری پیش می‌رود.,"With this planning, things go more smoothly.",
east,A2,noun,شرق,X,šarġ,X,خانهٔ ما در شرق شهر است.,Our house is in the east of the city.,
eastern,A2,adjective,شرقی,X,šarġi,X,این یک غذای شرقی است.,This is an Eastern dish.,
easy,A2,adjective,آسان,X,âsân,X,این کار آسان است.,This is easy.,
eat,A1,verb,خوردن,X,xordan,X,من سیب می‌خورم.,I am eating an apple.,
effort,B1,noun,کوشش,X,kušeš,X,با کوشش می‌توانی زبان را بهتر یاد بگیری.,"With effort, you can learn the language better.",
egg,A1,noun,تخم مرغ,X,toxm-e morġ,X,من تخم مرغ می‌خورم.,I eat eggs.,
