English,CEFR,gender,word,wordAudio,pronunciation,sentenceAudio,example,sentenceTranslation,
suck,B2,verb,مکیدن,X,mekidan,X,بچه عادت داشت انگشتش را می‌مکد و ترک کردنش زمان برد.,"The child used to suck his finger, and quitting it took time.",
sugar,A1,noun,شکر,X,šakar,,,,
suicidal,C,adjective,انتحاری,X,entehâri,X,روان‌پزشک در گزارش نوشت که افکار انتحاری او جدی است و باید فوراً تحت مراقبت قرار گیرد.,"In the report, the psychiatrist wrote that his suicidal thoughts are serious and that he must be placed under care immediately.",
suicide,C,noun,انتحار,X,entehâr,X,پرونده نشان می‌داد که انتحار نه از روی تصمیم ناگهانی، بلکه پس از ماه‌ها فشار روانی رخ داده است.,"The case showed that the suicide was not a sudden decision, but happened after months of psychological pressure.",
suicide,B2,noun,خودکشی,X,xod-koši,X,صحبت دربارهٔ خودکشی باید جدی گرفته شود و با کمک حرفه‌ای همراه باشد.,Talking about suicide must be taken seriously and accompanied by professional help.,
"summer, summertime",A1,noun,تابستان,X,tâbestân,X,تابستان گرم است.,Summer is warm.,
sun,A1,noun,خورشید,X,xoršid,,,,
Sunday,A1,noun,یکشنبه,X,yek-šanbe,X,یکشنبه من در خانه هستم.,On Sunday I’m at home.,
survive,C,verb,برزیستن,X,barzistan,X,در آن زمستانِ بی‌رحم، خانواده با اندک نان و امیدی لاغر برزیست.,"In that merciless winter, the family survived on a little bread and a thin hope.",
sushi,A1,noun,سوشی,X,suši,,,,
sweater,A2,noun,پلیور,X,poliver,,,,
Sweden,A1,noun,سوئد,X,su'ed,,,,
Swedish,A1,adjective,سوئدی,X,su'edi,,,,
Swedish,A1,noun,سوئدی,X,su'edi,,,,
"sweet, pleasant",A2,adjective,شیرین,X,širin,X,این چای شیرین است.,This tea is sweet.,
sweeten,B1,verb,شیرین کردن,X,širin kardan,X,برای چای، کمی عسل اضافه کرد تا آن را شیرین کند.,"For the tea, he added a little honey to sweeten it.",
sweetness,A2,noun,شیرینی,X,širini,X,من شیرینی نمی‌خورم.,I don’t eat sweets.,
swim,A1,verb,شنا کردن,X,šenâ kardan,,,,
system,B1,noun,سیستم,X,sistem,,,,
T-shirt,A1,noun,تی‌شرت,X,ti-šert,X,این تی‌شرت من است.,This is my T-shirt.,
"table, desk",A1,noun,میز,X,miz,,,,
"take, get, catch",A2,verb,گرفتن,X,gereftan,X,من اتوبوس را از ایستگاه گرفتم.,I took the bus from the stop.,
"talk, speak",A2,verb,حرف زدن,X,harf zadan,X,من نمی‌توانم الان حرف بزنم.,I can’t talk now.,
"tall, high",A2,adjective,بلند,X,boland,X,آن پسر قدِ بلند دارد.,That boy is tall.,
"taste, flavor",A2,noun,مزه,X,maze,X,این غذا مزه خوبی دارد.,This food tastes good.,
"tasty, delicious",A1,adjective,خوش‌مزه,X,xoš-maze,X,این غذا خوش‌مزه است.,This food is tasty.,
taxi,A1,noun,تاکسی,X,tâksi,X,من تاکسی می‌گیرم.,I take a taxi.,
tea,A1,noun,چای,X,čây,X,من چای دوست دارم.,I like tea.,
teach,A2,verb,درس دادن,X,dars dâdan,,,,
teacher,A1,noun,معلم,X,mo'allem,X,معلم در کلاس است.,The teacher is in the classroom.,
Tehran,A1,noun,تهران,X,tehrân,X,تهران در ایران است.,Tehran is in Iran.,
television,A1,noun,تلویزیون,X,talwīzyūn,X,تلویزیون روشن است.,The television is on.,
ten,A1,numeral,ده,X,dah,X,من ده کتاب دارم.,I have ten books.,
thank,A1,verb,تشکر کردن,X,tašakkor kardan,X,من تشکر می‌کنم.,I say thank you.,
"thank you, thanks",A1,interjection,تشکر,X,tašakkor,X,تشکر!,Thanks!,
thanks,A1,interjection,مرسی,X,mersi,X,مرسی!,Thank you!,
that,A1,adjective,آن,X,ân,X,آن کتاب قشنگ است.,That book is beautiful.,
"that, who",A2,conjunction,که,X,ke,,,,
the ... the,B2,adverb,هرچه,X,harče,,,,
"the US, the United States of America",A2,noun,ایالات متحده آمریکا,X,eyâlât-e mottahede-ye âmrikâ,,,,
"theater, theatre",A2,noun,تئاتر,X,te'âtr,,,,
then,A1,adverb,بعد,X,ba'd,X,بعد می‌آیم.,I will come later.,
there,A1,adverb,آنجا,X,ânjâ,X,آنجا یک درخت است.,There is a tree there.,
they,A1,pronoun,آن‌ها,X,ân-hâ,X,آن‌ها اینجا هستند.,They are here.,
thigh,B1,noun,ران,X,rân,,,,
thing,A1,noun,چیز,X,čiz,X,این چیز خوبی است.,This is a good thing.,
thirsty,A1,adjective,تشنه,X,tešne,X,من تشنه‌ام.,I am thirsty.,
thirteen,A1,numeral,سیزده,X,sizdah,,,,
thirty,A1,numeral,سی,X,si,,,,
this,A1,pronoun,این,X,in,X,این ماشین من است.,This is my car.,
thousand,A1,noun,هزار,X,hazâr,,,,
three,A1,numeral,سه,X,se,X,من سه کتاب دارم.,I have three books.,
Thursday,A1,noun,پنجشنبه,X,panj-šanbe,X,پنجشنبه من کار می‌کنم.,On Thursday I work.,
ticket,A1,noun,بلیت,X,belit,X,من یک بلیت دارم.,I have a ticket.,
"tie, necktie",A2,noun,کراوات,X,kerâvât,X,او برای مهمانی کراوات زد.,He wore a tie for the party.,
time,A2,noun,زمان,X,zamân,X,در زمان قدیم مردم ساده‌تر بودند.,"In the old days, people were simpler.",
time,B2,noun,گاه,X,gâh,X,گاه آدم فکر می‌کند همه چیز دیر شده، اما هنوز وقت هست.,"Sometimes a person thinks everything is too late, but there is still time.",
"time, hour, clock, watch",A1,noun,ساعت,X,sâ'at,X,ساعت چند است؟,What time is it?,
"time, instance",B1,noun,بار,X,bâr,X,این بار می‌خواهم زودتر تصمیم بگیرم تا وقت تلف نشود.,This time I want to decide sooner so that time isn’t wasted.,
tired,A2,adjective,خسته,X,xaste,X,امروز خیلی خسته هستم.,I’m very tired today.,
"to, at",A1,preposition,به,X,be,X,من به مدرسه می‌روم.,I’m going to school.,
toast,A2,noun,نان تست,X,nân-e tost,X,صبح‌ها نان تست می‌خورم.,In the mornings I eat toast.,
today,A1,noun,امروز,X,emruz,X,امروز جمعه است.,Today is Friday.,
toe,A2,noun,انگشت پا,X,angošt-e pâ,X,انگشت پای من درد می‌کند.,My toe hurts.,
together,A1,adverb,با هم,X,bâ ham,X,ما با هم به خانه می‌رویم.,We are going home together.,
toilet,A1,noun,توالت,X,tovâlet,X,توالت آنجا است.,The toilet is there.,
tomato,A1,noun,گوجه‌فرنگی,X,gowje-farangi,X,گوجه‌فرنگی قرمز است.,The tomato is red.,
tomato sauce,A2,noun,سس گوجه‌فرنگی,X,sos-e gowje-farangi,X,برای پاستا سس گوجه‌فرنگی می‌خواهم.,I want tomato sauce for pasta.,
tomorrow,A1,adverb,فردا,X,fardâ,X,فردا می‌آیم.,I’ll come tomorrow.,
tonight,A1,adverb,امشب,X,emšab,X,امشب به سینما می‌روم.,Tonight I’m going to the cinema.,
tooth,A2,noun,دندان,X,dandân,X,دندان من درد می‌کند.,My tooth hurts.,
toothbrush,A1,noun,مسواک,X,mesvâk,X,مسواک در حمام است.,The toothbrush is in the bathroom.,
toothpaste,A1,noun,خمیر دندان,X,xamir dandân,X,خمیر دندان اینجاست.,The toothpaste is here.,
"topic, subject, theme",B1,noun,موضوع,X,mowzu',,,,
tourist,A2,noun,توریست,X,turist,X,او یک توریست از فرانسه است.,He is a tourist from France.,
touristy,A2,adjective,توریستی,X,turisti,X,اینجا خیلی توریستی است.,It’s very touristy here.,
"toward, towards",A2,preposition,به سمت,X,beh samt,X,من به سمت خانه می‌روم.,I am going toward home.,
towel,A1,noun,حوله,X,howle,X,حوله روی تخت است.,The towel is on the bed.,
town,B1,noun,شهرک,X,šahrak,X,آن‌ها به یک شهرک نزدیک تهران رفتند چون اجاره آنجا کمتر بود.,They went to a town near Tehran because the rent there was lower.,
toy,A1,noun,اسباب بازی,X,asbâb bâzi,X,این اسباب بازی مالِ من است.,This toy is mine.,
traffic light,A2,noun,چراغ راهنمایی,X,čerâġ-e râhnamâyi,X,چراغ راهنمایی قرمز شد.,The traffic light turned red.,
train,A2,noun,قطار,X,ġatâr,X,من با قطار به تهران می‌روم.,I go to Tehran by train.,
translation,A2,noun,ترجمه,X,tarjome,X,من ترجمه فارسی را دوست دارم.,I like the Persian translation.,
transliteration,B2,noun,نویسه‌گردانی,X,nevise-gardâni,X,برای این پروژه، نویسه‌گردانیِ نام‌ها باید یکسان باشد تا خواننده گیج نشود.,"For this project, the transliteration of names has to be consistent so the reader doesn’t get confused.",
travel,A1,verb,سفر کردن,X,safar kardan,,,,
tree,A1,noun,درخت,X,deraxt,X,درخت سبز است.,The tree is green.,
try,B1,verb,کوشش کردن,X,kôšeš kardan,X,برای پیدا کردن کار، کوشش کردم و ناامید نشدم.,I tried to find a job and I didn’t give up.,
try,B1,verb,کوشیدن,X,kušidan,X,او خیلی کوشید تا دیر نکند.,He tried hard not to be late.,
Tuesday,A1,noun,سه‌شنبه,X,se-šanbe,X,سه‌شنبه من به سینما می‌روم.,On Tuesday I go to the cinema.,
Turkey,A1,noun,ترکیه,X,torkiye,X,ترکیه یک کشور است.,Turkey is a country.,
TV,A1,noun,تی‌وی,X,ti-vi,X,تی‌وی روشن است.,The TV is on.,
twelve,A1,numeral,دوازده,X,davâzdah,X,من دوازده سالم است.,I am twelve years old.,
twentieth,A2,adjective,بیستم,X,bistom,X,امروز بیستم ماه است.,Today is the twentieth of the month.,
twenty,A1,numeral,بیست,X,bist,X,من بیست سالم است.,I am twenty years old.,
two,A1,numeral,دو,X,do,X,من دو دوست دارم.,I have two friends.,
ugly,A2,adjective,زشت,X,zešt,X,آن فیلم خیلی زشت بود.,That movie was very ugly.,
Ukraine,A2,noun,اوکراین,X,okrâyn,X,او از اوکراین آمده است.,He came from Ukraine.,
umbrella,A1,noun,چتر,X,čatr,X,چتر من اینجاست.,My umbrella is here.,
"under, underneath, below, beneath",A1,preposition,زیر,X,zir,X,گربه زیر میز است.,The cat is under the table.,
understand,A2,verb,فهمیدن,X,fahmidan,X,من این جمله را نمی‌فهمم.,I don’t understand this sentence.,
unique,B2,adjective,یکتا,X,yektâ,X,هر زبان راه‌های یکتایی برای گفتن احساسات دارد، حتی وقتی معنی‌ها نزدیک‌اند.,"Every language has unique ways of expressing feelings, even when the meanings are close.",
unit,B2,noun,یکا,X,yekâ,X,در فیزیک، هر کمیت را با یک یکا اندازه می‌گیرند تا مقایسه ممکن شود.,"In physics, every quantity is measured with a unit so comparison is possible.",
universe,B2,noun,کیهان,X,keyhân,X,در مستند گفتند که کیهان شاید خیلی بزرگ‌تر از چیزی باشد که ما تصور می‌کنیم.,In the documentary they said the universe might be much bigger than we imagine.,
university,A1,noun,دانشگاه,X,dânešgâh,X,دانشگاه بزرگ است.,The university is big.,
"until, up to",A2,preposition,تا,X,tâ,X,من تا فردا در تهران می‌مانم.,I’m staying in Tehran until tomorrow.,
use,B1,noun,استفاده,X,estefâde,X,از این برنامه استفادهٔ زیادی می‌کنم.,I use this app a lot.,
use,B1,verb,استفاده کردن,X,estefâde kardan,X,من هر روز از مترو استفاده می‌کنم.,I use the metro every day.,
use,B2,verb,به کار بردن,X,be kâr bordan,X,برای توضیح این مفهوم، بهتر است یک مثال ساده به کار ببریم.,"To explain this concept, it’s better to use a simple example.",
user,B1,noun,کاربر,X,kârbar,X,هر کاربر یک نام کاربری و رمز دارد.,Each user has a username and a password.,
"vacation, holiday",A1,noun,تعطیلات,X,ta'tilât,X,تعطیلات خوب است.,The vacation/holiday is good.,
"vase, pot",A2,noun,گلدان,X,goldân,X,یک گلدان روی میز است.,There is a vase on the table.,
vegetable,A2,noun,سبزی,X,sabzi,X,من هر روز سبزی می‌خورم.,I eat vegetables every day.,
vegetables,B1,noun,سبزیجات,X,sabzijât,X,من سعی می‌کنم هر روز سبزیجات بخورم، حتی وقتی وقت کم دارم.,"I try to eat vegetables every day, even when I don’t have much time.",
"very, many",A1,adverb,خیلی,X,xeyli,X,من خیلی خسته‌ام.,I am very tired.,
"via, through, by means of",B1,preposition,از طریق,X,az tariq-e,,,,
violin,A2,noun,ویولن,X,viyolon,X,او ویولن می‌زند.,He plays the violin.,
wait,A2,verb,صبر کردن,X,sabr kardan,X,لطفاً کمی صبر کن.,Please wait a little.,
wake up,A2,verb,بیدار کردن,X,bidâr kardan,X,مادر من مرا بیدار کرد.,My mother woke me up.,
"wake up, awaken",A2,verb,بیدار شدن,X,bidâr šodan,X,من ساعت شش بیدار شدم.,I woke up at six o’clock.,
Wales,B1,noun,ولز,X,velz,X,ولز بخشی از بریتانیا است و طبیعت سبزی دارد.,Wales is part of Britain and has green landscapes.,
walk,A1,verb,راه رفتن,X,râh raftan,X,من هر روز راه می‌روم.,I walk every day.,
"want, will, be going to",A1,verb,خواستن,X,xâstan,X,من آب می‌خواهم.,I want water.,
washing,B1,noun,شستشو,X,šostošu,X,شستشوی لباس‌ها را عصر انجام می‌دهم.,I do the laundry in the afternoon.,
washing machine,B1,noun,ماشین لباس‌شویی,X,mâšin-e lebâs-šuyi,X,ماشین لباس‌شویی خراب شده و باید تعمیرش کنم.,The washing machine is broken and I need to fix it.,
"water, juice",A1,noun,آب,X,âb,X,آب تمیز است.,The water is clean.,
waterfall,B1,noun,آبشار,X,âbšâr,X,آبشار بعد از باران خیلی پرآب شد و صدایش از دور شنیده می‌شد.,"The waterfall got very full after the rain, and its sound could be heard from far away.",
we,A1,pronoun,ما,X,mâ,X,ما اینجا هستیم.,We are here.,
"weather, air",A1,noun,هوا,X,havâ,X,هوا سرد است.,The weather is cold.,
Wednesday,A1,noun,چهارشنبه,X,čahâršanbe,X,چهارشنبه من به مدرسه می‌روم.,On Wednesday I go to school.,
week,A1,noun,هفته,X,hafte,X,یک هفته اینجا هستم.,I have been here for a week.,
welcome,A1,interjection,خوش آمدید,X,xoš âmadid,X,خوش آمدید!,Welcome!,
west,A2,noun,غرب,X,ġarb,X,دوست من در غرب شهر زندگی می‌کند.,My friend lives in the west of the city.,
western,A2,adjective,غربی,X,ġarbi,X,این یک فیلم غربی است.,This is a Western movie.,
what,A1,pronoun,چه,X,če,X,چه روزی است؟,What day is it?,
what,A1,pronoun,چی,X,či,X,چی گفتی؟,What did you say?,
"what is, what's",A1,verb,چیست,X,čist,X,این چیست؟,What is this?,
when,A1,adverb,کی,X,key,X,تو کی می‌آیی؟,When are you coming?,
where,A1,adverb,کجا,X,kojâ,X,تو کجا می‌روی؟,Where are you going?,
white,A1,adjective,سفید,X,sefid,X,دیوار سفید است.,The wall is white.,
who,A1,pronoun,چه کسی,X,če kasi,X,چه کسی اینجاست؟,Who is here?,
who,A1,pronoun,کی,X,ki,X,کی اینجاست؟,Who is here?,
whorehouse,C,noun,جنده‌خانه,X,jende-xâne,X,در اسناد تاریخی، از جنده‌خانه به عنوان بخشی از اقتصاد پنهانِ شهر یاد شده است.,"In historical documents, the brothel is mentioned as part of the city’s underground economy.",
why,A1,adverb,چرا,X,čerâ,X,چرا دیر آمدی؟,Why did you come late?,
wine,A2,noun,شراب,X,šarâb,X,شراب قرمز روی میز است.,There is red wine on the table.,
with,A1,preposition,با,X,bâ,X,من با دوستم می‌آیم.,I’m coming with my friend.,
"woman, wife",A1,noun,زن,X,zan,X,زن در خانه است.,The woman is at home.,
"woman's, womanly, feminine",A2,adjective,زنانه,X,zanâna,X,این کیف زنانه است.,This is a woman's bag.,
wood,A2,noun,چوب,X,čub,X,این میز از چوب است.,This table is made of wood.,
wooden,A2,adjective,چوبی,X,čubi,X,این صندلی چوبی است.,This chair is wooden.,
word,A1,noun,کلمه,X,kalame,X,کلمه جدید را یاد بگیر.,Learn a new word.,
word,A2,noun,لغت,X,loġat,X,این لغت را نمی‌فهمم.,I don’t understand this word.,
work,A1,verb,کار کردن,X,kâr kardan,X,من کار می‌کنم.,I work.,
"work, job",A1,noun,کار,X,kâr,X,او کار کرد.,He worked.,
world,A2,noun,جهان,X,jahân,X,جهان بزرگ و زیباست.,The world is big and beautiful.,
worship,B2,verb,پرستیدن,X,parastidan,X,بعضی‌ها به جای پرستیدن خدا، پول یا قدرت را پرستیدن می‌کنند، بی‌آنکه متوجه باشند.,"Some people, instead of worshipping God, worship money or power without realizing it.",
"wrong, erroneous",A2,adjective,اشتباهی,X,eštebâhi,X,این جواب اشتباهی است.,This answer is wrong.,
"yeah, yes",A1,adverb,آره,X,âre,X,آره، خوب است.,"Yeah, it’s good.",
year,A1,noun,سال,X,sâl,X,من بیست سال دارم.,I am twenty years old.,
"yell, shout, scream, cry",B1,noun,فریاد,X,faryâd,,,,
"yell, shout, scream, cry",B1,verb,فریاد زدن,X,faryâd zadan,,,,
yellow,A1,adjective,زرد,X,zard,X,این ماشین زرد است.,This car is yellow.,
yes,A1,adverb,بله,X,bale,X,بله، مرسی.,"Yes, thanks.",
yesterday,A1,adverb,دیروز,X,diruz,X,دیروز باران آمد.,It rained yesterday.,
yogurt,A1,noun,ماست,X,mâst,X,من ماست می‌خورم.,I eat yogurt.,
"you all, you",A1,pronoun,شما,X,šomâ,X,شما کجا هستید؟,Where are you all?,
"you, you (formal)",B1,pronoun,وی,X,vey,X,وی گفت که فردا دیرتر می‌آید و جلسه را باید عقب بیندازیم.,He said he would come later tomorrow and that we should postpone the meeting.,
"you, you (informal)",A1,pronoun,تو,X,to,X,تو کجا هستی؟,Where are you?,
"you're welcome, please",A1,interjection,خواهش می‌کنم,X,xâheš mi-konam,X,خواهش می‌کنم.,You’re welcome.,
young,A1,adjective,جوان,X,javân,X,او جوان است.,He is young.,
zero,A1,numeral,صفر,X,sefr,X,این عدد صفر است.,This number is zero.,