English,CEFR,gender,word,wordAudio,pronunciation,definition,sentenceAudio,example,sentenceTranslation,To Delete,Duplicate?
water,A1,noun,آب,X,âb,مایعی بی‌رنگ برای نوشیدن و شستن,X,وقتی تشنه‌ام، یک لیوان آب می‌خواهم.,"When I’m thirsty, I want a glass of water.",,
juice,A1,noun,آب میوه,X,âbmive,نوشیدنیِ گرفته‌شده از میوه,X,برای صبحانه یک لیوان آب میوه می‌نوشم.,"For breakfast, I drink a glass of juice.",,
"weather, climate",A2,noun,آب و هوا,X,âb-o-havâ,وضعیتِ بیرون مثل گرما و سرما و باد,X,آب و هوای امروز گرم است.,Today's weather is hot.,,
beer,A2,noun,آبجو,X,âbjow,نوشیدنیِ الکلیِ زرد و گازدار,X,در این رستوران آبجو هم دارند.,They have beer at this restaurant too.,,
waterfall,B1,noun,آبشار,X,âbšâr,آبِ زیاد که از بلندی پایین می‌آید,X,آبشار بعد از باران خیلی پرآب شد و صدایش از دور شنیده می‌شد.,"The waterfall got very full after the rain, and its sound could be heard from far away.",,
"lemon juice, lemonade",A2,noun,آبلیمو,X,âblimu,مایعِ ترش که از لیمو می‌گیرند,X,من صبح‌ها کمی آبلیمو در آب می‌ریزم.,In the mornings I pour a little lemon juice into water.,,
"candy, sweets",A2,noun,آبنبات,X,âbnabât,شیرینیِ کوچک و سفت برای خوردن,X,من یک آبنبات در کیفم دارم.,I have a candy in my bag.,,
blue,A1,adjective,آبی,X,âbi,دارای رنگِ آسمان در روز روشن,X,آبی رنگِ آسمان است.,Blue is the color of the sky.,,
atheist,B2,noun,آتئیست,X,âte'ist,کسی که به هیچ دین و خدایی باور ندارد,X,او خودش را آتئیست معرفی می‌کند، اما می‌گوید دربارهٔ باور دیگران قضاوت نمی‌کند.,"He introduces himself as an atheist, but says he doesn’t judge other people’s beliefs.",,
fire,A1,noun,آتش,X,âtaš,شعله و گرمایی که می‌سوزاند,X,برای گرم شدن، آتش روشن می‌کنیم.,"To get warm, we light a fire.",,
"brazier, firepot",C,noun,آتشدان,X,âtašdân,ظرفی برای نگه داشتن آتش,X,آتشدانِ برنجیِ وسطِ حیاط، شب‌ها را روشن و دورهمی را گرم می‌کرد.,The brass brazier in the middle of the yard lit up the nights and warmed the gathering.,,
"wrench, spanner",B1,noun,آچار,X,âčâr,ابزارِ باز و بسته کردن پیچ,X,لوله آب شل شده است و من باید با آچار آن را سفت کنم.,The water pipe is loose and I need to tighten it with a wrench.,,
address,A1,noun,آدرس,X,âdres,نشانیِ خانه یا محل,X,بدون آدرس، بسته به دست تو نمی‌رسد.,"Without an address, the package won’t reach you.",,
person,A1,noun,آدم,X,âdam,انسان,X,آدم حرف می‌زند، اما سگ فقط پارس می‌کند.,"A person talks, but a dog only barks.",,
"quiet, calm",A2,adjective,آرام,X,ârâm,وضعیتی که در آن صدای بلند یا آشفتگی وجود ندارد,X,کتابخانه آن‌قدر آرام بود که صدای ورق خوردن کتاب را می‌شنیدم.,The library was so quiet that I could hear the sound of the book's page turning.,,
"barber, hairdresser, hairstylist",A2,noun,آرایشگر,X,ârâyešgar,کسی که مو را کوتاه می‌کند یا مدل می‌دهد,X,آرایشگر موهای من را کوتاه کرد.,The hairdresser cut my hair.,,
flour,A1,noun,آرد,X,ârd,پودرِ گندم برای پختن,X,آرد را با آب قاطی می‌کنم تا خمیر شود.,I mix flour with water so it becomes dough.,,
elbow,B1,noun,آرنج,X,âranj,مفصل و استخوانِ وسطِ دست که خم می‌شود,X,وقتی داشتم از درِ باریک رد می‌شدم، آرنج من به چارچوب برخورد کرد و استخوان مفصلم به شدت درد گرفت.,"When I was passing through the narrow door, my elbow hit the frame and my joint bone hurt severely.",,
"yeah, yes",A1,adverb,آره,X,âre,بله در گفت‌وگوی غیررسمی,X,او پرسید «می‌آیی؟» و من گفتم «آره».,"He asked, “Are you coming?” and I said, “Yeah.”",,
"free, liberal",A2,adjective,آزاد,X,âzâd,دارای آزادی برای انتخاب و حرف زدن,X,من آزاد هستم.,I am free.,,
freedom,B1,noun,آزادی,X,âzâdi,حالتِ رها بودن و اختیار داشتن,X,مردم برای آزادی گاهی هزینهٔ سنگینی می‌دهند.,People sometimes pay a heavy cost for freedom.,,
easy,A2,adjective,آسان,X,âsân,دارای سختیِ کم,X,این کار آسان است.,This is easy.,,
"elevator, lift",A2,noun,آسانسور,X,âsânsor,وسیله‌ای برقی برای جابه‌جاییِ عمودی در ساختمان,X,پله‌ها خراب است، پس باید با آسانسور به طبقه دهم برویم.,"The stairs are broken, so we must go to the tenth floor by elevator.",,
"ease, convenience",B1,noun,آسانی,X,âsâni,راحت بودنِ انجامِ کار,X,با این برنامه‌ریزی، کارها با آسانی بیشتری پیش می‌رود.,"With this planning, things go more smoothly.",,
sky,A1,noun,آسمان,X,âsmân,فضای بالایِ سرِ ما که در روز آبی دیده می‌شود,X,آسمان آبی است.,The sky is blue.,,
"cook, chef",A2,noun,آشپز,X,âšpaz,کسی که غذا درست می‌کند,X,آشپز در رستوران کار می‌کند.,The cook works in the restaurant.,,
kitchen,B1,noun,آشپزخانه‌ای,X,âšpaz-xâne,اتاقی برای پختنِ غذا,X,برای خانهٔ جدید چند وسیلهٔ آشپزخانه‌ای لازم داریم.,For the new house we need a few kitchen items.,,
Africa,A1,noun,آفریقا,X,âfriġâ,قاره‌ای بزرگ در جنوبِ اروپا,X,آفریقا یک قارهٔ بزرگ است.,Africa is a big continent.,,
South Africa,A2,noun,آفریقای جنوبی,X,âfriqâ-ye jonubi,کشوری در جنوبِ قارهٔ آفریقا,X,آفریقای جنوبی کشور بزرگی است.,South Africa is a big country.,,
August,A1,noun,آگوست,X,âgost,ماهِ هشتمِ سالِ میلادی,X,آگوست ماهِ هشتِ سال است.,August is the eighth month of the year.,,
Germany,A1,noun,آلمان,X,âlmân,کشوری در مرکزِ اروپا,X,آلمان در اروپا است.,Germany is in Europe.,,
German,A1,adjective,آلمانی,X,âlmâni,مربوط به کشورِ آلمان یا زبانِ آن,X,او زبان آلمانی را بلد است.,He knows the German language.,,
pollution,B1,noun,آلودگی,X,âludegi,کثیفیِ هوا یا آب,X,دود کارخانه‌ها باعث افزایش آلودگی هوای شهرهای بزرگ شده است.,The smoke from factories has increased the air pollution in big cities.,,
pollute,B1,verb,آلودن,X,âludan,کثیف کردنِ محیط,X,ما نباید با ریختن زباله، آب رودخانه را بیالاییم (آلوده کنیم).,We shouldn't pollute the river by throwing garbage.,,
ready,A1,adjective,آماده,X,âmâde,آماده برای شروع یا رفتن,X,من آماده‌ام.,I am ready.,,
"come, arrive",A1,verb,آمدن,X,âmadan,رسیدن به یک جا,X,من الان می‌آیم.,I’m coming now.,,
America,A1,noun,آمریکا,X,âmrikâ,کشوری بزرگ در آمریکای شمالی,X,آمریکا یک کشور بزرگ است.,America is a big country.,,
South America,A2,noun,آمریکای جنوبی,X,âmrikâ-ye jonubi,قاره‌ای در جنوبِ آمریکا,X,آمریکای جنوبی هم بزرگ است.,South America is big too.,,
North America,A2,noun,آمریکای شمالی,X,âmrikâ-ye šomâli,قاره‌ای در شمالِ آمریکا,X,آمریکای شمالی بزرگ است.,North America is big.,,
Central America,B1,noun,آمریکای مرکزی,X,âmrikâ-ye markazi,بخشِ میانیِ قارهٔ آمریکا,X,آمریکای مرکزی چند کشور کوچک و گرم دارد.,"Central America has several small, warm countries.",,
education,B1,noun,آموزش,X,âmuzeš,فرآیندِ یاد دادنِ دانش یا مهارتی به دیگران,X,سیستم آموزش در این کشور به گونه‌ای است که دانش‌آموزان علاوه بر تئوری، مهارت‌های عملی را هم یاد می‌گیرند.,The education system in this country is such that students learn practical skills in addition to theory.,,
that,A1,adjective,آن,X,ân,اشاره به چیز یا نفر دور,X,آن صندلی برای مهمان است.,That chair is for guests.,,
there,A1,adverb,آنجا,X,ânjâ,در محل دور از اینجا,X,توالت آنجا، کنار حمام است.,"The toilet is there, next to the bathroom.",,
"so, that",B1,adverb,آن‌قدر,X,ânqadr,به اندازه‌ای که نتیجهٔ مشخصی داشته باشد,X,آن‌قدر خندیدم که چشم‌هایم اشک افتاد.,I laughed so much that my eyes filled with tears.,,
they,A1,pronoun,آن‌ها,X,ân-hâ,ضمیر برای چند نفر یا چند چیز,X,آن‌ها با هم به خانه می‌آیند.,They come home together.,,
"slow, quiet",A2,adjective,آهسته,X,âheste,با سرعتِ کم,X,لطفاً آهسته صحبت کن.,Please speak slowly.,,
iron,A2,noun,آهن,X,âhan,فلزی سفت که زنگ می‌زند,X,این در از آهن است.,This door is made of iron.,,
"song, voice",A2,noun,آواز,X,âvâz,صدای آهنگین با کلمات,X,من آواز او را دوست دارم.,I like his singing.,,
sing,A2,verb,آواز خواندن,X,âvâz xândan,با آهنگ و صدا شعر یا ترانه خواندن,X,او در حمام آواز می‌خواند.,He sings in the bathroom.,,
bring,A2,verb,آوردن,X,âvardan,چیزی را با خود به اینجا رساندن,X,می‌توانی یک لیوان آب برای من بیاوری؟,Can you bring me a glass of water?,,
April,A1,noun,آوریل,X,âvril,ماهِ چهارمِ سالِ میلادی,X,آوریل ماهِ چهار است.,April is the fourth month.,,
avocado,A2,noun,آووکادو,X,âvokâdo,میوهٔ سبز با پوستِ کلفت,X,برای صبحانه آووکادو می‌خورم.,I eat avocado for breakfast.,,
hang,B1,verb,آویزان کردن,X,âvizân kardan,چیزی را از بالا آویزان کردن,X,کت‌ام را پشت در آویزان کردم.,I hung my coat behind the door.,,
ayatollah,B2,noun,آیت‌الله,X,âyato-l-lâh,روحانیِ بلندپایه در تشیع,X,آیت‌الله در پیامش به مسائل فقهی و سیاسی هم‌زمان اشاره کرد.,"In his message, the ayatollah referred to religious and political issues at the same time.",,
future,B1,noun,آینده,X,âyande,زمانی که هنوز نیامده است و بعداً اتفاق می‌افتد,X,هیچ‌کس نمی‌تواند با اطمینان بگوید که در آینده چه اتفاقی می‌افتد، اما می‌توانیم برای آن برنامه‌ریزی کنیم.,"No one can say with certainty what will happen in the future, but we can plan for it.",,
verse,B2,noun,آیه,X,âye,بخش کوتاه از متن قرآن,X,این آیه دربارهٔ بخشش است و در نماز هم زیاد خوانده می‌شود.,This verse is about forgiveness and is also read often in prayer.,,
mirror,A1,noun,آیینه,X,âyine,شیشه‌ای که تصویرِ صورت را نشان می‌دهد,X,آیینه روی دیوارِ حمام است.,The mirror is on the bathroom wall.,,
cloud,A1,noun,ابر,X,abr,توده‌ای سفید یا خاکستری در آسمان,X,ابر جلوی خورشید است.,A cloud is in front of the sun.,,
superpower,B2,noun,ابرقدرت,X,abarqodrat,کشوری با نفوذ سیاسی و نظامی بسیار زیاد,X,وقتی یک ابرقدرت تحریم می‌گذارد، اقتصادِ کشورِ هدف فوراً تحت فشار می‌رود.,"When a superpower imposes sanctions, the target country’s economy immediately comes under pressure.",,
supernova,C,noun,ابرنواختر,X,abar-now-axtar,انفجارِ بسیار درخشانِ پایانِ یک ستاره,X,ابرنواختر گاهی پایانِ یک ستاره است، اما برای اخترشناسی آغازِ داده‌های تازه.,"A supernova is sometimes the end of a star, but for astronomy it is the start of new data.",,
silk,B1,noun,ابریشم,X,"abrišam, abrišom",نخِ طبیعی و گران‌بها,X,این پارچه بسیار نرم و گران‌بها است چون از ابریشم خالص تهیه شده است.,This fabric is very soft and expensive because it is made of pure silk.,,
room,A1,noun,اتاق,X,otâq,بخشی جدا در خانه با دیوار و در,X,در این اتاق یک چراغ هست.,There is a lamp in this room.,,
bedroom,A1,noun,اتاق خواب,X,otâq-e xâb,جایی در خانه برای خوابیدن,X,اتاق خواب جایِ خواب است.,A bedroom is a place for sleeping.,,
living room,A1,noun,اتاق نشیمن,X,otâġ-e nešiman,جایی در خانه برای نشستن و استراحت,X,در اتاق نشیمن یک مبل هست.,There is a sofa in the living room.,,
Austria,A2,noun,اتریش,X,otriš,کشوری در اروپا,X,اتریش در اروپا است.,Austria is in Europe.,,
atom,B2,noun,اتم,X,atom,کوچک‌ترین واحدِ سازندهٔ ماده,X,اتم کوچک‌ترین بخشِ یک عنصر نیست، اما برای فهم بسیاری از پدیده‌ها نقطهٔ شروع خوبی است.,"An atom isn’t the smallest part of an element, but it’s a good starting point for understanding many phenomena.",,
atomic,B2,adjective,اتمی,X,atomi,مربوط به اتم,X,بحث دربارهٔ انرژی اتمی می‌تواند هم علمی باشد و هم سیاسی.,Discussion about nuclear energy can be both scientific and political.,,
bus,A1,noun,اتوبوس,X,otobus,وسیلهٔ نقلیهٔ عمومی برای جابه‌جایی در شهر,X,اتوبوس به اسلو می‌رود.,The bus goes to Oslo.,,
"trace, sign, mark, effect, impact",B2,noun,اثر,X,asar,نتیجه یا پیامدِ یک کار,X,اثرِ این تصمیم تا سال‌ها در زندگیِ مردم می‌ماند.,The impact of this decision will remain in people’s lives for years.,,
stove,A1,noun,اجاق,X,ojâq,دستگاهی که برای پختنِ غذا گرما تولید می‌کند,X,اجاق روشن است.,The stove is on.,,
stove,A2,noun,اجاق‌گاز,X,ojâq-gâz,وسیله‌ی آشپزی که با سوختِ گاز کار می‌کند,X,کتری را روی اجاق‌گاز بگذار تا آب برای چای جوش بیاید.,Put the kettle on the stove so the water boils for tea.,,
respect,B1,noun,احترام,X,ehterâm,رفتارِ مؤدبانه با دیگران,X,احترام گذاشتن به دیگران کار سختی نیست، اما خیلی‌ها یادشان می‌رود.,"Respecting others isn’t hard, but many people forget.",,
respectful,B2,adjective,احترامی,X,ehtarami,نشان‌دهندهٔ احترام,X,در جلسه، با یک لحن احترامی مخالفت کرد تا بحث به دعوا نکشد.,"In the meeting, he disagreed in a respectful tone so the discussion wouldn’t turn into a fight.",,
"feeling, emotion",B1,noun,احساس,X,ehsâs,حالتِ درونیِ دل,X,بعد از آن حرف‌ها یک احساس بد در من ماند.,"After those words, a bad feeling stayed with me.",,
"feel, sense",B1,verb,احساس کردن,X,ehsâs kardan,حس کردنِ یک حالت یا پیام,X,وقتی وارد اتاق شدم، احساس کردم که همه به من نگاه می‌کنند.,"When I entered the room, I felt that everyone was looking at me.",,
idiotic,B1,adjective,احمق,X,ahmaġ,بسیار نادان و بی‌فکر,X,این تصمیم احمق بود و همه را به دردسر انداخت.,This decision was stupid and got everyone into trouble.,,
idiot,B1,noun,احمق,X,ahmaġ,شخصِ بسیار نادان,X,به او نگفت احمق، فقط گفت باید بیشتر فکر کنی.,"He didn’t call him an idiot, he just said you should think more.",,
star,B2,noun,اختر,X,axtar,ستاره,X,در شعر قدیمی، «اختر» نمادِ امید در شب‌های تاریک است.,"In old poetry, a star is a symbol of hope in dark nights.",,
post office,A1,noun,اداره پست,X,edâre-ye post,جایی برای فرستادن و گرفتن نامه و بسته,X,بسته را به اداره پست می‌برم.,I take the package to the post office.,,
duck,A2,noun,اردک,X,ordak,پرنده‌ای که شنا می‌کند,X,در پارک یک اردک دیدم.,I saw a duck in the park.,,
"cheap, inexpensive",A2,adjective,ارزان,X,arzân,ارزشِ کم و قیمتِ پایین,X,این مغازه ارزان است.,This shop is cheap.,,
Europe,A1,noun,اروپا,X,orupâ,قاره‌ای در غربِ آسیا,X,اروپا یک قاره است.,Europe is a continent.,,
European,A2,adjective,اروپایی,X,orupâyi,مربوط به اروپا,X,او یک شهروند اروپایی است.,He is a European citizen.,,
"from, of",A1,preposition,از,X,az,حرف اضافه برای نشان دادن مبدأ یا جدا شدن,X,من از تهران می‌آیم.,I’m coming from Tehran.,,
"through, via, by means of",B1,preposition,از طریق,X,az tariq-e,حرفِ اضافه برای نشان دادنِ مسیر یا راه,X,از طریق اینترنت می‌توانی فرم را پر کنی و بفرستی.,Through the internet you can fill out the form and send it.,,
horse,A2,noun,اسب,X,asb,حیوانی بزرگ برای سواری,X,اسب سفید سریع می‌دود.,The white horse runs fast.,,
toy,A1,noun,اسباب بازی,X,asbâb bâzi,چیزی برای سرگرمیِ کودک,X,این اسباب بازی وقتی دکمه‌اش را می‌زنم صدا می‌دهد.,This toy makes a sound when I press its button.,,
Spain,A1,noun,اسپانیا,X,espâniyâ,کشوری در جنوبِ اروپا,X,اسپانیا در اروپا است.,Spain is in Europe.,,
Spanish,A1,adjective,اسپانیایی,X,espâniyâyi,مربوط به کشورِ اسپانیا یا زبانِ آن,X,او اسپانیایی است و اسپانیایی حرف می‌زند.,He is Spanish and speaks Spanish.,,
"employment, hiring",B2,noun,استخدام,X,estexdâm,فرآیندِ پذیرشِ نیرو در یک سازمان,X,فرآیند استخدام در این سازمان دولتی بسیار پیچیده است.,The recruitment process in this government organization is very complicated.,,
"pool, swimming pool",A2,noun,استخر,X,estaxr,جایی پر از آب برای شنا,X,تابستان‌ها به استخر می‌روم.,In summer I go to the pool.,,
bone,A2,noun,استخوان,X,ostoxân,چیزی سفت در بدن که بدن را نگه می‌دارد,X,سگ یک استخوان پیدا کرد.,The dog found a bone.,,
relaxation,A2,noun,استراحت,X,esterâhat,زمان برای آرام شدن و خوابیدن,X,بعد از کار به استراحت نیاز دارم.,"After work, I need to rest.",,
rest,A2,verb,استراحت کردن,X,esterâhat kardan,کمی خوابیدن یا آرام بودن برای بهتر شدن,X,امروز کمی استراحت می‌کنم.,Today I rest a little.,,
use,B1,noun,استفاده,X,estefâde,به کار بردنِ یک چیز برای هدف,X,از این برنامه استفادهٔ زیادی می‌کنم.,I use this app a lot.,,
use,B1,verb,استفاده کردن,X,estefâde kardan,به کار بردنِ یک چیز برای هدف,X,من هر روز از مترو استفاده می‌کنم.,I use the metro every day.,,
Estonian,B2,adjective,استونیایی,X,estuniyâyi,مربوط به استونی,X,من با چند همکار استونیایی کار کرده‌ام و از نظم و دقتشان در پروژه‌ها خوشم می‌آید.,"I have worked with a few Estonian colleagues, and I like their orderliness and precision in projects.",,
myth,B2,noun,اسطوره,X,osture,داستان کهنِ خیالی که نسل‌به‌نسل نقل می‌شود,X,آن داستان برای مردم اسطوره شد، چون نسل‌به‌نسل تعریفش کردند.,That story became a myth for people because it was told generation after generation.,,
mythology,C,noun,اسطوره‌شناسی,X,osture-šenâsi,مطالعهٔ روایت‌های کهن و نمادهای فرهنگی,X,اسطوره‌شناسی مرزِ خیال و تاریخ را نشان می‌دهد، نه این‌که یکی را حذف کند.,"Mythology shows the boundary between imagination and history, not that it removes one.",,
spinach,A2,noun,اسفناج,X,esfenâj,سبزیِ سبز که در غذا می‌پزند,X,من امروز اسفناج می‌خورم.,Today I eat spinach.,,
sponge,A2,noun,اسفنج,X,esfanj,وسیله‌ای نرم برای شستن,X,من با یک اسفنج خیس، ظرف‌های کثیف را تمیز می‌کنم.,I am cleaning the dirty dishes with a wet sponge.,,
Scotland,A2,noun,اسکاتلند,X,eskâtland,کشوری در شمالِ بریتانیا,X,اسکاتلند جای قشنگی است.,Scotland is a pretty place.,,
Scandinavia,B1,noun,اسکاندیناوی,X,eskândinâvi,منطقه‌ای در شمالِ اروپا,X,اسکاندیناوی برای طبیعت و زمستان‌های طولانی‌اش معروف است.,Scandinavia is known for its nature and its long winters.,,
skeleton,B2,noun,اسکلت,X,eskelet,مجموعه‌ی استخوان‌های بدن,X,در آزمایشگاه زیست‌شناسی، یک اسکلت کامل انسان برای مطالعه استخوان‌ها وجود دارد.,"In the biology laboratory, there is a complete human skeleton for bone study.",,
ski,A2,noun,اسکی,X,eski,ورزشِ روی برف با کفشِ مخصوص,X,من در زمستان اسکی دوست دارم.,In winter I like skiing.,,
ski,A2,verb,اسکی کردن,X,eski kardan,روی برف با کفشِ مخصوص حرکت کردن,X,آخر هفته با دوستانم اسکی می‌کنم.,On the weekend I ski with my friends.,,
Islam,A2,noun,اسلام,X,eslâm,دینِ پیامبرِ محمد,X,اسلام دین بزرگی است.,Islam is a great religion.,,
Islamist,C,noun,اسلام‌گرا,X,eslâm-garâ,کسی که ایدئولوژی سیاسیِ دینی را دنبال می‌کند,X,اسلام‌گرا در این گزارش فقط یک برچسب سیاسی نیست؛ به شبکه و برنامه هم اشاره دارد.,"In this report, Islamist is not just a political label, it also refers to a network and a plan.",,
Islamism,C,noun,اسلام‌گرایی,X,eslâm-garâyi,ایدئولوژی سیاسی مبتنی بر دین,X,اسلام‌گرایی در این متن به‌عنوان ایدئولوژیِ دولت‌ساز تعریف شده است، نه صرفاً دینداری.,"In this text, Islamism is defined as a state-building ideology, not merely religiosity.",,
Islamic,B1,adjective,اسلامی,X,eslâmi,مربوط به دینِ اسلام,X,او معماری اسلامی را دوست دارد و هر بار به مسجد نگاه می‌کند، جزئیات تازه‌ای می‌بیند.,"He likes Islamic architecture, and every time he looks at the mosque, he notices new details.",,
Oslo,A1,noun,اسلو,X,oslo,پایتختِ نروژ,X,من در اسلو زندگی می‌کنم.,I live in Oslo.,,
name,A2,noun,اسم,X,esm,کلمه‌ای که به یک نفر می‌گویند,X,اسم او رضا است.,His name is Reza.,,
sign,B1,noun,اشاره,X,ešâre,علامت یا حرکت برای رساندنِ پیام,X,با یک اشاره فهمیدم که باید ساکت بمانم.,"With a single gesture, I understood that I needed to stay quiet.",,
point,B1,verb,اشاره کردن,X,ešâre kardan,با دست یا نگاه جهت را نشان دادن,X,او به نقشه اشاره کرد تا مسیر را نشان بدهد.,He pointed at the map to show the route.,,
"mistake, fault, error",A2,noun,اشتباه,X,eštebâh,کارِ غلط که نتیجهٔ بد می‌دهد,X,من یک اشتباه کوچک کردم.,I made a small mistake.,,
"wrong, erroneous",A2,adjective,اشتباهی,X,eštebâhi,دارای خطا و درست نبودن,X,این جواب اشتباهی است.,This answer is wrong.,,
tear,B1,noun,اشک,X,ašk,مایعِ شوری که هنگامِ غم یا شوق از چشم می‌آید,X,او آن‌قدر غمگین بود که وقتی نامه را خواند، یک قطره اشک از گوشه چشمش روی کاغذ افتاد.,"He was so sad that when he read the letter, a drop of tear fell from the corner of his eye onto the paper.",,
information,A2,noun,اطلاعات,X,ettelâ'ât,چیزهایی که دربارهٔ یک موضوع می‌دانیم,X,من به اطلاعات بیشتر نیاز دارم.,I need more information.,,
